Northwards Housing Ltd,S.11001
Norton Housing and Support Ltd,S.11001
Norwich Airport Ltd,S.11001
Norwich City Council,S.1313
Norwich Consolidated Charities,S.11001
Norwich Housing Society Limited,S.11001
Norwich Port,S.1313
Notting Dale Housing Co-operative Limited,S.11001
Notting Hill Home Ownership Limited,S.11001
Notting Hill Housing Trust,S.11001
Nottingham City Council,S.1313
Nottingham City Homes Ltd,S.11001
Nottingham City Transport Co Ltd,S.11001
Nottingham Community (Second) Housing Association Limited,S.11001
Nottingham Community Housing Association Limited,S.11001
Nottinghamshire County Council,S.1313
Nottinghamshire YMCA,S.11001
NPL Management Limited,S.11001
NPT Homes Ltd,S.11001
NS&I,S.1311
NSAH (Alliance Homes) Limited,S.11001
Nuclear Decommissioning Authority,S.1311
Nuclear Flask Hire Limited (s. BNG / BNFL),S.11001
Nuclear Generation Decommissioning Fund Ltd,S.11001
Nuclear Liabilities Fund Trust Company,S.1311
Nuclear Powered Warships Safety Committee,S.1311
Nuclear Research Advisory Council,S.1311
Nuclear Transport Limited (s. BNG / BNFL),S.11001
Nuclear Weapons Safety Committee,S.1311
Nuneaton and Bedworth Borough Council,S.1313
Nuneaton and Bedworth Leisure Trust,S.1313
Nursery Channel Ltd. (S - S4C) (The),S.11001
"Nurses', Midwives' and other NHS Professions Review Body",S.1311
"Nurses, Midwives, Health Visitors and Professions Allied to Medicine Pay Review Body",S.1311
"Nursing and Midwifery Council, The",S.1311
Oadby and Wigston District Council,S.1313
Oak Foundation,S.11001
Oak Housing Limited,S.11001
Oak Tree Housing Association Ltd,S.11001
Oakapple Housing Co-operative Limited,S.11001
Oast Wood Housing Co-operative Limited,S.11001
Oban Port,S.1313
OBRIC Publications Ltd - (s LDDC),S.11001
Occupational Pensions Board,S.1311
Occupational Pensions Regulatory Authority (OPRA),S.1311
Ocean Housing Group Limited,S.11001
Ocean Housing Limited,S.11001
Ochil View Housing Association Ltd,S.11001
Ockley Housing Association Limited,S.11001
Octavia Housing,S.11001
Odu-Dua Housing Association Limited,S.11001
Office for Budget Responsibility,S.1311
Office for Fair Access,S.1311
Office for Judicial Complaints,S.1311
Office for Legal Complaints,S.1311
Office for National Statistics,S.1311
Office for Nuclear Regulation (ONR),S.11001
Office for Standard in Education children's Services and Skills (Ofsted),S.1311
Office for the Regulation of Electricity and Gas (OFREG) (Northern Ireland),S.1311
Office of Communications (Ofcom),S.1311
Office of Electricity Regulation,S.1311
Office of Fair Trading,S.1311
Office of Gas and Electricity Markets (OFGEM),S.1311
Office of Gas Supply,S.1311
Office of Government Commerce,S.1311
Office of Health Professionals Adjudicators,S.1311
Office of Her Majesty’s Chief Inspector of Education and Training in Wales (Estyn),S.1311
Office of Her Majesty's Chief Inspector of Schools in England,S.1311
Office of Passenger Rail Franchising,S.1311
Office of Public Service,S.1311
Office of Public Services and Science (OPSS),S.1311
Office of Qualifications and Examinations Regulator (Ofqual),S.1311
Office of Rail Regulation (ORR),S.1311
Office of Surveillance Commissioners,S.1311
Office of Telecommunications (OFTEL),S.1311
Office of the Adjudicator - Broadcast Transmission Services,S.1311
Office of the Chief Investigating Officer (Scotland),S.1311
Office of the Children's Commissioner,S.1311
Office of the Commissioner for Public Appointments,S.1311
Office of the Commissioner for Public Appointments in Scotland,S.1311
Office of the Data Protection Commissioner,S.1311
Office of the Data Protection Registrar,S.1311
Office of the Deputy Prime Minister (ODPM),S.1311
Office of the Immigration Services Commissioner,S.1311
Office of the Information Commissioner,S.1311
Office of the Northern Ireland Commissioner for Administration,S.1311
Office of the Northern Ireland Commissioner for Complaints,S.1311
Office of the Parliamentary Commissioner and Health Service Commissioners,S.1311
Office of the Paymaster General,S.1311
Office of the Rail Regulator and International Rail Regulator (ORR),S.1311
Office of the Scottish Charity Regulator (OSCR),S.1311
Office of the Scottish Parliamentary Standards Commissioner,S.1311
Office of the Secretary of State for Wales,S.1311
Office of Water Services (OFWAT),S.1311
Offshore Energy Technology Board,S.1311
Offshore Industry Liaison Committee,S.1311
OFWAT National Customer Council,S.1311
OGC buying.solutions,S.11001
Ogilvie Charities (The),S.11001
Oil and Gas Projects and Supplies Office Board,S.1311
Oil and Pipelines Agency,S.11001
Old Ben Homes (The),S.11001
Old Cleeve Memorial Cottages,S.11001
Old Etonian Housing Association Limited (The),S.11001
Old Farm Park Housing Co-operative Limited,S.11001
Old Ford Housing Association Limited,S.11001
Old Isleworth Housing Co-operative Limited,S.11001
Old Oak Housing Association Ltd,S.11001
"Oldham Coliseum Theatre Ltd, The",S.1313
Oldham Economic Development Association Ltd,S.1313
Oldham Metropolitan Borough Council,S.1313
Olympic Delivery Authority,S.1311
Olympic Lottery Distributor,S.1311
Olympic Park Legacy Company,S.1313
Omega Housing Limited,S.11001
One Housing Group Limited,S.11001
One Manchester Limited,S.11001
One NorthEast,S.1311
One Vision Housing Limited,S.11001
One YMCA,S.11001
Ongo Homes Limited,S.11001
Onslow Almshouses (The),S.11001
Onward Homes Limited,S.11001
Optima Community Association,S.11001
Orbit Group Limited,S.11001
Orbit South Housing Association Limited,S.11001
Orchard & Shipman Homes Limited,S.11001
Orchard Homes,S.11001
Orchard Housing Society Limited,S.11001
Ordnance Survey,S.11001
Ordnance Survey of Northern Ireland,S.1311
Ore Valley Housing Association Ltd,S.11001
Orford Town Trustees,S.11001
Oriel Housing Limited,S.11001
Origin Housing 2 Limited,S.11001
Origin Housing Limited,S.11001
Orkney Harbour Commissioners,S.1313
Orkney Housing Association Ltd,S.11001
Orkney Islands Council,S.1313
Orts Road Housing Co-operative Limited,S.11001
Orwell Housing Association Limited,S.11001
Osel Enterprises Ltd,S.1313
Osprey Housing Ltd,S.11001
Osprey Housing Moray,S.11001
Otto Schiff Housing Association,S.11001
Overseas Project Board,S.1311
Overseas Service Pensions Scheme Advisory Board,S.1311
Oxfield Housing Co-operative Association Limited,S.11001
Oxford City Council,S.1313
Oxfordshire County Council,S.1313
"Oxted, Limpsfield & District Housing Association Limited",S.11001
Pacific Nuclear Transport Limited (s. BNG / BNFL),S.11001
Paddock Housing Co-operative Limited,S.11001
Padley Housing Association Limited,S.11001
Paignton Port,S.1313
Paisley Housing Association Ltd,S.11001
Palm Housing Co-operative Limited,S.11001
Pan African Refugee Housing Co-operative Limited,S.11001
Papa Westray Aerodrome,S.1313
Papworth Trust (The),S.11001
Parades Commission,S.1311
Paradigm Homes Charitable Housing Association Limited,S.11001
Paradigm Housing Group Limited,S.11001
Paradise Housing Co-operative Limited,S.11001
Paragon Asra Housing Limited,S.11001
Paragon Community Housing Limited,S.11001
Paragon Housing Association Ltd,S.11001
Parcelforce Worldwide - (s C),S.11001
Parish Councils (England),S.1313
Parish Houses Charity,S.11001
Park Hill Housing Co-operative Limited,S.11001
Parkhead Housing Association Ltd,S.11001
Parkway Green Housing Trust,S.11001
Parliamentary and Health Service Ombudsman,S.1311
Parliamentary Boundary Commission for England,S.1311
Parliamentary Boundary Commission for Wales,S.1311
Parole Board for England and Wales,S.1311
Parole Board for Scotland,S.1311
Parson Latham's Hospital In Barnwell,S.11001
Partick Housing Association Ltd,S.11001
Particle Physics and Astronomy Research Council (PPARC),S.1311
Partners Foundation Limited,S.11001
Partnership Fund Assessment Panel,S.1311
Partnerships for Church of England Schools,S.1311
Partnerships for Schools,S.1311
Partnerships UK,S.11001
PAS Housing Association,S.11001
Passage Housing Services,S.11001
Passenger Transport Authorities (En Bloc),S.1313
Passenger Transport Executive Group Ltd (PTEG Ltd),S.1311
Passenger Transport Executives (PTE),S.1313
Patent Office (t/a The UK Intellectual Property Office),S.11001
Pathways Jubilee Charity (The),S.11001
Patient Client Council,S.1311
Patient Client Council (Northern Ireland),S.1311
Peabody Enterprises Limited,S.11001
Peabody Trust,S.11001
Peace Cottages Charity,S.11001
Peacehaven and Telscombe Housing Association Ltd,S.11001
Peak District National Park Authority,S.1313
Peak District Rural Housing Association Limited,S.11001
Peak Valley Housing Association Limited,S.11001
Pearman Street Co-operative Limited,S.11001
Pearson's & St Elizabeth's Cottage Homes,S.11001
Peel Street Housing Co-operative Limited,S.11001
Pembrokeshire Coast National Park Authority,S.1313
Pembrokeshire County Council,S.1313
Pembrokeshire Housing Association Ltd,S.11001
Pendle Borough Council,S.1313
Pendleton Improved Housing Association Limited,S.11001
Penge Churches Housing Association Limited,S.11001
Penn and Widow Smith Almshouses,S.11001
Pennaf Ltd,S.11001
Pennan Harbour,S.11001
Pennant Homes,S.11001
Penryn Port,S.1313
Pension Protection Fund,S.12801
"Pension, Disability and Carers Service",S.1311
"Pensions Advisory Service, The",S.1311
Pensions Appeal Tribunal,S.1311
Pensions Appeal Tribunal for Scotland,S.1311
Pensions Compensation Board,S.1311
"Pensions Ombudsman, The",S.1311
"Pensions Regulator, The",S.1311
Pentland Housing Association Ltd,S.11001
Penzance Port,S.1313
People and Arts (Latin Am) LLC [USA] (50%) (sBBCW) (Associate),S.11001
People First Housing Association Limited,S.11001
"People, Pay and Pensions Agency",S.1311
People's Panel Advisory Group,S.1311
Perry Almshouses,S.11001
Perryview Housing Co-operative Limited,S.11001
Personal Accounts Delivery Authority,S.1311
Persons Hearing Consumer Credit Licensing Appeals,S.1311
Persons Hearing Estate Agents Appeal,S.1311
Perth and Kinross Council,S.1313
Perth Port,S.1313
Pesticides Residue Committee,S.1311
Peter Bedford Housing Association Limited,S.11001
Peter Birtwistle Trust,S.11001
Peterborough - (s NTC),S.1311
Peterborough City Council,S.1313
Peterhead Port,S.11001
Peterlee - (s NTC),S.1311
PHA Homes,S.11001
Pharmacists’ Review Panel,S.1311
Phillips Port (Caithness),S.1313
Phoenix Community Housing Association (Bellingham and Downham) Limited,S.11001
Phoenix Community Housing Co-operative Limited,S.11001
Phoenix House,S.11001
PhonepayPlus,S.1311
Pickering and Ferens Homes,S.11001
Pierhead Housing Association Limited,S.11001
Pig Production Development Committee,S.1311
Pilgrim Homes,S.11001
Pine Court Housing Association Limited,S.11001
Pine Ridge Housing Association Limited,S.11001
Pine Tree Housing Co-operative Limited,S.11001
Pineview Housing Association Ltd,S.11001
Pinnacle Spaces Limited,S.11001
Pinner House Society Limited,S.11001
Pioneer Co-operative Housing (Redditch) Limited,S.11001
Pioneer Housing and Community Group Limited (The),S.11001
Pirbright Institute,S.1311
Pittenweem Port,S.1313
Place Names Advisory Committee,S.1311
Places for People Group Limited,S.11001
Places for People Homes Limited,S.11001
Places for People Living+ Limited,S.11001
Planning Appeals Commission,S.1311
Planning Inspectorate,S.1311
Planning Service (Northern Ireland),S.1311
Plant Varieties and Seeds Tribunal,S.1311
Platinum Skies Living Limited,S.11001
Plexus UK (First Project) Limited,S.11001
Plumlife Homes Limited,S.11001
Plus Dane (Cheshire) Housing Association Limited,S.11001
Plus Dane (Merseyside) Housing Association Limited,S.11001
Plus Dane Housing Group Limited,S.11001
Plymouth (Roborough) Aerodrome,S.1313
Plymouth Charity Trust,S.11001
Plymouth City Bus Ltd,S.11001
Plymouth City Council,S.1313
Plymouth Community Homes,S.11001
Plymouth Development Corporation,S.11001
Plymouth Marine Laboratory,S.1311
Plymouth Marines Application Ltd,S.11001
Pneumoconiosis Workers Compensation Board,S.1311
Pobl Group ltd,S.11001
Pointsforlife Ltd,S.1311
Poisons Board,S.1311
Poisons Board (Northern Ireland),S.1311
Police Advisory Board for England and Wales,S.1311
Police Advisory Board for Scotland,S.1311
Police and Crime Commissioners (En bloc),S.1313
Police Arbitration Tribunal,S.1311
Police Authorities (En Bloc),S.1313
Police Authority for Northern Ireland,S.1311
Police Complaints Authority,S.1311
Police Discipline Appeals Tribunal,S.1311
Police Forces (En Bloc),S.1313
Police Forces (Scotland) (En Bloc),S.1313
Police Information Technology Organisation (PITO),S.1311
Police Negotiating Board,S.1311
Police Ombudsman for Northern Ireland (Independent Commission for Police Complaints for Northern Ireland),S.1311
Police Rehabilitation and Retraining Trust,S.1311
Police Service of Northern Ireland,S.1311
Police Service of Scotland,S.1311
Policyholders' Protection Board,S.1311
Polish Citizens Committee Housing Association Ltd,S.11001
Polish Housing Society Ltd,S.11001
Polish Retired Persons Housing Association Limited,S.11001
Poole Harbour Commissioners,S.11001
Poole Housing Partnership Ltd,S.11001
Poole Old Peoples Welfare and Housing Society Limited,S.11001
Poplar HARCA Limited,S.11001
Port Isaac,S.11001
Port Nahaven (Islay),S.1313
Port of Leith Housing Association Ltd,S.11001
Port of London Authority,S.11001
Port of Tyne Authority,S.11001
Port Seton Harbour,S.11001
Portal Housing Association Limited,S.11001
Porthove Housing Association Limited,S.11001
Portman House,S.11001
Portobello Housing Co-operative Limited,S.11001
Portree (Port),S.1313
Portsmouth Churches Housing Association Limited,S.11001
Portsmouth City Council,S.1313
Portsmouth Port,S.1313
Portsmouth Rotary Housing Association Limited,S.11001
Positive Lifestyles Ltd,S.1313
Post Office Limited,S.11001
Post Office Users' Council for Northern Ireland,S.1311
Post Office Users' Council for Scotland,S.1311
Post Office Users' Council for Wales,S.1311
Post Office Users' National Council,S.1311
Post Qualification Education Board for Health Science Pharmacists in Scotland,S.1311
Postal Services Commission,S.1311
Postal Services Holding Company Plc,S.11001
Postal Services Holding Company Plc.,S.1311
PostCap (Guernsey) Ltd. (Guernsey) - (s C),S.11001
Potato Council Ltd,S.1311
Potato Industry Development Council,S.1311
Potteries Box Company Ltd - (s Remploy Ltd) (The),S.11001
Powell and Welch Almshouse Charity (The),S.11001
Powys County Council,S.1313
Powys Teaching Health Board,S.1311
Poynton-with-Worth Almshouse Charity (The),S.11001
PPP Arbiter,S.1313
Prescription Pricing Authority,S.1311
Preston City Council,S.1313
Prestwich & North Western Housing Association Ltd,S.11001
Prestwick Airport Infrastructure Limited,S.11001
Prestwick Airport Limited,S.11001
Prestwick Airport Property Limited,S.11001
Prestwick Aviation Holdings Limited,S.1311
Primary Care Trusts (En Bloc),S.1311
Prime Focus Regeneration Group Limited,S.11001
Prince Albert Gardens Housing Co-operative Limited,S.11001
Princes Park Housing Co-operative Limited (The),S.11001
Priority Sites Ltd,S.11001
Privy Council Office,S.1311
Probation Board for Northern Ireland,S.1311
Probation Trusts,S.1311
Proffitts - Investing in Communities Community Interest Company,S.11001
Progress Care Housing Association Limited,S.11001
Progress Housing Group Limited,S.11001
Project 34,S.11001
Property Advisors to the Civil Estate (PACE),S.1311
Property Advisory Group,S.1311
Prospect Community Housing,S.11001
Prospect Housing Limited,S.11001
Proteus Theatre Co Ltd,S.1313
Proudman Oceanographic Laboratory,S.1311
Provanhall Housing Association Ltd,S.11001
Providence Row Housing Association,S.11001
Prudential Regulation Authority,S.12601
Public Guardian Board,S.1311
Public Guardianship Office,S.1311
Public Health England,S.1311
Public Health Laboratory Service Board,S.1311
Public Health Wales NHS Trust,S.1311
Public Lending Right and the Public Lending Right Advisory Committee,S.1311
Public Private Partnerships Programme Ltd (4ps),S.1313
Public Prosecution Service for Northern Ireland,S.1311
Public Record Office,S.1311
Public Records Office of Northern Ireland,S.1311
Public Service Commission,S.1311
Public Service Training Council Northern Ireland,S.1311
Public Services Ombudsman for Wales,S.1311
Public Services Productivity Panel Unit,S.1311
Public Trust Office,S.1311
Purbeck District Council,S.1313
Purlin Housing Co-operative Limited,S.11001
Puttenham & Wanborough Housing Society Limited,S.11001
QinetiQ,S.11001
Quadrant-Brownswood Tenant Co-operative Limited,S.11001
Qualifications and Curriculum Development Agency,S.1311
"Qualifications, Curriculum and Assessment Authority for Wales",S.1311
Quality Meat Scotland,S.1311
Quality Space (Stirling) Ltd,S.1313
Queen Elizabeth II Conference Centre,S.11001
Queen Victoria School,S.1311
Queen Victoria School (Charity),S.1311
Queens Cross Housing Association Ltd,S.11001
Quo Vadis Trust,S.11001
Race Education and Employment Forum,S.1311
Race Relations Employment Advisory Group,S.1311
Race Relations Forum,S.1311
Rachel Herbert's Church Parsonage and Almshouse Charities,S.11001
Radcliffe Housing Society Limited,S.11001
Radian Group Limited,S.11001
Radio Authority,S.1311
Radioactive Waste Management Advisory Committee,S.1311
Radioactive Waste Management Limited,S.1311
Radiocommunications Agency,S.1311
RAF Logistics Support Services,S.1311
RAF Maintenance Group Defence Agency,S.1311
RAF Personnel Management Agency,S.1311
RAF Signals Engineering Establishment,S.1311
RAF Training Group Defence Agency,S.1311
Rail for London Ltd,S.11001
Rail Passengers' Committees,S.1311
Rail Passengers' Council,S.1311
Rail Users’ Consultative Committees,S.1311
Railsale Ltd,S.1311
Railway Housing Association and Benefit Fund,S.11001
RAJAR (Radio Joint Audience Research) Ltd (50%) (sBBCW) (Associate),S.11001
Rampton Hospital Authority,S.1311
Ramsey Welfare Charities,S.11001
Ramsgate Port,S.1313
Rate Collection Agency (Northern Ireland),S.1311
Rathgael & White Abbey Schools Management Board,S.1311
Raven Housing Trust Limited,S.11001
Ravenscroft Re-Build Co-operative Limited,S.11001
Rayner House and Yew Trees Limited,S.11001
RCT Homes Ltd,S.11001
RCUK Shared Services Centre Ltd,S.1311
Reach (Supported Living) Limited,S.11001
Reactor Sites Management Company Ltd.,S.11001
Reading Borough Council,S.1313
Reading Transport Ltd,S.11001
Reading YMCA,S.11001
Red Devon Housing Limited,S.11001
Red House Farm Housing Co-operative Limited,S.11001
Red Kite Community Housing Limited,S.11001
Redbridge Homes Ltd,S.11001
Redcar and Cleveland Council,S.1313
Redditch - (s NTC),S.1311
Redditch Borough Council,S.1313
Redditch Community Homes,S.11001
Redditch Co-operative 2000 Limited,S.11001
Redditch Friends Housing Association Limited,S.11001
Redwing Living Limited,S.11001
Redwood Housing Co-operative Limited,S.11001
Reedmonte Ltd,S.1313
Refuge,S.11001
Regenda Limited,S.11001
"Regional Agency for Public Health and Social Well-being (Northern Ireland), The",S.1311
Regional Aggregation Bodies,S.1311
Regional Assemblies (England),S.1313
Regional Business Services Organisation,S.1311
Regional Business Services Organisation (Northern Ireland),S.1311
Regional Flood Defence Committees,S.1311
Regional Health and Social Care Board,S.1311
Regional Health and Social Care Board (Northern Ireland),S.1311
Regional Health Authorities (En Bloc),S.1311
Regional Industrial Development Boards,S.1311
Regional Panels in MAFF,S.1311
Registered Homes Tribunal (Northern Ireland),S.1311
Registered Homes Tribunals,S.1311
Registered Inspectors of Schools Appeals Tribunal,S.1311
Registered Inspectors of Schools Appeals Tribunal (Wales),S.1311
Registered Nursery Education Inspectors Appeals Tribunal,S.1311
Registers of Scotland,S.11001
Registrar of Occupational and Personal Pension Schemes,S.1311
Registrar of the Public Lending Right,S.1311
Registry of Friendly Societies,S.1311
Reidvale Housing Association,S.11001
Reigate and Banstead Borough Council,S.1313
Reigate Quaker Housing Association Limited,S.11001
Renewable Energy Advisory Committee,S.1311
Renewable Fuels Agency,S.1311
Renfrew Port,S.1313
Renfrewshire Council,S.1313
Rent Assessment Panels (Northern Ireland),S.1311
Rent Assessment Panels (RAPS),S.1311
Rent Assessment Panels (Scotland),S.1311
Rent Assessment Panels (Wales),S.1311
Rent Service (The),S.1311
Research Councils (En Bloc),S.1311
Research Sites Restoration Limited,S.1311
Reside Housing Association Limited,S.11001
Residuary Bodies,S.1313
Residuary Body for Wales,S.1311
Resource: The Council for Museums Archives and Libraries,S.1311
Resthaven Almshouses,S.11001
Retail Trust,S.11001
Retirement Lease Housing Association,S.11001
Revenue and Customs Prosecutions Office,S.1311
Revenue Scotland,S.1311
Reverend Rowland Hill Almshouse Charity (The),S.11001
Review Board for Government Contracts,S.1311
Reviewing Committee on the Export of Works of Art,S.1311
Rex Housing Limited,S.11001
Rhondda Cynon Taff County Borough Council,S.1313
Rhondda Housing Association Limited,S.11001
Ribble Valley Borough Council,S.1313
Ribble Valley Homes Limited,S.11001
Richard Whitaker's Almshouses,S.11001
Richmond Avenue Housing Co-operative Limited,S.11001
Richmond Co-operative Housing Association Limited,S.11001
Richmond Fellowship (The),S.11001
Richmond Housing Partnership Limited,S.11001
Richmondshire District Council,S.1313
Rickmansworth Churches Housing Association Limited,S.11001
Ringway Developments Ltd,S.1313
Ringway Handling Limited (s MA),S.11001/3
Ringway Handling Services Ltd (s MA),S.11001/3
Ripon Municipal Charities,S.11001
Ripon YMCA,S.11001
River Clyde Homes,S.11001
River Nith Navigation,S.11001
River Yealm Harbour Authority,S.11001
Rivers Agency (Northern Ireland),S.1311
"Riverside Centre Ltd, The",S.1313
Riverside Group Limited (The),S.11001
Riverside Housing Co-operative (Redditch) Limited,S.11001
Riversmead Housing Association Limited,S.11001
RM Museum Ltd,S.11001
RNM Functions Ltd,S.11001
Roads Service (Northern Ireland),S.1311
Robert Hibbert's Almshouse Charity,S.11001
Robert Salter Charity (The),S.11001
Rochdale Boroughwide Housing Limited,S.11001
Rochdale Metropolitan Borough Council,S.1313
Rochford District Council,S.1313
Rochford Housing Association Limited,S.11001
Rockdale Housing Association Limited,S.11001
Rockingham Forest Housing Association Limited,S.11001
Roddons Housing Association Limited,S.11001
Rogate and Terwick Housing Association Limited,S.11001
Roger Williams & Queen Victoria Memorial Almshouse,S.11001
Roger's Almshouses,S.11001
Rolls Royce PLC,S.11001
Rooftop Homes Limited,S.11001
Rooftop Housing Association Limited,S.11001
Rooftop Housing Group Limited,S.11001
Rosebery Housing Association Limited,S.11001
Rosehearty Harbour,S.11001
Rosehill Housing Co-operative Limited,S.11001
Rosemary Simmons Memorial Housing Association Limited,S.11001
Ross Walk Housing Co-operative Limited,S.11001
Rossendale Borough Council,S.1313
Rossendale Transport Ltd,S.11001
Rotary Club of Dudley Housing Association Limited,S.11001
Rotary House For The Deaf Limited,S.11001
Rother District Council,S.1313
Rotherham Metropolitan Borough Council,S.1313
Routes to Work South,S.1313
Rowett Research Institute,S.1311
Rowland Hill and Vaughan Almshouse Charity,S.11001
Royal Air Force Museum,S.1311
Royal Air Forces Association Housing Limited,S.11001
Royal Armouries Museum,S.1311
Royal Bank of Scotland Group plc,S.12501
Royal Bank of Scotland Group plc Subsidiaries,S.12201
"Royal Bank of Scotland plc, The",S.12201
Royal Borough of Greenwich,S.1313
Royal Borough of Kensington and Chelsea,S.1313
Royal Borough of Kingston upon Thames,S.1313
Royal Borough of Windsor and Maidenhead,S.1313
"Royal Botanic Garden, Edinburgh",S.1311
"Royal Botanic Gardens, Kew",S.1311
Royal Collection Enterprises Ltd,S.11001
Royal Collection Trust,S.11001
Royal Commission on Ancient and Historical Monuments of Scotland,S.1311
Royal Commission on Environmental Pollution,S.1311
Royal Commission on Historical Monuments in England,S.1311
Royal Commission on Long Term Care of the Elderly,S.1311
Royal Commission on the Ancient and Historical Monuments of Wales,S.1311
Royal Docks Management Authority Ltd - (s LDA),S.11001
Royal Fine Art Commission,S.1311
Royal Fine Art Commission for Scotland,S.1311
Royal Hospital Chelsea,S.1311
Royal Household,S.1311
Royal Mail Plc (and subsidiaries),S.11001
Royal Marines Museum,S.1311
Royal Military College of Science Advisory Council (RCMS),S.1311
Royal Mint,S.11001
"Royal Mint Advisory Committee on the Design of Coins, Medals, Seals and Decorations",S.1311
Royal Naval Museum,S.1311
Royal Naval Museum Trading Company Ltd.,S.11001
Royal Naval Submarine Museum,S.1311
Royal Observatory Greenwich,S.1311
Royal Parks Agency,S.1311
Royal Patriotic Fund,S.1311
Royal Ulster Constabulary,S.1311
Royal Ulster Constabulary George Cross Foundation,S.1311
Ruabon Almshouse Charity,S.11001
Ruchazie Housing Association Ltd,S.11001
Rugby Borough Council,S.1313
Runcorn - (s NTC),S.1311
Runnymede Borough Council,S.1313
Rural Development Commission,S.1311
Radias Housing Association,S.11001
Rural Housing Association Ltd,S.11001
Rural Payments Agency,S.1311
Rural Stirling Housing Association Ltd,S.11001
Rushcliffe Borough Council,S.1313
Rushmoor Borough Council,S.1313
Rusland Road Housing Co-operative Limited,S.11001
Russet Homes Limited,S.11001
Rutherglen and Cambuslang Housing,S.11001
Rutland County Council,S.1313
RY Winning Hand Ltd,S.11001
Ryde Port,S.1313
Rye Harbour Commissioners,S.11001
Ryedale District Council,S.1313
Rykneld Homes Limited,S.11001
Rykneld Homes Ltd,S.11001
S.A.D.A.C.C.A. Ltd (Sheffield and District Afro-Caribbean Community Association Ltd),S.1313
S.M.N.E Ltd.,S.11001
S4C Masnachol Cyf - (s S4C),S.11001
S4C Rhyngwladol Cyf. (S - S4C),S.11001
S4C2 Cyf. (S - S4C),S.11001
Sackville College,S.11001
Sadeh Lok Limited,S.11001
Safefood (Food Safety Promotion Board),S.1311
Safer Places,S.11001
Saffron Housing Trust Limited,S.11001
Saint David’s Diocesan Housing Association Ltd,S.11001
Saint Mary Magdalen's Hospital (The),S.11001
Salcombe Port,S.1313
Salford City Council,S.1313
Salisbury City Almshouse and Welfare Charities,S.11001
