name,esa-2010
124 Facilities Ltd - (s C4),S.11001
180 Housing Ltd,S.11001
2010 Rotherham Ltd,S.11001
20-20 Housing Co-operative Limited,S.11001
28a Supported Living Limited,S.11001
3CHA Ltd,S.11001
4 Ventures Ltd,S.11001
700 Club,S.11001
A1 Housing Bassetlaw Ltd,S.11001
A2Dominion Homes Limited,S.11001
A2Dominion Housing Group Limited,S.11001
A2Dominion Housing Options Limited,S.11001
A2Dominion South Limited,S.11001
Abbeyfield (Berkhamsted & Hemel Hempstead) Society Limited (The),S.11001
Abbeyfield (Brecon) Society Ltd,S.11001
Abbeyfield (Chelsea & Fulham) Society Limited (The),S.11001
Abbeyfield (Christ Church) Society Limited (The),S.11001
Abbeyfield (Colyton) Society Limited (The),S.11001
Abbeyfield (Darlington) Society Limited (The),S.11001
Abbeyfield (Lyme Regis & District) Society Ltd (The),S.11001
Abbeyfield (Maidenhead) Society Limited (The),S.11001
Abbeyfield (Norwich) Society Limited (The),S.11001
Abbeyfield (Oxford) Society Limited (The),S.11001
Abbeyfield (Ripon and District) Society Ltd (The),S.11001
Abbeyfield (Southport) Society Limited (The),S.11001
Abbeyfield (Streatham) Society Limited (The),S.11001
Abbeyfield (Wells) Society Limited (The),S.11001
Abbeyfield (Weymouth) Society Limited (The),S.11001
Abbeyfield / SSAFA Hereford Society Limited (The),S.11001
Abbeyfield Abbots Langley Society Limited (The),S.11001
Abbeyfield Alresford and District Society Ltd (The),S.11001
Abbeyfield and Wesley Housing Association,S.11001
Abbeyfield Bangor / UCNW Society Ltd,S.11001
Abbeyfield Barrow-in- Furness Society Limited (The),S.11001
Abbeyfield Basildon Society Limited (The),S.11001
Abbeyfield Berwick Society Limited (The),S.11001
Abbeyfield Billericay Society Limited (The),S.11001
Abbeyfield Bishop's Castle & District Society Limited (The),S.11001
Abbeyfield Bishops Stortford Society Limited (The),S.11001
Abbeyfield Blackcombe Society Limited (The),S.11001
Abbeyfield Blackmore Vale Society Limited (The),S.11001
Abbeyfield Bognor Regis Society Limited (The),S.11001
Abbeyfield Borough of Conway Society Limited,S.11001
Abbeyfield Bradford Society Limited (The),S.11001
Abbeyfield Bradford-on-Avon Society Limited (The),S.11001
"Abbeyfield Braintree, Bocking and Felsted Society Limited",S.11001
Abbeyfield Bristol and Keynsham Society,S.11001
Abbeyfield Bromley Society Limited (The),S.11001
Abbeyfield Buckland Monachorum Society Limited (The),S.11001
Abbeyfield Burnham and Highbridge Society Ltd (The),S.11001
Abbeyfield Burnley Society Limited (The),S.11001
Abbeyfield Bury Society Limited (The),S.11001
Abbeyfield Camborne Society Ltd (The),S.11001
Abbeyfield Canvey Island Society Limited (The),S.11001
Abbeyfield Chalfonts Society Limited (The),S.11001
Abbeyfield Chester Society Limited,S.11001
Abbeyfield Cirencester Society Limited,S.11001
Abbeyfield Colwyn Bay Society Ltd,S.11001
Abbeyfield Crowborough Society Limited (The),S.11001
Abbeyfield Deben Extra Care Society Limited (The),S.11001
Abbeyfield Deptford Society Limited (The),S.11001
Abbeyfield Dorcas Society Limited (The),S.11001
Abbeyfield Dulwich Society Limited (The),S.11001
Abbeyfield East London Extra Care Society Ltd (The),S.11001
Abbeyfield Ellesmere Port Society Limited (The),S.11001
Abbeyfield Fareham Society Limited (The),S.11001
Abbeyfield Ferring Society Limited (The),S.11001
Abbeyfield Fflint,S.11001
Abbeyfield Furness Extra Care Society Limited (The),S.11001
Abbeyfield Gerrards Cross Society Limited (The),S.11001
Abbeyfield Gloucestershire Society Limited (The),S.11001
Abbeyfield Great Missenden & District Society (The),S.11001
"Abbeyfield Grimsby, Cleethorpes and District Society Limited",S.11001
Abbeyfield Groombridge Society Limited (The),S.11001
Abbeyfield Guildford Society Limited (The),S.11001
Abbeyfield Hertfordshire Residential Care Society,S.11001
Abbeyfield Holsworthy Society Limited (The),S.11001
Abbeyfield Hoylake and West Kirby Society Ltd (The),S.11001
Abbeyfield Ilkley Society Limited (The),S.11001
Abbeyfield Kent Society (The),S.11001
Abbeyfield Kings Langley Society Limited (The),S.11001
Abbeyfield Lancashire Extra Care Society Ltd (The),S.11001
Abbeyfield Lancaster Society Limited (The),S.11001
Abbeyfield Liskeard Society Limited (The),S.11001
Abbeyfield Llandeilo Society Ltd,S.11001
Abbeyfield Llandudno Society Ltd,S.11001
Abbeyfield Llanrwst and District Society Ltd,S.11001
Abbeyfield London Polish Society Limited (The),S.11001
Abbeyfield Loughborough Society Limited (The),S.11001
Abbeyfield Nailsworth & District Society Ltd,S.11001
Abbeyfield Newbury Society Limited (The),S.11001
Abbeyfield Newcastle-upon-Tyne Society Ltd (The),S.11001
Abbeyfield North Downs Society Limited (The),S.11001
Abbeyfield North Northumberland Extra Care Society Limited,S.11001
Abbeyfield Northallerton and District Society Ltd,S.11001
Abbeyfield Orwell Extra Care Society Limited (The),S.11001
Abbeyfield Oxenford Society Limited (The),S.11001
Abbeyfield Oxton & Prenton Society Ltd (The),S.11001
Abbeyfield Pirbright and District Society Ltd (The),S.11001
Abbeyfield Porlock Society Limited (The),S.11001
Abbeyfield Prestbury and District Society Ltd,S.11001
Abbeyfield Reading Society Limited (The),S.11001
Abbeyfield Ribble Valley Society Limited (The),S.11001
Abbeyfield Rotherhithe Society Limited (The),S.11001
Abbeyfield Saltash Society Limited (The),S.11001
Abbeyfield Sanderstead Society Limited (The),S.11001
Abbeyfield Scarborough Society Limited (The),S.11001
Abbeyfield Scotland Ltd,S.11001
Abbeyfield Shanklin Society Limited (The),S.11001
Abbeyfield Sidmouth Society Limited (The),S.11001
Abbeyfield Society (The),S.11001
Abbeyfield Sodbury Vale Society Limited (The),S.11001
Abbeyfield Solent Society Limited (The),S.11001
Abbeyfield South Downs Limited,S.11001
Abbeyfield South Molton Society Limited (The),S.11001
Abbeyfield South West Society Limited (The),S.11001
Abbeyfield Southend Society Limited (The),S.11001
Abbeyfield Southern Oaks,S.11001
Abbeyfield Tavistock Society Limited (The),S.11001
Abbeyfield Thirsk & Sowerby Society Limited (The),S.11001
Abbeyfield Tiverton Society Limited (The),S.11001
Abbeyfield Uxbridge Society Limited (The),S.11001
Abbeyfield Wales Society Ltd,S.11001
Abbeyfield Wallasey Society (The),S.11001
Abbeyfield Wessex Society Limited,S.11001
Abbeyfield Wey Valley Society Limited,S.11001
Abbeyfield Whitehaven Society Limited (The),S.11001
Abbeyfield Widnes Society Limited (The),S.11001
Abbeyfield Winchester Society Limited (The),S.11001
Abbeyfield Worcester Society Limited (The),S.11001
Abbeyfield Wrexham Society Ltd,S.11001
Abbeyfield York Society Limited (The),S.11001
Abeona Housing Co-operative Limited,S.11001
Aberdeen City Council,S.1313
Aberdeen Harbour Board,S.11001
Aberdeen Soroptimist Housing Society Ltd,S.11001
Aberdeen Western Peripheral Route (AWPR) Special purpose Vehicles (SPVs),S.1311
Aberdeenshire Council,S.1313
Aberford Almshouses Trust,S.11001
Abertawe Bro Morgannwg University Health Board,S.1311
Abertay Housing Association Ltd,S.11001
ABF The Soldiers Charity,S.1311
Ability Housing Association,S.11001
ABN Amro Bank NV,S.12201
Abronhill Housing Association Ltd,S.11001
Academies (En Bloc),S.1311
Academy Trusts (En Bloc),S.1311
Accent Corporate Services Limited,S.11001
Accent Group Limited,S.11001
Accent Housing Limited,S.11001
Accent Nene Limited,S.11001
Accent Peerless Limited,S.11001
Access Homes Housing Association Limited,S.11001
Acclaim Housing Limited,S.11001
AccommodationYes Limited,S.11001
Accord Housing Association Limited,S.11001
Accountant General of the Senior Courts,S.1311
Accountant General of the Supreme Court,S.1311
Accounts Commission for Scotland,S.1311
Acis Group Limited,S.11001
Action Housing and Support Limited,S.11001
Actis,S.11001
Adactus Housing Association Limited,S.11001
Adactus Housing Group Limited,S.11001
Adam and Company plc,S.12201
Addiscombe Catholic Housing Association Limited,S.11001
Adler Housing,S.11001
Administration of Radioactive Substances Advisory Committee,S.1311
Adullam Homes Housing Association Limited,S.11001
Adult Learning Inspectorate,S.1311
Adur District Council,S.1313
Advance Housing and Support Limited,S.11001
Advantage - West Midlands,S.1311
Adventure Activities Licensing Authority/TQS Ltd,S.1311
Advisory Board on Fair Trading in Telecommunications,S.1311
Advisory Board on Family Law,S.1311
Advisory Board on Restricted Patients,S.1311
Advisory Board on Sustainable Development,S.1311
Advisory Board on the Registration of Homeopathic Products,S.1311
Advisory Committee for Disabled People in Employment and Training,S.1311
Advisory Committee for the Joint Environmental Markets Unit,S.1311
Advisory Committee for Wales,S.1311
Advisory Committee of the Therapeutic Professions Allied to Medicine,S.1311
Advisory Committee on Advertising,S.1311
Advisory Committee on Animal Feedingstuffs,S.1311
Advisory Committee on Arbitration Law,S.1311
Advisory Committee on Borderline Substances,S.1311
Advisory Committee on Breast Cancer Screening,S.1311
Advisory Committee on Business and the Environment,S.1311
Advisory Committee on Business Appointments,S.1311
Advisory Committee on Cleaner Coal Technology,S.1311
Advisory Committee on Conscientious Objectors,S.1311
Advisory Committee on Consumer Products and the Environment,S.1311
Advisory Committee on Dangerous Pathogens,S.1311
Advisory Committee on Dental Establishments,S.1311
Advisory Committee on Design Quality in the NHS,S.1311
Advisory Committee on Distinction Awards,S.1311
Advisory Committee on Genetic Testing,S.1311
Advisory Committee on Hazardous Substances,S.1311
Advisory Committee on Historic Wreck Sites,S.1311
Advisory Committee on Juvenile Court Lay Panel (Northern Ireland),S.1311
Advisory Committee on Legal Education and Conduct,S.1311
Advisory Committee on Lifelong Learning Targets,S.1311
Advisory Committee on National Health Service Drugs,S.1311
Advisory Committee on Novel Foods and Processes,S.1311
Advisory Committee on Overseas Economic and Social Research,S.1311
Advisory Committee on Packaging,S.1311
Advisory Committee on Pesticides,S.1311
Advisory Committee on Plant and Machinery,S.1311
Advisory Committee on Releases to the Environment,S.1311
Advisory Committee on Service Candidates,S.1311
Advisory Committee on Sites of Special Scientific Interest,S.1311
Advisory Committee on Telecommunications for Disabled and Elderly People (DIEL),S.1311
Advisory Committee on the Government Art Collection,S.1311
Advisory Committee on the Microbiological safety of Food,S.1311
Advisory Committee on Work-Life Balance,S.1311
Advisory Committees on General Commissioners of Income Tax,S.1311
Advisory Committees on General Commissioners of Income Tax (Northern Ireland),S.1311
Advisory Committees on Justices of the Peace (Northern Ireland),S.1311
Advisory Committees on Justices of the Peace in England and Wales,S.1311
"Advisory Committees on Justices of the Peace in Lancashire, Greater Manchester and Merseyside",S.1311
Advisory Conciliation and Arbitration Service,S.1311
Advisory Council on Libraries,S.1311
Advisory Council on National Records and Archives,S.1311
Advisory Council on Public Records,S.1311
Advisory Council on the Misuse of Drugs,S.1311
Advisory Group on Hepatitis,S.1311
Advisory Group on Military Medicine,S.1311
Advisory Panel on Standards for the Planning Inspectorate,S.1311
AEA Technology,S.11001
Aelwyd Housing Association Ltd,S.11001
Aerospace Committee,S.1311
Affinity Sutton Homes Limited,S.11001
Agamemnon Housing Association Limited,S.11001
Age Concern Wiltshire,S.1313
Aged Merchant Seamen's Homes,S.11001
Aggregator Vehicle PLC,S.1311
Agricultural Development and Advisory Service,S.1311
Agricultural Dwelling House Advisory Committees (England) (ADHAC),S.1311
Agricultural Dwelling House Advisory Committees (Wales),S.1311
Agricultural Land Tribunal (Wales),S.1311
Agricultural Land Tribunals (England),S.1311
Agricultural Research Institute of Northern Ireland,S.1311
Agricultural Wages Board for England and Wales,S.1311
Agricultural Wages Board for Northern Ireland,S.1311
Agricultural Wages Committees for England,S.1311
Agricultural Wages Committees for Wales,S.1311
Agriculture and Environment Biotechnology Commission,S.1311
Agriculture and Horticulture Development Board,S.1311
Agri-Food & Biosciences Institute,S.1311
Agudas Israel Housing Association Limited,S.11001
Air Safety Support International Ltd,S.1311
Air Travel Trust,S.1311
Airborne Particles Expert Group,S.1311
Aire Valley Finance (No2) plc,S.12501
Aire Valley Homes Leeds,S.11001
Aire Valley Mortgages 2004-1 plc,S.12501
Aire Valley Mortgages 2005-1 plc,S.12501
Aire Valley Mortgages 2006-1 plc,S.12501
Aire Valley Mortgages 2007-1 plc,S.12501
Aire Valley Mortgages 2007-2 plc,S.12501
Aire Valley Mortgages 2008-1 plc,S.12501
Aire Valley Warehousing 3 Limited,S.12501
Airport Advertising Ltd (s MA),S.11001
Airport Driving Range Company Limited,S.11001
Airport Management Consultants Ltd (s MA),S.11001
Airport Management Services Limited (s H&IE),S.1311
Airport Petroleum Ltd (s MA),S.11001
Airport Trading Ltd (s MA),S.11001
AKSA Housing Association Limited,S.11001
Albion Housing Co-operative Limited,S.11001
Albyn Housing Society Ltd,S.11001
Alcohol Education and Research Council,S.1311
Aldwyck East Housing Association Limited,S.11001
Aldwyck Housing Group Limited,S.11001
Alice Coralie Glyn Homes,S.11001
Allandale Care Group Limited,S.11001
Allerdale Borough Council,S.1313
Alliance Housing Association (South Yorkshire) Limited,S.11001
Allnutt Mill Housing Co-operative Limited,S.11001
Allonby Almshouses,S.11001
Almond Housing Association Ltd,S.11001
Almshouse Charity,S.11001
Almshouse Charity of Charles Jones,S.11001
Almshouse Charity of Elizabeth Smith,S.11001
Almshouse Charity of Hannah Rawson,S.11001
Almshouse Charity of Letitia Cornwallis,S.11001
Almshouse Charity of Sir William Powell,S.11001
Almshouse of St John the Baptist & St John the Evangelist,S.11001
Almshouses of Miss Anne Hopkins-Smith,S.11001
Almshouses of William & Rebecca Pearce,S.11001
Alpha (R.S.L.) Limited,S.11001
Alpha Housing Association,S.11001
Alpha Housing Co-operative Limited,S.11001
Alt Housing Co-operative Limited,S.11001
Amber Valley Borough Council,S.1313
Amble Development Trust Ltd,S.1313
AMC Bank Ltd,S.12201
Amercare Ltd - (s BNFL),S.11001
Amicus Group Limited,S.11001
AmicusHorizon Limited,S.11001
Amlwch Port,S.1313
ANCHO Ltd,S.11001
Anchor Property Holdings Limited,S.11001
Anchor Trust,S.11001
Ancient Monuments Board for Scotland,S.1311
Ancient Monuments Board for Wales,S.1311
Andover Charities (The),S.11001
Anerley Housing Co-operative Limited (The),S.11001
Aneurin Bevan University Health Board,S.1311
Angel Train Contracts,S.11001
Angiers Almshouse Charity,S.11001
Anglian Water,S.11001
Angus Council,S.1313
Angus Housing Association Ltd,S.11001
Animal Diseases Research Association,S.1311
Animal Health,S.1311
Animal Health and Veterinary Laboratories Association,S.1311
Animal Planet (Latin Am) (50%) (sBBCW) (Associate),S.11001
Animal Procedures Committee,S.1311
Animal Welfare Advisory Committee (MOD),S.1311
Annan Harbour,S.11001
Antonine Housing Association Ltd,S.11001
Antrim and Newtownabbey Borough Council,S.1313
"Anvil Trust Ltd, The",S.1313
Apex Housing Association,S.11001
Apna Ghar Housing Association Limited,S.11001
Appeal Body (DVTA),S.1311
Appeals Service,S.1311
Apple and Pear Research Council (APRC),S.1311
Appointments Commission,S.1311
Aragon Housing Association Limited,S.11001
Arawak Walton Housing Association Limited,S.11001
Arbroath Harbour,S.1313
Arches Housing Limited,S.11001
Architects Registration Board,S.11001
Architectural Heritage Fund,S.1311
Architecture and Design Scotland,S.1311
Arcon Housing Association Limited,S.11001
Ardenglen Housing Association Ltd,S.11001
Ards and North Down Borough Council,S.1313
Areas of Outstanding Natural Beauty (AONB) Conservation Boards (En Bloc),S.1313
Arena Housing Group Limited,S.11001
Argyle Street Housing Co-operative Limited,S.11001
Argyll and Bute Council,S.1313
Argyll Community Housing Association,S.11001
Argyll Ferries Ltd,S.1311
Arhag Housing Association Limited,S.11001
Ark Housing Association (NI) Ltd,S.11001
Ark Housing Association Ltd,S.11001
Arklet Housing Association Ltd,S.11001
"Armagh City, Banbridge and Craigavon Borough Council",S.1313
Armagh Observatory and Planetarium,S.1311
Armed Forces Pay Review Body,S.1311
Armed Forces Personnel Administration Agency,S.1311
Arms Length Management Organisations (ALMOs),S.11001
Armstrong Home of Rest (The),S.11001
Army Base Repair Organisation (ABRO),S.11001
Army Base Storage and Distribution Agency,S.1311
Army Personnel Centre,S.1311
Army Technical Support Agency,S.1311
Army Training and Recruiting Agency,S.1311
Arneway Housing Co-operative Limited,S.11001
ARP Charitable Services,S.11001
Arpeggio Properties Limited,S.11001
Arts and Humanities Research Board,S.1311
"Arts and Humanities Research Council, The",S.1311
Arts Council for Wales National Lottery,S.1311
Arts Council of England,S.1311
Arts Council of Northern Ireland,S.1311
Arts Council of Wales,S.1311
Arun District Council,S.1313
Arundel Buildings Housing Co-operative Limited,S.11001
Ascension Island Personnel Ltd (50%) (sWS) (Associate),S.11001
Ascent Housing LLP,S.11001
Ascham Homes Ltd,S.11001
Ash Homes (The),S.11001
Ashbourne Almshouse Charity,S.11001
Ashfield District Council,S.1313
Ashfield Homes Ltd,S.11001
Ashford Borough Council,S.1313
Ashford Pavilion Housing Co-operative Limited,S.11001
Ashley Community & Housing Ltd,S.11001
Ashram Housing Association Limited,S.11001
Ash-Shahada Housing Association Limited,S.11001
Ashton Pioneer Homes Limited,S.11001
Ashwell Housing Association Limited,S.11001
Ashworth Hospital Authority,S.1311
Aspire Housing Limited,S.11001
ASRA Housing Association Limited,S.11001
Asra Housing Group Limited,S.11001
Asset Protection Agency,S.1311
Assets Recovery Agency,S.1311
Association of London Government,S.1313
Association of Port Health Authorities,S.1313
Association of Town Centre Management,S.1313
Assured Living Housing Association Limited,S.11001
Aster Communities,S.11001
Aster Group Limited,S.11001
Aston Almshouse Charity,S.11001
Aston-Mansfield Charitable Trust,S.11001
Ath-Gray Housing Co-operative Limited,S.11001
Atrium Homes,S.11001
Attorney General's Office,S.1311
Auchmithie Harbour,S.11001
Auckland Home Solutions Community Interest Company,S.11001
Audit Commission,S.11001
Audit Commission Pension Scheme (The),S.12901
Audit Scotland,S.11001
Auxesia Homes Limited,S.11001
Averon Leisure Management Limited,S.1313
Aviation Committee,S.1311
Avoch Harbour,S.11001
AWE [Atomic Weapons Establishment] Management Ltd,S.11001
AWE [Atomic Weapons Establishment] Plc,S.11001
Axiom Housing Association Limited,S.11001
Aycliffe - (s NTC),S.1311
Aylesbury Vale District Council,S.1313
Aylesham and District Community Workshop Trust,S.1313
Aylott Janes Almshouses,S.11001
Ayrshire Housing,S.11001
B3 Living Limited,S.11001
Babergh District Council,S.1313
Bahay Kubo Housing Association Limited,S.11001
Baileyfield Switch and Crossing Works,S.11001
Bainsdown Ltd (s MA),S.11001/03
Baker's Benevolent Society (The),S.11001
Balkerne Gardens Trust Limited,S.11001
Balsall Heath Housing Co-operative Limited,S.11001
Bampfylde Almshouse Charity (The),S.11001
Baneswell Housing Association Ltd,S.11001
Bangla Housing Association,S.11001
Bangor Diocesan Housing Association Ltd,S.11001
Bank of England,S.121
Bank of Scotland plc,S.12201
Banking Department,S.121
Barbican Centre,S.1313
Barnes Workhouse Fund,S.11001
Barnet Homes Ltd,S.11001
Barnet Overseas Students Housing Association Ltd,S.11001
Barnsbury Housing Association Limited,S.11001
Barnsley Metropolitan Borough Council,S.1313
Barnstaple Port,S.1313
Barnwood Housing Co-operative Limited,S.11001
Barony Housing Association Ltd,S.11001
Barrhead Housing Association Ltd,S.11001
Barrow-in-Furness Borough Council,S.1313
Bartholomew Thomas Almshouses,S.11001
Basic Skills Agency,S.1311
Basildon - (s NTC),S.1311
Basildon Borough Council,S.1313
Basingstoke and Deane Borough Council,S.1313
Basingstoke Dial-a-Ride,S.1313
Bassetlaw District Council,S.1313
Bath and North East Somerset Council,S.1313
Bath Centre for Voluntary Service Homes,S.11001
Battersea Tenants Co-operative Limited,S.11001
BBC Commercial Holdings Limited,S.1311
BBC do Brazil Limitada (Brazil) (sWS),S.11001
BBC East Asia Relay Company Ltd [Hong Kong] (s WS),S.11001
BBC Haymarket Exhibitions Ltd (50%) (sBBCW) (Associate),S.11001
BBC Magazines Inc. [USA] (s BBCW),S.11001
BBC Pension Scheme,S.12901
BBC Polska SP Zoo [Poland] (s WS),S.11001
BBC Radiocom (Bulgaria) OLLC [Bulgaria] (s WS),S.11001
BBC Radiocom (Hungary) Ltd [Hungary] (s WS),S.11001
BBC Radiocom (Praha) Sro [Czech Republic] (s WS),S.11001
BBC Radiocom (Romania) SRL [Romania] (s WS),S.11001
BBC Radiocom (Slovakia) Ltd [Slovakia] (s WS),S.11001
BBC Radiocom Deutschland GmbH (Germany) (sWS),S.11001
BBC World Service (WS),S.1311
BBC World Service Television Ltd (s BBCW),S.11001
BBC World Service Training Trust (s WS),S.11001
BBC Worldwide (France) SARL [France] (s BBCW),S.11001
BBC Worldwide (Germany) GMBH [Germany] (s BBCW),S.11001
BBC Worldwide (Investments) Ltd (s BBCW),S.11001
BBC Worldwide Americas Inc.[USA] (s BBCW),S.11001
BBC Worldwide Channel Investment Ltd (s BBCW),S.11001
BBC Worldwide Ltd (BBCW)- (s HS),S.11001
BBC Worldwide Music Ltd (s BBCW),S.11001
BCE Corporate Functions Ltd,S.11001
Beacon Waste Ltd,S.1313
Beaumaris Port,S.1313
Becket Trust Housing Association Limited,S.11001
Bedfont Stoney Wall Housing Co-operative Limited,S.11001
Bedford Borough Council,S.1313
Bedford Citizens Housing Association Limited,S.11001
"Bedfordshire, Cambridgeshire, Hertfordshire and Northamptonshire Community Rehabilitation Company (CRC)",S.1311
Beech Housing Association Limited,S.11001
Beeches Road Community Enterprise Ltd,S.1313
Beef Assurance Scheme Membership Panel,S.1311
Beer Community Land Trust Limited,S.11001
Belfast Airport,S.11001
Belfast City Council,S.1313
Belfast Education and Library Board,S.1311
Belfast Harbour Commissioners,S.11001
Belfast Health and Social Care Trust,S.1311
Belgrade Theatre,S.1313
Belgrave Neighbourhood Co-op Housing Association Limited,S.11001
Belgrave Street Housing Co-operative Limited,S.11001
Bellsmyre Housing Association Ltd,S.11001
Benefits Agency,S.1311
Benenden Almshouse Charities,S.11001
Ben-Motor & Allied Trades Benevolent Fund,S.11001
Berkshire Young Musicians Trust,S.1313
Berneslai Homes Ltd,S.11001
Bernicia Group Limited,S.11001
Berrow Cottage Homes (The),S.11001
Berwick Borough Housing,S.11001
Berwickshire Housing Association Ltd,S.11001
Bespoke Supportive Tenancies Limited,S.11001
Bethany Home Trust,S.11001
Bethel Housing Association Limited,S.11001
Betsi Cadwaladr University Health Board,S.1311
Better Regulation Task Force,S.1311
Bexley Community Housing Association Limited,S.11001
Bexley United Charities,S.11001
BHA Housing 2014 Limited,S.11001
Bideford Port,S.1313
Bield Housing & Care,S.11001
BIG Lottery Fund,S.1311
Big Society Capital,S.1311
Big Society Foundation,S.1311
Big Society Trust,S.1311
Biggin Hill Aerodrome,S.1313
BIL Solutions Ltd - (s BNG / BNFL),S.11001
Billericay Community Housing Association Limited,S.11001
Bio Products Laboratory Ltd,S.11001
Biotechnology and Biological Sciences Research Council (The),S.1311
"Birch, Samson and Littleton United Charities (The)",S.11001
Birchfield House Co-operative Limited,S.11001
Birkenhead Forum Housing Association Limited,S.11001
Birmingham Airport,S.11001
Birmingham BRIS,S.11001
Birmingham City Council,S.1313
Birmingham Civic Housing Association Limited,S.11001
Birmingham Co-operative Housing Services Limited,S.11001
Birmingham Heartlands UDC,S.11001
Birmingham Jewish Housing Association Limited,S.11001
Birmingham YMCA,S.11001
Birnbeck Housing Association Limited,S.11001
BIS (Postal Services Act 2011) B Company Limited,S.1311
BIS (Postal Services Act 2011) Company Limited,S.1311
Blaby District Council,S.1313
Black Country Development Corporation,S.11001
Black Country Housing Group Limited,S.11001
Black Horse Ltd,S.12201
Blackburn Borough Transport,S.11001
Blackburn with Darwen Borough Council,S.1313
Blackburn YMCA,S.11001
Blackpool Airport Ltd,S.11001
Blackpool Challenge Partnership Ltd,S.1313
Blackpool Coastal Housing Ltd,S.11001
Blackpool Council,S.1313
Blackpool Fylde and Wyre Society for the Blind (The),S.11001
"Blackpool Fylde and Wyre Society for the Blind, The",S.1313
Blackpool Grand Theatre (Arts and Entertainment) Ltd,S.1313
Blackpool Grand Theatre Catering Ltd,S.1313
Blackpool Grand Theatre Trust Ltd,S.1313
Blackpool Operating Company Ltd,S.1313
Blackpool Town Centre Forum Ltd,S.1313
Blackpool Transport Services Ltd,S.11001
Blackwood Homes and Care,S.11001
Blaenau Gwent County Borough Council,S.1313
Blairtummock Housing Association Ltd,S.11001
Blenheim Housing Co-operative Limited,S.11001
Blochairn Housing Association Ltd,S.11001
Blue House (The),S.11001
Blue Pits Housing Action,S.11001
Blue Square Residential Ltd,S.11001
Blue Triangle (Glasgow) Housing,S.11001
Blyth Cottages,S.11001
Blyth Harbour Commissioners,S.11001
Blyth Valley Housing Ltd,S.11001
BNFL (IP) Ltd (s. BNFL),S.11001
BNFL Engineering Ltd - (s BNFL),S.11001
BNFL Enrichment Ltd - (BNFL),S.11001
BNFL Enterprise - (s BNG / BNFL),S.11001
BNFL Interim Storage Ltd - (s BNFL),S.11001
BNFL Properties Limited - (s BNG / BNFL),S.11001
Boards of Visitors and Visiting Committees (Northern Ireland),S.1311
Boards of Visitors to Penal Establishments,S.1311
Bocking United Charities,S.11001
Bognor Regis Ltd,S.1313
Bolney Housing Association Limited,S.11001
Bolsover District Council,S.1313
Bolton at Home,S.11001
Bolton at Home Ltd,S.11001
Bolton Council,S.1313
Bomarsund Housing Co-operative Limited,S.11001
Bonham and Strathleven Tenants Co-operative Ltd,S.11001
Boorman's Almshouses,S.11001
Booth & Fisher (Motor Services) Ltd - (s SYPTE),S.11001
Bòrd na Gàidhlig,S.1311
Bordesley Green Housing Co-operative Limited,S.11001
Borough of Broxbourne,S.1313
Borough of Poole,S.1313
