London Borough of Barnet,S.1313
London Borough of Bexley,S.1313
London Borough of Brent,S.1313
London Borough of Bromley,S.1313
London Borough of Camden,S.1313
London Borough of Croydon,S.1313
London Borough of Ealing,S.1313
London Borough of Enfield,S.1313
London Borough of Hackney,S.1313
London Borough of Hammersmith and Fulham,S.1313
London Borough of Haringey,S.1313
London Borough of Harrow,S.1313
London Borough of Havering,S.1313
London Borough of Hillingdon,S.1313
London Borough of Hounslow,S.1313
London Borough of Islington,S.1313
London Borough of Lambeth,S.1313
London Borough of Lewisham,S.1313
London Borough of Merton,S.1313
London Borough of Newham,S.1313
London Borough of Redbridge,S.1313
London Borough of Richmond upon Thames,S.1313
London Borough of Southwark,S.1313
London Borough of Sutton,S.1313
London Borough of Tower Hamlets,S.1313
London Borough of Waltham Forest,S.1313
London Borough of Wandsworth,S.1313
London Boroughs (En Bloc),S.1313
London Bus Services Ltd (s.TfL),S.11001
London Buses Ltd (s.TfL),S.1313
London Community Rehabilitation Company (CRC),S.1311
London Cyrenians Housing Limited,S.11001
London Development Agency,S.1313
London District Housing Association Limited,S.11001
London Docklands Development Corporation - (LDDC),S.11001
"London Fire and Emergency Planning Authority, The",S.1313
London Housing Trust,S.11001
London Legacy Development Corporation,S.1313
London Luton Airport Ltd,S.1313
London Olympic Bid Company / London 2012 Ltd,S.1311
London Organising Committee of the Olympic Games (LOCOG),S.11001
London Pensions Fund Authority (operations),S.11001
London Region Electricity Consumers’ Committee,S.1311
London Regional Transport,S.11001
London River Services Ltd (s.TfL),S.11001
London Strategic Housing Limited,S.11001
London Thames Gateway Development Corporation,S.1311
London Transport Museum (s.TfL),S.1313
London Transport Museum (Trading) Ltd,S.11001
London Transport Users Committee (LTUC),S.1313
London Underground Ltd,S.11001
London Waste and Recycling Board,S.1313
Londonderry Port and Harbour Commissioners,S.11001
Longdendale Housing Society Limited,S.11001
Longhurst & Havelok Homes,S.11001
Longhurst Group Limited,S.11001
Longlife Housing Co-operative Limited,S.11001
Look Ahead Care and Support Ltd,S.11001
Lord Chancellor's Department,S.1311
Lord Chancellor's Legal Aid Advisory Committee (Northern Ireland),S.1311
"Lord Chief Justice, The",S.1311
Lord Mayor of Portsmouth's Coronation Homes Ltd.,S.11001
Loreburn Housing Association Ltd,S.11001
Loretto Housing Association Ltd,S.11001
Lothian Buses plc,S.11001
Loughs Agency,S.1311
Louisa Cottages Charity,S.11001
Louisa Lilley Almshouses (The),S.11001
Low Carbon Contracts Company,S.1311
Low Level Waste Repository (LLWR) Ltd,S.1311
Low Pay Commission,S.1311
Lowestoft Church & Town Almshouse Charity,S.11001
LUL Nominee BCV Ltd,S.1313
LUL Nominee SSL Ltd,S.1313
Luminus Group Limited,S.11001
Luminus Homes Limited,S.11001
Lune Valley Rural Housing Association Limited,S.11001
Luton Borough Council,S.1313
Luton Community Housing Ltd,S.11001
Luton International Airport Ltd,S.11001
Lydney War Memorial Trust,S.11001
Lygon Almshouses (The),S.11001
Lyme Regis Port,S.1313
Lyng Community Association,S.11001
Lynsted Housing Co-operative Limited,S.11001
Lyvennet Community Trust,S.11001
Macaulay Land Use Research Institute,S.1311
Macaulay Research and Consultancy Services Ltd,S.11001
Macduff Port,S.1313
MacFarlane Trust,S.1311
Magistrates Courts (En Bloc),S.1311
Magistrates Courts Rule Committee,S.1311
Magistrates Courts Rules Committee (Northern Ireland),S.1311
Magna Housing Association Limited,S.11001
Magna Housing Group Limited,S.11001
Magna Housing Limited,S.11001
Magna West Somerset Housing Association Limited,S.11001
Magnox Electric Ltd (s BNFL),S.1311
Magnox Electric plc,S.11001
Magnox Limited,S.1311
Magnox North Ltd. (s. BNFL),S.1311
Magnox South Ltd. (s. BNFL),S.1311
Maidstone Borough Council,S.1313
Major Housing Association Ltd,S.11001
Maldon District Council,S.1313
Maldon Housing Association Limited,S.11001
Malins Affordable Homes Limited,S.11001
Mallaig Harbour,S.11001
Malvern Hills District Council,S.1313
Manchester (Barton) Aerodrome,S.1313
Manchester Airport Building Ltd (s MA),S.11001
Manchester Airport Employment Services Ltd (s MA),S.11001
Manchester Airport Finance Holdings Ltd,S.11001/3
Manchester Airport Finance Ltd (s MA),S.11001
Manchester Airport Group Finance Ltd,S.11001/3
Manchester Airport Group plc,S.11001/3
Manchester Airport Group Property Developments Ltd,S.11001/3
Manchester Airport Group Property Services Ltd,S.11001/3
Manchester Airport Holdings Limited,S.12701/03
Manchester Airport plc,S.11001/3
Manchester and District Housing Association Limited,S.11001
Manchester City Council,S.1313
Manchester Investment and Development Agency Service Ltd,S.1313
Manchester Jewish Housing Association,S.11001
Manchester Unity Housing Association Limited,S.11001
Manningham Housing Association Limited,S.11001
Manor Estates Housing Association Ltd,S.11001
Manor Housing Association Limited,S.11001
Mansfield District Council,S.1313
Mansfield Road (Nottingham) Baptist Housing Association Limited,S.11001
Mansfields (Norwich) Ltd - (s Remploy Ltd ),S.11001
Mansfields Group Ltd - (s Remploy Ltd),S.11001
Margaret Colquhoun Chavasse Almshouses,S.11001
Margaret Hydes Charity,S.11001
Margaret Jane Ashley Almshouse Charity (The),S.11001
Marine and Aviation (War Risks) Fund,S.1311
Marine and Fisheries Agency,S.1311
Marine Management Organisation,S.1311
Marine Safety Agency,S.1311
Marine Scotland,S.1311
Maritime and Coastguard Agency,S.1311
Maritime Second Housing Association Ltd,S.11001
Marlborough & District Housing Association Limited,S.11001
Marsden Memorial Homes,S.11001
Marshall Aid Commemoration Commission,S.1311
Marshfield Consolidated Charities,S.11001
Martlet Homes Limited,S.11001
Mary Hannah Almshouses,S.11001
Mary Hatch Almshouses with Diamond Jubilee Cottages,S.11001
Maryhill Housing Association Ltd,S.11001
Masonic Housing Association,S.11001
Master of the Rolls,S.1311
May Day Permanent Housing Co-operative Limited,S.11001
Maynard Co-operative Housing Association Limited,S.11001
Mayor's Office for Policing and Crime,S.1313
Maze / Long Kesh Development Corporation,S.1311
Measurement Advisory Committee,S.1311
Meat and Livestock Commission (MLC),S.1311
Meat Hygiene Advisory Committee,S.1311
Meat Hygiene Appeals Tribunal for England and Wales,S.1311
Meat Hygiene Service,S.1311
Medical Appeal Tribunals Northern Ireland,S.1311
Medical Appeals Tribunal,S.1311
Medical Devices Agency,S.1311
Medical Practices Committee,S.1311
Medical Research Council,S.1311
Medical Research Council Technology,S.11001
Medical Supplies Agency,S.1311
Medical Workforce Standing Advisory Committee,S.1311
Medicines and Healthcare products Regulatory Agency,S.11001
Medicines Commission,S.1311
Medway Council,S.1313
Melin Homes Limited,S.11001
Melton Borough Council,S.1313
Melville Housing Association Ltd,S.11001
Mendip District Council,S.1313
Mental Health Act Commission,S.1311
Mental Health Commission for Northern Ireland,S.1311
Mental Health Review Tribunal,S.1311
Mental Health Review Tribunal for Northern Ireland,S.1311
Mental Health Review Tribunal for Wales,S.1311
Mental Welfare Commission for Scotland,S.1311
Merchant Navy Reserve,S.1311
Merchant Taylors' Boone's Charity (The),S.11001
Mercian Housing Association Limited,S.11001
Mercy House of William Fry,S.11001
Meres and Mosses Housing Association,S.11001
Merlin Housing Society Limited,S.11001
Mersea Island Trust,S.11001
Merseyside and North Wales Region Electricity Consumers’ Committee,S.1311
Merseyside Community Rehabilitation Company (CRC),S.1311
Merseyside Development Corporation,S.11001
Merseyside Passenger Transport Executive - (s PTE),S.1313
Merseyside Waste Authority,S.1313
Merseytravel - (Merseyside Passenger Transport Executive),S.11001
Merthyr Tydfil County Borough Council,S.1313
Merthyr Tydfil Housing Association Limited,S.11001
Merthyr Valleys Homes Limited,S.11001
Merton Priory Homes,S.11001
Meteorological Office,S.11001
Methodist Homes Housing Association Limited,S.11001
Metronet Rail BCV Holdings Ltd,S.11001
Metronet Rail SSL Holdings Ltd,S.11001
Metropolitan Benefit Societies' Almshouses,S.11001
Metropolitan Housing Trust Limited,S.11001
Metropolitan Police Authority,S.1313
Metropolitan Police Committee,S.1311
Microbiological Research Authority,S.1311
Mid and East Antrim Borough Council,S.1313
Mid Devon District Council,S.1313
Mid Suffolk District Council,S.1313
Mid Sussex District Council,S.1313
Mid Ulster District Council,S.1313
Middle Level Commissioners,S.1313
Middlesbrough Council,S.1313
Midland Heart Limited,S.11001
Midlands Region Electricity Consumers Committee,S.1311
Midlothian Council,S.1313
Mid-Wales Housing Association Ltd,S.11001
Mile End Housing Co-operative Limited (The),S.11001
Milford Haven Port Authority,S.11001
Military Survey,S.1311
Milk Development Council (MDC),S.1311
Mill Street Co-op Ltd,S.11001
Millat Asian Housing Association Limited,S.11001
Milldale Housing Co-operative Limited,S.11001
Millennium Commission,S.1311
Miller Walk Housing Co-operative Limited,S.11001
Milnbank Housing Association Ltd,S.11001
Milton Keynes - (s NTC),S.1311
Milton Keynes Council,S.1313
Minehead Port,S.1313
Mineworker's Pension Scheme,S.12901
Ministry of Defence,S.1311
Ministry of Defence Police & Guarding Agency,S.1311
Ministry of Justice,S.1311
Minster Housing Co-operative Limited,S.11001
Miss Rutland's Almshouses,S.11001
Mission Housing Association Limited,S.11001
Misuse of Drugs Advisory Board,S.1311
Misuse of Drugs Professional Panel,S.1311
Misuse of Drugs Tribunal,S.1311
Mitre Housing Association Limited,S.11001
MNE Ltd.,S.11001
Moat Farm Housing Co-operative Limited,S.11001
Moat Homes Limited,S.11001
Moat Housing Group Limited,S.11001
Mole Valley District Council,S.1313
Mole Valley Housing Association Limited,S.11001
Molendinar Park Housing Association,S.11001
Molyneux Almshouses (The),S.11001
Money Advice Service,S.1311
Monitor – Independent Regulator of NHS Foundation Trusts,S.1311
Monmouth Road Housing Co-operative Limited,S.11001
Monmouthshire County Council,S.1313
Monmouthshire Housing Association Limited,S.11001
Monopolies and Mergers Commission,S.1311
Montrose Port,S.11001
Moorlands Housing,S.11001
Moray Council,S.1313
Moredun Research Institute,S.1311
Mortgage Express,S.12201
Mortlake Almshouse and Relief Charities,S.11001
Mossbank Homes Limited,S.11001
Mosscare Housing Limited,S.11001
Mount Green Housing Association Limited,S.11001
Mrs H Frances Le Personne Benevolent Trust,S.11001
Muir Group Housing Association Limited,S.11001
MuirCroft Housing Association Limited,S.11001
Muirhouse Housing Association Ltd,S.11001
Mulberry Housing Co-operative Limited,S.11001
Multimedia Ventures Ltd (50%) (sWS) (Associate),S.11001
Municipal & Owen Carter Almshouse Charities,S.11001
Municipal Charities,S.11001
Municipal Charities of Stratford-upon-Avon (The),S.11001
Museum of Kent Life Trust,S.1313
Museum of London,S.1313
Museum of Science and Industry in Manchester,S.1311
Museums and Galleries Commission,S.1311
Museums Libraries and Archives Council,S.1311
Musselburgh Port,S.1313
My Space Housing Solutions,S.11001
N.I.R Leasing Limited - (s NITHC),S.11001
N.I.R Travel Limited - (s NITHC),S.11001
NACRO,S.11001
Nacro Community Enterprises Limited,S.11001
Nairn Port,S.1313
National Advisory Council for the Employment of People with Disabilities,S.1311
National Air Traffic Services Ltd - (s CAA),S.11001
National Archives,S.1311
National Archives of Scotland,S.1311
National Army Museum,S.1311
National Assembly for Wales,S.1311
National Association of Citizens Advice Bureau (England and Wales) (The),S.1311
National Audit Office,S.1311
National Biological Standards Board (UK),S.1311
National Blood Authority,S.11001
"National Board for Nursing, Midwifery and Health Visiting for Northern Ireland",S.1311
"National Board for Nursing, Midwifery and Health Visiting for Scotland",S.1311
National Care Standards Commission,S.1311
National Clinical Assessment Authority (NCAA),S.1311
National College for School Leadership,S.1311
National College for Teaching and Leadership,S.1311
National Consumer Council,S.1311
National Consumers Consultative Committee (Electricity) (NCCC),S.1311
National Council for Education and Training for Wales,S.1311
National Council of Young Men’s Christian Associations (Incorporated),S.11001
National Crime Agency,S.1311
National Crime Squad,S.1311
National Criminal Intelligence Service,S.1311
National Curriculum Council,S.1311
National Disability Council,S.1311
National Employer Advisory Board,S.1311
National Employment Panel,S.1311
National Employment Savings Trust Corporation (NEST),S.12901
National Endowment for Science and Technology and the Arts (NESTA),S.1311
National Exhibition Centre Limited,S.1313
National Expert Group on Transboundary Air Pollution,S.1311
National Forest Company,S.1311
National Fraud Authority,S.1311
National Fuel Distributors Ltd - (s HI),S.11001
National Galleries of Scotland,S.1311
National Gallery,S.1311
National Health Service Business Services Authority,S.1311
National Health Service Central Register,S.1311
"National Health Service Commissioning Board, The",S.1311
National Health Service Estates,S.11001
National Health Service Foundation Trusts (England),S.1311
National Health Service Information Authority,S.1311
National Health Service Litigation Authority,S.1311
National Health Service Pensions Agency,S.1311
National Health Service Professionals South West,S.1311
National Health Service Supplies Authority,S.1311
National Health Service Training Authority,S.1311
National Health Service Tribunal,S.1311
National Health Service Trusts (England),S.1311
National Health Service Trusts (Wales),S.1311
National Heritage Memorial Fund,S.1311
National Heritage Memorial Fund Investment Account,S.1311
National Institute for Clinical Excellence (The),S.1311
National Institute for Health and Clinical Excellence (The),S.1311
National Institute of Health and Care Excellence,S.1311
National Insurance Contributions Office,S.1311
National Insurance Fund,S.1311
National Insurance Local Tribunals,S.1311
National Investment and Loans Office,S.1311
National Library of Scotland,S.1311
National Library of Wales,S.1311
National Library of Wales Staff Superannuation Scheme,S.12901
National Loans Fund,S.1311
National Lottery Commission,S.1311
National Lottery Distribution Fund,S.1311
National Lottery UK Sports Council Lottery,S.1311
National Maritime Museum,S.1311
"National Measurement Office, The",S.1311
National Museum of the Royal Navy,S.1311
National Museum of Wales Pension Scheme,S.12901
National Museums and Galleries of Northern Ireland,S.1311
National Museums and Galleries of Wales,S.1311
National Museums and Galleries on Merseyside,S.1311
National Museums Liverpool,S.1311
National Museums of Scotland,S.1311
National Non Food Crop Centre,S.1311
National Nuclear Laboratories Ltd,S.11001
National Parks Authorities (En Bloc),S.1313
National Patient Safety Agency,S.1311
National Policing Improvement Agency,S.1311
National Portrait Gallery,S.1311
National Probation Service for England and Wales,S.1311
National Radiological Protection Board,S.1311
National Records of Scotland,S.1311
National Research Development Corporation,S.1311
National Savings Bank (Ordinary and Investment accounts),S.1311
National Savings Stock Register Cash Account,S.1311
National School of Government,S.1311
National Specialist Commissioning Advisory Group,S.1311
National Stone Centre,S.1313
National Treatment Agency,S.1311
National Waiting Times Centre Board,S.1311
National Weights and Measurements Laboratory,S.1311
National Westminster Bank plc,S.12201
National Youth Agency,S.1311
Natural England,S.1311
"Natural Environment Research Council, The",S.1311
Natural History Museum,S.1311
Natural Resources Wales,S.1311
Naval Aircraft Repair Organisation,S.1311
Naval Bases and Supply Agency,S.1311
Naval Manning Agency,S.1311
Naval Recruiting and Training Agency,S.1311
"Navy, Army and Air Force Institute",S.11001
NDA Archives Limited,S.1311
Neath Port Talbot County Borough Council,S.1313
Nehemiah United Churches Housing Association Limit,S.11001
NESTA Endowment Account (National Endowment for Science Technology and Arts),S.1311
"NESTA Trust, The",S.1311
Network Homes Limited,S.11001
Network Housing Group Limited,S.11001
Network Rail Limited,S.1311
Network Stadium Housing Association Limited,S.11001
New Charter Homes Limited,S.11001
New Charter Housing Trust Limited,S.11001
New College Of Cobham (The),S.11001
New Cut Housing Co-operative Limited (The),S.11001
New Deal Task  Force,S.1311
New Forest District Council,S.1313
New Forest National Park Authority,S.1313
New Forest Villages Housing Association Limited,S.11001
New Foundations Housing Association Limited,S.11001
New Fylde Housing Limited,S.11001
New Gorbals Housing Association Ltd,S.11001
New Linx Housing Trust,S.11001
New Longsight Housing Co-operative Limited,S.11001
New Millennium Experience Company Ltd,S.11001
New Moves Housing Co-operative Limited,S.11001
New Opportunities Fund,S.1311
New Outlook Housing Association Limited,S.11001
New Progress Housing Association Limited,S.11001
New Roots Limited,S.11001
New Swift Housing Co-operative Limited,S.11001
New Venture Housing Co-operative Limited,S.11001
New Video Channel America LLC [USA] (s BBCW),S.11001
New Walk Property Management CIC,S.11001
New World Housing Association Limited,S.11001
Newark and Sherwood District Council,S.1313
Newark and Sherwood Homes Ltd,S.11001
Newark Emmaus Trust,S.11001
Newark Housing Association Limited,S.11001
Newcastle International Airport Ltd,S.11001
Newcastle-Under-Lyme Borough Council,S.1313
Newcastle-upon-Tyne City Council,S.1313
Newcastle-upon-Tyne MDC,S.1313
Newham Homes Ltd,S.11001
Newington Housing Association Ltd,S.11001
Newleaf Housing Co-operative Limited,S.11001
Newlon Housing Trust,S.11001
Newlyn Pier and Harbour Commissioners,S.11001
Newport (IOW) Port,S.1313
Newport City Council,S.1313
Newport City Homes Housing Association Ltd,S.11001
Newport Transport Ltd,S.11001
Newquay Port,S.1313
"Newry, Mourne and Down District Council",S.1313
Newydd Housing Association (1974) Ltd,S.11001
Nexia Solutions Ltd. (s. BNFL),S.11001
Next Step Homes Ltd,S.11001
Nexus (Tyne and Wear Passenger Transport Executive),S.1313
NFPA Scotland Ltd,S.11001
NHS 24,S.1311
NHS Blood and Transplant,S.11001
NHS Board Endowment Funds (Scotland) - aka Scottish NHS Charities,S.1311
NHS Business Service Authority,S.1311
NHS Charities in England and Wales (En Bloc),S.1311
NHS Commissioning Board Special Health Authority,S.1311
"NHS Confederation, The",S.1311
NHS Direct NHS Trust (England),S.1311
NHS Education for Scotland,S.1311
NHS Estates,S.11001
NHS Health Scotland Board,S.1311
NHS Institute for Innovation and Improvement,S.1311
NHS Logistics Authority,S.11001
NHS Pensions Agency,S.1311
NHS Professionals,S.1311
NHS Professionals Limited,S.11001
NHS Professionals South West,S.1311
NHS Purchasing and Supply Agency,S.1311
NHS Quality Improvement Scotland,S.1311
NHS Trust Development Authority,S.1311
NHS Trusts (England) (En Bloc),S.1311
NI Co-Ownership Housing Association Ltd,S.11001
Nicholas Chamberlaine's Hospital & Sermon Charity,S.11001
Non Fossil Purchasing Agency Ltd,S.11001
Norden Farm Centre Trust,S.1313
Norfolk & Suffolk Community Rehabilitation Company (CRC),S.1311
Norfolk County Council,S.1313
North Ayrshire Council,S.1313
North Ayrshire Municipal Bank Ltd,S.12501
North Belfast Housing Association Ltd,S.11001
North Berwick Harbour,S.11001
North Camden Housing Co-operative Limited,S.11001
North Connel (Oban) Aerodrome,S.1313
North Devon Council,S.1313
North Devon Homes Limited,S.11001
North Devon Homes Limited,S.11001
North Dorset District Council,S.1313
North East Derbyshire District Council,S.1313
North East Lincolnshire Council,S.1313
North East of Scotland Transport Partnership (NESTRANS),S.1313
North East Wales Careers Service Ltd,S.1311
North Eastern Education and Library Board,S.1311
North Eastern Region Electricity Consumers’ Committee,S.1311
North Eastern YWCA Trustees Limited,S.11001
North Glasgow Housing Association Ltd,S.11001
North Hertfordshire District Council,S.1313
North Hertfordshire Homes Limited,S.11001
North Hull Housing Action Trust,S.1311
North Kent Architecture Centre Ltd,S.1313
North Kesteven District Council,S.1313
North Lanarkshire Council,S.1313
North Lanarkshire Municipal Bank Ltd,S.12501
North Lincolnshire Council,S.1313
North London Muslim Housing Association Limited,S.11001
North London Waste Authority,S.1313
North Memorial Homes City of Leicester,S.11001
North Norfolk District Council,S.1313
North of Scotland Region Electricity Consumers’ Committee,S.1311
North of Scotland Water Authority,S.11001
North Ronaldsay Aerodrome,S.1313
North Somerset Council,S.1313
North South Language Body (An Foras Teanga North-South Body o Leid) (The),S.1311
North Star Housing Group Limited,S.11001
North Tyneside Council,S.1313
North View Housing Association Ltd,S.11001
North Wales Housing Association Ltd,S.11001
North Warwickshire Borough Council,S.1313
North West Cultural Consortium,S.1311
North West Leicestershire District Council,S.1313
North West Regional Development Agency,S.1311
North Western Region Electricity Consumers’ Committee,S.1311
North Yorkshire County Council,S.1313
North Yorkshire Moors National Park Authority,S.1313
Northampton Borough Council,S.1313
Northamptonshire County Council,S.1313
Northamptonshire Rural Housing Association Limited,S.11001
Northborough Housing Co-operative Limited,S.11001
"Northchapel, Petworth and Tillington Almshouses",S.11001
Northern Health and Personal Social Services Board,S.1311
Northern Health and Social Care Trust,S.1311
Northern Housing Consortium (NHC),S.1313
Northern Ireland Advisory Committee on Telecommunications,S.1311
Northern Ireland Advisory Committee on Travellers,S.1311
Northern Ireland Airports Ltd,S.11001
"Northern Ireland Ambulance Service Health and Social Care Trust, The",S.1311
Northern Ireland Assembly Commission,S.1311
Northern Ireland Audit Office,S.1311
Northern Ireland Authority for Energy Regulation,S.1311
Northern Ireland Blood Transfusion Service Agency,S.1311
Northern Ireland Building Regulations Advisory Committee,S.1311
Northern Ireland Central Investment Fund for Charities,S.12601
Northern Ireland Central Services Agency (NICSA),S.1311
Northern Ireland Child Support Agency,S.1311
Northern Ireland Commissioner for Protection Against Unlawful Industrial Action,S.1311
Northern Ireland Commissioner for the Rights of Trade Union Members,S.1311
Northern Ireland Community Relations Council,S.1311
Northern Ireland Consolidated Fund,S.1311
Northern Ireland Consumer Committee for Electricity,S.1311
Northern Ireland Cooperation Overseas (NI-CO) Ltd,S.11001
Northern Ireland Council for Postgraduate Medical and Dental Education,S.1311
Northern Ireland Council for the Curriculum Examinations & Assessment (NICCEA),S.1311
Northern Ireland Courts and Tribunals Service,S.1311
Northern Ireland Courts Service,S.1311
Northern Ireland Crown Court Rules Committee,S.1311
Northern Ireland Disability Council,S.1311
Northern Ireland District Councils (En Bloc),S.1313
Northern Ireland Driver Vehicle Testing Agency,S.11001
Northern Ireland Economic Council,S.1311
Northern Ireland Economic Development Council,S.1311
Northern Ireland Education and Library Boards,S.1311
Northern Ireland Environment Agency,S.1311
Northern Ireland Fire and Rescue Board,S.1311
Northern Ireland Fishery Harbour Authority,S.1311
Northern Ireland Government Departments (En Bloc),S.1311
Northern Ireland Guardian Ad Litem Agency (NIGALA),S.1311
Northern Ireland Health and Social Care Trust Charitable Funds,S.1311
Northern Ireland Health Promotion Agency,S.1311
Northern Ireland Higher Education Council,S.1311
Northern Ireland Housing Executive (NIHE),S.11001
Northern Ireland Human Rights Commission,S.1311
Northern Ireland Industrial Court,S.1311
Northern Ireland Industrial Tribunals,S.1311
Northern Ireland Judicial Appointments Commission,S.1311
Northern Ireland Law Commission,S.1311
Northern Ireland Legal Services Commission,S.1311
Northern Ireland Library Authority,S.1311
Northern Ireland Local Government Officer’s Superannuation Committee,S.1311
Northern Ireland Medical and Dental Training Agency,S.1311
Northern Ireland Memorial Fund,S.1311
Northern Ireland Museums Council,S.1311
Northern Ireland Office,S.1311
Northern Ireland Ombudsman,S.1311
Northern Ireland Police Fund,S.1311
Northern Ireland Policing Board,S.1311
Northern Ireland Postal Services Committee,S.1311
Northern Ireland Prison Service,S.1311
Northern Ireland Public Sector Enterprise,S.11001
Northern Ireland Railways Company Ltd - (s NITHC),S.11001
Northern Ireland Regional Medical Physics Agency (NIRMPA),S.1311
"Northern Ireland Review Body (Driver, Operator and Vehicle Licensing)",S.1311
Northern Ireland Rural Development Council,S.1311
Northern Ireland Schools (En Bloc),S.1311
Northern Ireland Screen Commission,S.1311
Northern Ireland Social Care Council (NISCC),S.1311
Northern Ireland Statistics and Research Agency,S.1311
Northern Ireland Strategic Investment Board Ltd,S.1311
Northern Ireland Tourist Board,S.1311
Northern Ireland Transport Holding Company (NITHC),S.11001
Northern Ireland Utility Regulator,S.1311
Northern Ireland Water Council,S.1311
Northern Ireland Water Limited,S.1311
Northern Ireland Water Service,S.1311
Northern Lighthouse Board,S.1311
Northern Rock Asset Management plc,S.1311
Northern Rock Estates Ltd.,S.11001
Northern Rock Homes Ltd.,S.11001
Northern Rock plc,S.11001
Northern Rock Properties Ltd.,S.11001
Northern Rock Traffic Management Ltd.,S.11001
Northlink Ferries Ltd,S.1311
Northumberland County Council,S.1313
Northumberland National Park Authority,S.1313
Northumbria Community Rehabilitation Company (CRC),S.1311
