Project 34,Public Non-Financial Corporation,S.11001,1996-07-24T00:00:00Z
Property Advisors to the Civil Estate (PACE),Central Government,S.1311,NA
Property Advisory Group,Former Central Government,S.1311,2003-07-01T00:00:00Z
Prospect Community Housing,Public Non-Financial Corporation,S.11001,2001-07-18T00:00:00Z
Prospect Housing Limited,Public Non-Financial Corporation,S.11001,1996-07-24T00:00:00Z
Proteus Theatre Co Ltd,Local Government,S.1313,NA
Proudman Oceanographic Laboratory,Central Government,S.1311,NA
Provanhall Housing Association Ltd,Public Non-Financial Corporation,S.11001,2001-07-18T00:00:00Z
Providence Row Housing Association,Public Non-Financial Corporation,S.11001,1996-07-24T00:00:00Z
Prudential Regulation Authority,Public Financial Corporation,S.12601,2013-04-01T00:00:00Z
Public Guardian Board,Former Central Government,S.1311,2012-09-01T00:00:00Z
Public Guardianship Office,Former Central Government,S.1311,2007-10-01T00:00:00Z
Public Health England,Central Government,S.1311,2013-04-01T00:00:00Z
Public Health Laboratory Service Board,Former Central Government,S.1311,2005-04-01T00:00:00Z
Public Health Wales NHS Trust,Central Government,S.1311,2009-08-01T00:00:00Z
Public Lending Right and the Public Lending Right Advisory Committee,Former Central Government,S.1311,1905-07-01T00:00:00Z
Public Private Partnerships Programme Ltd (4ps),Local Government,S.1313,2009-08-01T00:00:00Z
Public Prosecution Service for Northern Ireland,Central Government,S.1311,2005-06-01T00:00:00Z
Public Record Office,Former Central Government,S.1311,NA
Public Records Office of Northern Ireland,Central Government,S.1311,NA
Public Service Commission,Central Government,S.1311,2006-03-01T00:00:00Z
Public Service Training Council Northern Ireland,Former Central Government,S.1311,NA
Public Services Ombudsman for Wales,Central Government,S.1311,NA
Public Services Productivity Panel Unit,Former Central Government,S.1311,2002-05-01T00:00:00Z
Public Trust Office,Former Central Government,S.1311,NA
Purbeck District Council,Local Government,S.1313,NA
Purlin Housing Co-operative Limited,Public Non-Financial Corporation,S.11001,1996-07-24T00:00:00Z
Puttenham & Wanborough Housing Society Limited,Public Non-Financial Corporation,S.11001,1996-07-24T00:00:00Z
QinetiQ,Former Public Corporation,S.11001,NA
Quadrant-Brownswood Tenant Co-operative Limited,Public Non-Financial Corporation,S.11001,1996-07-24T00:00:00Z
Qualifications and Curriculum Development Agency,Former Central Government,S.1311,2012-04-01T00:00:00Z
"Qualifications, Curriculum and Assessment Authority for Wales",Former Central Government,S.1311,2006-04-01T00:00:00Z
Quality Meat Scotland,Central Government,S.1311,2008-04-01T00:00:00Z
Quality Space (Stirling) Ltd,Local Government,S.1313,NA
Queen Elizabeth II Conference Centre,Public Non-Financial Corporation,S.11001,NA
Queen Victoria School,Former Central Government,S.1311,2005-04-01T00:00:00Z
Queen Victoria School (Charity),Central Government,S.1311,2006-04-01T00:00:00Z
Queens Cross Housing Association Ltd,Public Non-Financial Corporation,S.11001,2001-07-18T00:00:00Z
Quo Vadis Trust,Public Non-Financial Corporation,S.11001,1996-07-24T00:00:00Z
Race Education and Employment Forum,Former Central Government,S.1311,NA
Race Relations Employment Advisory Group,Former Central Government,S.1311,NA
Race Relations Forum,Central Government,S.1311,NA
Rachel Herbert's Church Parsonage and Almshouse Charities,Public Non-Financial Corporation,S.11001,1996-07-24T00:00:00Z
Radcliffe Housing Society Limited,Public Non-Financial Corporation,S.11001,1996-07-24T00:00:00Z
Radian Group Limited,Public Non-Financial Corporation,S.11001,1996-07-24T00:00:00Z
Radio Authority,Former Central Government (some quasi-corporate),S.1311,NA
Radioactive Waste Management Advisory Committee,Central Government,S.1311,NA
Radioactive Waste Management Limited,Central Government,S.1311,2014-04-01T00:00:00Z
Radiocommunications Agency,Former Central Government,S.1311,NA
RAF Logistics Support Services,Former Central Government,S.1311,NA
RAF Maintenance Group Defence Agency,Former Central Government,S.1311,NA
RAF Personnel Management Agency,Former Central Government,S.1311,2004-04-01T00:00:00Z
RAF Signals Engineering Establishment,Former Central Government,S.1311,NA
RAF Training Group Defence Agency,Former Central Government,S.1311,2006-04-01T00:00:00Z
Rail for London Ltd,Public Non-Financial Corporation,S.11001,2011-04-01T00:00:00Z
Rail Passengers' Committees,Former Central Government,S.1311,NA
Rail Passengers' Council,Central Government,S.1311,NA
Rail Users Consultative Committees,Former Central Government,S.1311,NA
Railsale Ltd,Former Central Government,S.1311,NA
Railway Housing Association and Benefit Fund,Public Non-Financial Corporation,S.11001,1996-07-24T00:00:00Z
RAJAR (Radio Joint Audience Research) Ltd (50%) (sBBCW) (Associate),Public Non-Financial Corporation,S.11001,NA
Rampton Hospital Authority,Former Central Government,S.1311,NA
Ramsey Welfare Charities,Public Non-Financial Corporation,S.11001,1996-07-24T00:00:00Z
Ramsgate Port,Local Government,S.1313,NA
Rate Collection Agency (Northern Ireland),Former Central Government,S.1311,NA
Rathgael & White Abbey Schools Management Board,Former Central Government,S.1311,NA
Raven Housing Trust Limited,Public Non-Financial Corporation,S.11001,1996-07-24T00:00:00Z
Ravenscroft Re-Build Co-operative Limited,Public Non-Financial Corporation,S.11001,1996-07-24T00:00:00Z
Rayner House and Yew Trees Limited,Public Non-Financial Corporation,S.11001,1996-07-24T00:00:00Z
RCT Homes Ltd,Public Non-Financial Corporation,S.11001,1996-07-24T00:00:00Z
RCUK Shared Services Centre Ltd,Central Government,S.1311,2007-08-01T00:00:00Z
Reach (Supported Living) Limited,Public Non-Financial Corporation,S.11001,1996-07-24T00:00:00Z
Reactor Sites Management Company Ltd.,Former Public Corporation,S.11001,NA
Reading Borough Council,Local Government,S.1313,NA
Reading Transport Ltd,Public Non-Financial Corporation,S.11001,NA
Reading YMCA,Public Non-Financial Corporation,S.11001,1996-07-24T00:00:00Z
Red Devon Housing Limited,Public Non-Financial Corporation,S.11001,1996-07-24T00:00:00Z
Red House Farm Housing Co-operative Limited,Public Non-Financial Corporation,S.11001,1996-07-24T00:00:00Z
Red Kite Community Housing Limited,Public Non-Financial Corporation,S.11001,1996-07-24T00:00:00Z
Redbridge Homes Ltd,Former Public Corporation,S.11001,2012-08-01T00:00:00Z
Redcar and Cleveland Council,Local Government,S.1313,NA
Redditch - (s NTC),Former Central Government,S.1311,NA
Redditch Borough Council,Local Government,S.1313,NA
Redditch Community Homes,Public Non-Financial Corporation,S.11001,1996-07-24T00:00:00Z
Redditch Co-operative 2000 Limited,Public Non-Financial Corporation,S.11001,1996-07-24T00:00:00Z
Redditch Friends Housing Association Limited,Public Non-Financial Corporation,S.11001,1996-07-24T00:00:00Z
Redwing Living Limited,Public Non-Financial Corporation,S.11001,1996-07-24T00:00:00Z
Redwood Housing Co-operative Limited,Public Non-Financial Corporation,S.11001,1996-07-24T00:00:00Z
Reedmonte Ltd,Local Government,S.1313,NA
Refuge,Public Non-Financial Corporation,S.11001,1996-07-24T00:00:00Z
Regenda Limited,Public Non-Financial Corporation,S.11001,1996-07-24T00:00:00Z
"Regional Agency for Public Health and Social Well-being (Northern Ireland), The",Central Government,S.1311,2009-04-01T00:00:00Z
Regional Aggregation Bodies,Former Central Government,S.1311,NA
Regional Assemblies (England),Former Local Government,S.1313,NA
Regional Business Services Organisation,Central Government,S.1311,NA
Regional Business Services Organisation (Northern Ireland),Central Government,S.1311,2009-04-01T00:00:00Z
Regional Flood Defence Committees,Central Government,S.1311,NA
Regional Health and Social Care Board,Central Government,S.1311,NA
Regional Health and Social Care Board (Northern Ireland),Central Government,S.1311,2009-04-01T00:00:00Z
Regional Health Authorities (En Bloc),Former Central Government,S.1311,1996-04-01T00:00:00Z
Regional Industrial Development Boards,Central Government,S.1311,NA
Regional Panels in MAFF,Former Central Government,S.1311,NA
Registered Homes Tribunal (Northern Ireland),Central Government,S.1311,NA
Registered Homes Tribunals,Former Central Government,S.1311,NA
Registered Inspectors of Schools Appeals Tribunal,Central Government,S.1311,NA
Registered Inspectors of Schools Appeals Tribunal (Wales),Central Government,S.1311,NA
Registered Nursery Education Inspectors Appeals Tribunal,Central Government,S.1311,NA
Registers of Scotland,Public Non-Financial Corporation,S.11001,NA
Registrar of Occupational and Personal Pension Schemes,Central Government,S.1311,NA
Registrar of the Public Lending Right,Former Central Government,S.1311,2013-10-01T00:00:00Z
Registry of Friendly Societies,Former Central Government,S.1311,NA
Reidvale Housing Association,Public Non-Financial Corporation,S.11001,2001-07-18T00:00:00Z
Reigate and Banstead Borough Council,Local Government,S.1313,NA
Reigate Quaker Housing Association Limited,Public Non-Financial Corporation,S.11001,1996-07-24T00:00:00Z
Renewable Energy Advisory Committee,Former Central Government,S.1311,1905-06-23T00:00:00Z
Renewable Fuels Agency,Former Central Government,S.1311,NA
Renfrew Port,Local Government,S.1313,NA
Renfrewshire Council,Local Government,S.1313,NA
Rent Assessment Panels (Northern Ireland),Central Government,S.1311,NA
Rent Assessment Panels (RAPS),Former Central Government,S.1311,2013-07-01T00:00:00Z
Rent Assessment Panels (Scotland),Central Government,S.1311,NA
Rent Assessment Panels (Wales),Central Government,S.1311,NA
Rent Service (The),Former Central Government,S.1311,2009-04-01T00:00:00Z
Research Councils (En Bloc),Central Government,S.1311,NA
Research Sites Restoration Limited,Central Government,S.1311,2009-02-01T00:00:00Z
Reside Housing Association Limited,Public Non-Financial Corporation,S.11001,1996-07-24T00:00:00Z
Residuary Bodies,Local Government,S.1313,NA
Residuary Body for Wales,Former Central Government,S.1311,NA
Resource: The Council for Museums Archives and Libraries,Former Central Government,S.1311,2004-04-01T00:00:00Z
Resthaven Almshouses,Public Non-Financial Corporation,S.11001,1996-07-24T00:00:00Z
Retail Trust,Public Non-Financial Corporation,S.11001,1996-07-24T00:00:00Z
Retirement Lease Housing Association,Public Non-Financial Corporation,S.11001,1996-07-24T00:00:00Z
Revenue and Customs Prosecutions Office,Former Central Government,S.1311,2010-01-01T00:00:00Z
Revenue Scotland,Central Government,S.1311,2015-01-01T00:00:00Z
Reverend Rowland Hill Almshouse Charity (The),Public Non-Financial Corporation,S.11001,1996-07-24T00:00:00Z
Review Board for Government Contracts,Central Government,S.1311,NA
Reviewing Committee on the Export of Works of Art,Central Government,S.1311,NA
Rex Housing Limited,Public Non-Financial Corporation,S.11001,1996-07-24T00:00:00Z
Rhondda Cynon Taff County Borough Council,Local Government,S.1313,NA
Rhondda Housing Association Limited,Public Non-Financial Corporation,S.11001,1996-07-24T00:00:00Z
Ribble Valley Borough Council,Local Government,S.1313,NA
Ribble Valley Homes Limited,Public Non-Financial Corporation,S.11001,1996-07-24T00:00:00Z
Richard Whitaker's Almshouses,Public Non-Financial Corporation,S.11001,1996-07-24T00:00:00Z
Richmond Avenue Housing Co-operative Limited,Public Non-Financial Corporation,S.11001,1996-07-24T00:00:00Z
Richmond Co-operative Housing Association Limited,Public Non-Financial Corporation,S.11001,1996-07-24T00:00:00Z
Richmond Fellowship (The),Public Non-Financial Corporation,S.11001,1996-07-24T00:00:00Z
Richmond Housing Partnership Limited,Public Non-Financial Corporation,S.11001,1996-07-24T00:00:00Z
Richmondshire District Council,Local Government,S.1313,NA
Rickmansworth Churches Housing Association Limited,Public Non-Financial Corporation,S.11001,1996-07-24T00:00:00Z
Ringway Developments Ltd,Local Government,S.1313,NA
Ringway Handling Limited (s MA),Public Non-Financial Corporation/Public Non-Financial Corporation (see notes in tab),S.11001/3,2013-02-01T00:00:00Z
Ringway Handling Services Ltd (s MA),Public Non-Financial Corporation/Public Non-Financial Corporation (see notes in tab),S.11001/3,2013-02-01T00:00:00Z
Ripon Municipal Charities,Public Non-Financial Corporation,S.11001,1996-07-24T00:00:00Z
Ripon YMCA,Public Non-Financial Corporation,S.11001,1996-07-24T00:00:00Z
River Clyde Homes,Public Non-Financial Corporation,S.11001,2001-07-18T00:00:00Z
River Nith Navigation,Former Public Non-Financial Corporation,S.11001,2015-12-02T00:00:00Z
River Yealm Harbour Authority,Public Non-Financial Corporation,S.11001,NA
Rivers Agency (Northern Ireland),Central Government,S.1311,NA
"Riverside Centre Ltd, The",Local Government,S.1313,NA
Riverside Group Limited (The),Public Non-Financial Corporation,S.11001,1996-07-24T00:00:00Z
Riverside Housing Co-operative (Redditch) Limited,Public Non-Financial Corporation,S.11001,1996-07-24T00:00:00Z
Riversmead Housing Association Limited,Public Non-Financial Corporation,S.11001,1996-07-24T00:00:00Z
RM Museum Ltd,Public Non-Financial Corporation,S.11001,NA
RNM Functions Ltd,Public Non-Financial Corporation,S.11001,NA
Roads Service (Northern Ireland),Central Government,S.1311,NA
Robert Hibbert's Almshouse Charity,Public Non-Financial Corporation,S.11001,1996-07-24T00:00:00Z
Robert Salter Charity (The),Public Non-Financial Corporation,S.11001,1996-07-24T00:00:00Z
Rochdale Boroughwide Housing Limited,Public Non-Financial Corporation,S.11001,1996-07-24T00:00:00Z
Rochdale Metropolitan Borough Council,Local Government,S.1313,NA
Rochford District Council,Local Government,S.1313,NA
Rochford Housing Association Limited,Public Non-Financial Corporation,S.11001,1996-07-24T00:00:00Z
Rockdale Housing Association Limited,Public Non-Financial Corporation,S.11001,1996-07-24T00:00:00Z
Rockingham Forest Housing Association Limited,Public Non-Financial Corporation,S.11001,1996-07-24T00:00:00Z
Roddons Housing Association Limited,Public Non-Financial Corporation,S.11001,1996-07-24T00:00:00Z
Rogate and Terwick Housing Association Limited,Public Non-Financial Corporation,S.11001,1996-07-24T00:00:00Z
Roger Williams & Queen Victoria Memorial Almshouse,Public Non-Financial Corporation,S.11001,1996-07-24T00:00:00Z
Roger's Almshouses,Public Non-Financial Corporation,S.11001,1996-07-24T00:00:00Z
Rolls Royce PLC,Former Public Corporation,S.11001,NA
Rooftop Homes Limited,Public Non-Financial Corporation,S.11001,1996-07-24T00:00:00Z
Rooftop Housing Association Limited,Public Non-Financial Corporation,S.11001,1996-07-24T00:00:00Z
Rooftop Housing Group Limited,Public Non-Financial Corporation,S.11001,1996-07-24T00:00:00Z
Rosebery Housing Association Limited,Public Non-Financial Corporation,S.11001,1996-07-24T00:00:00Z
Rosehearty Harbour,Former Public Non-Financial Corporation,S.11001,2015-12-02T00:00:00Z
Rosehill Housing Co-operative Limited,Public Non-Financial Corporation,S.11001,2001-07-18T00:00:00Z
Rosemary Simmons Memorial Housing Association Limited,Public Non-Financial Corporation,S.11001,1996-07-24T00:00:00Z
Ross Walk Housing Co-operative Limited,Public Non-Financial Corporation,S.11001,1996-07-24T00:00:00Z
Rossendale Borough Council,Local Government,S.1313,NA
Rossendale Transport Ltd,Public Non-Financial Corporation,S.11001,NA
Rotary Club of Dudley Housing Association Limited,Public Non-Financial Corporation,S.11001,1996-07-24T00:00:00Z
Rotary House For The Deaf Limited,Public Non-Financial Corporation,S.11001,1996-07-24T00:00:00Z
Rother District Council,Local Government,S.1313,NA
Rotherham Metropolitan Borough Council,Local Government,S.1313,NA
Routes to Work South,Local Government,S.1313,NA
Rowett Research Institute,Central Government,S.1311,NA
Rowland Hill and Vaughan Almshouse Charity,Public Non-Financial Corporation,S.11001,1996-07-24T00:00:00Z
Royal Air Force Museum,Central Government,S.1311,NA
Royal Air Forces Association Housing Limited,Public Non-Financial Corporation,S.11001,1996-07-24T00:00:00Z
Royal Armouries Museum,Central Government,S.1311,NA
Royal Bank of Scotland Group plc,Public Financial Corporation,S.12501,NA
Royal Bank of Scotland Group plc Subsidiaries,Public Financial Corporation,S.12201,NA
"Royal Bank of Scotland plc, The",Public Financial Corporation,S.12201,NA
Royal Borough of Greenwich,Local Government,S.1313,NA
Royal Borough of Kensington and Chelsea,Local Government,S.1313,NA
Royal Borough of Kingston upon Thames,Local Government,S.1313,NA
Royal Borough of Windsor and Maidenhead,Local Government,S.1313,NA
"Royal Botanic Garden, Edinburgh",Central Government,S.1311,NA
"Royal Botanic Gardens, Kew",Central Government,S.1311,NA
Royal Collection Enterprises Ltd,Public Non-Financial Corporation,S.11001,NA
Royal Collection Trust,Public Non-Financial Corporation,S.11001,NA
Royal Commission on Ancient and Historical Monuments of Scotland,Former Central Government,S.1311,2015-04-01T00:00:00Z
Royal Commission on Environmental Pollution,Former Central Government,S.1311,NA
Royal Commission on Historical Monuments in England,Former Central Government,S.1311,NA
Royal Commission on Long Term Care of the Elderly,Former Central Government,S.1311,NA
Royal Commission on the Ancient and Historical Monuments of Wales,Central Government,S.1311,NA
Royal Docks Management Authority Ltd - (s LDA),Public Non-Financial Corporation,S.11001,2002-04-01T00:00:00Z
Royal Fine Art Commission,Former Central Government,S.1311,1905-06-26T00:00:00Z
Royal Fine Art Commission for Scotland,Former Central Government,S.1311,NA
Royal Hospital Chelsea,Central Government,S.1311,NA
Royal Household,Central Government,S.1311,NA
Royal Mail Plc (and subsidiaries),Former Public Corporation,S.11001,2013-10-01T00:00:00Z
Royal Marines Museum,Central Government,S.1311,NA
Royal Military College of Science Advisory Council (RCMS),Former Central Government,S.1311,2004-04-01T00:00:00Z
Royal Mint,Public Non-Financial Corporation,S.11001,NA
"Royal Mint Advisory Committee on the Design of Coins, Medals, Seals and Decorations",Central Government,S.1311,NA
Royal Naval Museum,Central Government,S.1311,NA
Royal Naval Museum Trading Company Ltd.,Public Non-Financial Corporation,S.11001,NA
Royal Naval Submarine Museum,Central Government,S.1311,NA
Royal Observatory Greenwich,Central Government,S.1311,NA
Royal Parks Agency,Central Government,S.1311,NA
Royal Patriotic Fund,Central Government,S.1311,NA
Royal Ulster Constabulary,Former Central Government,S.1311,NA
Royal Ulster Constabulary George Cross Foundation,Central Government,S.1311,NA
Ruabon Almshouse Charity,Public Non-Financial Corporation,S.11001,1996-07-24T00:00:00Z
Ruchazie Housing Association Ltd,Public Non-Financial Corporation,S.11001,2001-07-18T00:00:00Z
Rugby Borough Council,Local Government,S.1313,NA
Runcorn - (s NTC),Former Central Government,S.1311,NA
Runnymede Borough Council,Local Government,S.1313,NA
Rural Development Commission,Former Central Government,S.1311,NA
Radias Housing Association,Public Non-Financial Corporation,S.11001,1992-07-15T00:00:00Z
Rural Housing Association Ltd,Public Non-Financial Corporation,S.11001,1992-07-15T00:00:00Z
Rural Payments Agency,Central Government,S.1311,NA
Rural Stirling Housing Association Ltd,Public Non-Financial Corporation,S.11001,2001-07-18T00:00:00Z
Rushcliffe Borough Council,Local Government,S.1313,NA
Rushmoor Borough Council,Local Government,S.1313,NA
Rusland Road Housing Co-operative Limited,Public Non-Financial Corporation,S.11001,1996-07-24T00:00:00Z
Russet Homes Limited,Public Non-Financial Corporation,S.11001,1996-07-24T00:00:00Z
Rutherglen and Cambuslang Housing,Public Non-Financial Corporation,S.11001,2001-07-18T00:00:00Z
Rutland County Council,Local Government,S.1313,NA
RY Winning Hand Ltd,Public Non-Financial Corporation,S.11001,1996-07-24T00:00:00Z
Ryde Port,Local Government,S.1313,NA
Rye Harbour Commissioners,Public Non-Financial Corporation,S.11001,NA
Ryedale District Council,Local Government,S.1313,NA
Rykneld Homes Limited,Public Non-Financial Corporation,S.11001,1996-07-24T00:00:00Z
Rykneld Homes Ltd,Public Non-Financial Corporation,S.11001,NA
S.A.D.A.C.C.A. Ltd (Sheffield and District Afro-Caribbean Community Association Ltd),Local Government,S.1313,NA
S.M.N.E Ltd.,Public Non-Financial Corporation,S.11001,NA
S4C Masnachol Cyf - (s S4C),Public Non-Financial Corporation,S.11001,NA
S4C Rhyngwladol Cyf. (S - S4C),Public Non-Financial Corporation,S.11001,NA
S4C2 Cyf. (S - S4C),Public Non-Financial Corporation,S.11001,NA
Sackville College,Public Non-Financial Corporation,S.11001,1996-07-24T00:00:00Z
Sadeh Lok Limited,Public Non-Financial Corporation,S.11001,1996-07-24T00:00:00Z
Safefood (Food Safety Promotion Board),Central Government,S.1311,1999-12-01T00:00:00Z
Safer Places,Public Non-Financial Corporation,S.11001,1996-07-24T00:00:00Z
Saffron Housing Trust Limited,Public Non-Financial Corporation,S.11001,1996-07-24T00:00:00Z
Saint Davids Diocesan Housing Association Ltd,Public Non-Financial Corporation,S.11001,1996-07-24T00:00:00Z
Saint Mary Magdalen's Hospital (The),Public Non-Financial Corporation,S.11001,1996-07-24T00:00:00Z
Salcombe Port,Local Government,S.1313,NA
Salford City Council,Local Government,S.1313,NA
Salisbury City Almshouse and Welfare Charities,Public Non-Financial Corporation,S.11001,1996-07-24T00:00:00Z
Salix Homes Limited,Public Non-Financial Corporation,S.11001,1996-07-24T00:00:00Z
Salix Homes Ltd,Public Non-Financial Corporation,S.11001,NA
Salmon Advisory Council,Former Central Government,S.1311,NA
Saltcoats Port,Local Government,S.1313,NA
Salvation Army Housing Association,Public Non-Financial Corporation,S.11001,1996-07-24T00:00:00Z
Sambourne Trust,Public Non-Financial Corporation,S.11001,1996-07-24T00:00:00Z
Samuel Lewis Foundation,Public Non-Financial Corporation,S.11001,1996-07-24T00:00:00Z
Sanctuary (North West) Housing Association Limited,Public Non-Financial Corporation,S.11001,1996-07-24T00:00:00Z
Sanctuary Affordable Housing Limited,Public Non-Financial Corporation,S.11001,1996-07-24T00:00:00Z
Sanctuary Housing Association,Public Non-Financial Corporation,S.11001,1996-07-24T00:00:00Z
Sanctuary Scotland Housing Association,Public Non-Financial Corporation,S.11001,2001-07-18T00:00:00Z
Sanday Aerodrome,Local Government,S.1313,NA
Sanday Port,Local Government,S.1313,NA
Sandbach Almshouse Charity,Public Non-Financial Corporation,S.11001,1996-07-24T00:00:00Z
Sandbourne Housing Association,Public Non-Financial Corporation,S.11001,1996-07-24T00:00:00Z
Sandwell Homeless and Resettlement Project Ltd,Local Government,S.1313,NA
Sandwell Homes Ltd,Former Public Corporation,S.11001,2013-01-01T00:00:00Z
Sandwell Metropolitan Borough Council,Local Government,S.1313,NA
Sandwell Tenants and Residents Federation Ltd,Local Government,S.1313,NA
Sandwich Port and Haven Commissioners,Public Non-Financial Corporation,S.11001,NA
Sapphire Independent Housing Limited,Public Non-Financial Corporation,S.11001,1996-07-24T00:00:00Z
Satman Developments,Local Government,S.1313,NA
Saundersfoot Harbour Commissioners,Public Non-Financial Corporation,S.11001,NA
Saxon Weald Homes Limited,Public Non-Financial Corporation,S.11001,1996-07-24T00:00:00Z
Scarborough Borough Council,Local Government,S.1313,NA
Scarborough Port,Local Government,S.1313,NA
School Examinations and Assessment Council,Former Central Government,S.1311,NA
School Food Trust,Former Central Government,S.1311,2011-09-01T00:00:00Z
School Support Staff Negotiating Body,Former Central Government,S.1311,2012-02-01T00:00:00Z
School Teachers Review Body,Central Government,S.1311,NA
Science Advisory Committee on the Medical Implications of Less-Lethal Weapons,Central Government,S.1311,2009-07-01T00:00:00Z
Science and Technology Facilities Council,Central Government,S.1311,NA
Science Museum Group,Central Government,S.1311,2012-04-01T00:00:00Z
Scientific Advisory Committee on Nutrition,Central Government,S.1311,NA
Scientific Committee on Tobacco and Health,Central Government,S.1311,NA
SCMG Enterprises Ltd,Public Non-Financial Corporation,S.11001,1987-11-01T00:00:00Z
Scotland Office,Central Government,S.1311,NA
Scotland's Commissioner for Children and Young People,Central Government,S.1311,NA
Scottish Advisory Committee on Distinction Awards,Central Government,S.1311,NA
Scottish Advisory Committee on Drug Misuse,Former Central Government,S.1311,1905-06-24T00:00:00Z
Scottish Advisory Committee on Telecommunications,Former Central Government,S.1311,2003-12-29T00:00:00Z
Scottish Advisory Committee on the Medical Workforce,Former Central Government,S.1311,1905-06-24T00:00:00Z
Scottish Agricultural College,Central Government,S.1311,NA
Scottish Agricultural Consultative Panel,Former Central Government,S.1311,NA
Scottish Agricultural Wages Board,Central Government,S.1311,NA
Scottish Ambulance Service Board,Central Government,S.1311,NA
Scottish Arts Council,Former Central Government,S.1311,2010-07-01T00:00:00Z
Scottish Association of Citizens Advice Bureau (The),Central Government,S.1311,2005-04-01T00:00:00Z
Scottish Borders Council,Local Government,S.1313,NA
Scottish Borders Housing Association Ltd,Public Non-Financial Corporation,S.11001,2001-07-18T00:00:00Z
Scottish Canals,Central Government,S.1311,2012-07-01T00:00:00Z
Scottish Child-Care Board,Former Central Government,S.1311,NA
Scottish Children's Reporter Administration,Central Government,S.1311,NA
Scottish Commission for the Regulation of Care,Former Central Government,S.1311,2011-04-01T00:00:00Z
Scottish Consolidated Fund,"CG Funds, Accounts, Courts and Posts",S.1311,NA
Scottish Consultative Council on the Curriculum,Former Central Government,S.1311,NA
Scottish Consumer Council,Former Central Government,S.1311,NA
Scottish Conveyancing and Executry Services Board,Former Central Government,S.1311,NA
Scottish Council for Educational Technology,Former Central Government,S.1311,NA
Scottish Council for Post-Graduate Medical Education and Dental Education,Former Central Government,S.1311,1905-06-24T00:00:00Z
