name,sector,esa-2010,start-date
124 Facilities Ltd - (s C4),Former Public Corporation,S.11001,2002-12-01T00:00:00Z
180 Housing Ltd,Public Non-Financial Corporation,S.11001,1996-07-24T00:00:00Z
2010 Rotherham Ltd,Former Public Corporation,S.11001,2011-07-01T00:00:00Z
20-20 Housing Co-operative Limited,Public Non-Financial Corporation,S.11001,1996-07-24T00:00:00Z
28a Supported Living Limited,Public Non-Financial Corporation,S.11001,1996-07-24T00:00:00Z
3CHA Ltd,Public Non-Financial Corporation,S.11001,1996-07-24T00:00:00Z
4 Ventures Ltd,Public Non-Financial Corporation,S.11001,2000-11-01T00:00:00Z
700 Club,Public Non-Financial Corporation,S.11001,1996-07-24T00:00:00Z
A1 Housing Bassetlaw Ltd,Public Non-Financial Corporation,S.11001,2008-07-22T00:00:00Z
A2Dominion Homes Limited,Public Non-Financial Corporation,S.11001,1996-07-24T00:00:00Z
A2Dominion Housing Group Limited,Public Non-Financial Corporation,S.11001,1996-07-24T00:00:00Z
A2Dominion Housing Options Limited,Public Non-Financial Corporation,S.11001,1996-07-24T00:00:00Z
A2Dominion South Limited,Public Non-Financial Corporation,S.11001,1996-07-24T00:00:00Z
Abbeyfield (Berkhamsted & Hemel Hempstead) Society Limited (The),Public Non-Financial Corporation,S.11001,1996-07-24T00:00:00Z
Abbeyfield (Brecon) Society Ltd,Public Non-Financial Corporation,S.11001,1996-07-24T00:00:00Z
Abbeyfield (Chelsea & Fulham) Society Limited (The),Public Non-Financial Corporation,S.11001,1996-07-24T00:00:00Z
Abbeyfield (Christ Church) Society Limited (The),Public Non-Financial Corporation,S.11001,1996-07-24T00:00:00Z
Abbeyfield (Colyton) Society Limited (The),Public Non-Financial Corporation,S.11001,1996-07-24T00:00:00Z
Abbeyfield (Darlington) Society Limited (The),Public Non-Financial Corporation,S.11001,1996-07-24T00:00:00Z
Abbeyfield (Lyme Regis & District) Society Ltd (The),Public Non-Financial Corporation,S.11001,1996-07-24T00:00:00Z
Abbeyfield (Maidenhead) Society Limited (The),Public Non-Financial Corporation,S.11001,1996-07-24T00:00:00Z
Abbeyfield (Norwich) Society Limited (The),Public Non-Financial Corporation,S.11001,1996-07-24T00:00:00Z
Abbeyfield (Oxford) Society Limited (The),Public Non-Financial Corporation,S.11001,1996-07-24T00:00:00Z
Abbeyfield (Ripon and District) Society Ltd (The),Public Non-Financial Corporation,S.11001,1996-07-24T00:00:00Z
Abbeyfield (Southport) Society Limited (The),Public Non-Financial Corporation,S.11001,1996-07-24T00:00:00Z
Abbeyfield (Streatham) Society Limited (The),Public Non-Financial Corporation,S.11001,1996-07-24T00:00:00Z
Abbeyfield (Wells) Society Limited (The),Public Non-Financial Corporation,S.11001,1996-07-24T00:00:00Z
Abbeyfield (Weymouth) Society Limited (The),Public Non-Financial Corporation,S.11001,1996-07-24T00:00:00Z
Abbeyfield / SSAFA Hereford Society Limited (The),Public Non-Financial Corporation,S.11001,1996-07-24T00:00:00Z
Abbeyfield Abbots Langley Society Limited (The),Public Non-Financial Corporation,S.11001,1996-07-24T00:00:00Z
Abbeyfield Alresford and District Society Ltd (The),Public Non-Financial Corporation,S.11001,1996-07-24T00:00:00Z
Abbeyfield and Wesley Housing Association,Public Non-Financial Corporation,S.11001,1992-07-15T00:00:00Z
Abbeyfield Bangor / UCNW Society Ltd,Public Non-Financial Corporation,S.11001,1996-07-24T00:00:00Z
Abbeyfield Barrow-in- Furness Society Limited (The),Public Non-Financial Corporation,S.11001,1996-07-24T00:00:00Z
Abbeyfield Basildon Society Limited (The),Public Non-Financial Corporation,S.11001,1996-07-24T00:00:00Z
Abbeyfield Berwick Society Limited (The),Public Non-Financial Corporation,S.11001,1996-07-24T00:00:00Z
Abbeyfield Billericay Society Limited (The),Public Non-Financial Corporation,S.11001,1996-07-24T00:00:00Z
Abbeyfield Bishop's Castle & District Society Limited (The),Public Non-Financial Corporation,S.11001,1996-07-24T00:00:00Z
Abbeyfield Bishops Stortford Society Limited (The),Public Non-Financial Corporation,S.11001,1996-07-24T00:00:00Z
Abbeyfield Blackcombe Society Limited (The),Public Non-Financial Corporation,S.11001,1996-07-24T00:00:00Z
Abbeyfield Blackmore Vale Society Limited (The),Public Non-Financial Corporation,S.11001,1996-07-24T00:00:00Z
Abbeyfield Bognor Regis Society Limited (The),Public Non-Financial Corporation,S.11001,1996-07-24T00:00:00Z
Abbeyfield Borough of Conway Society Limited,Public Non-Financial Corporation,S.11001,1996-07-24T00:00:00Z
Abbeyfield Bradford Society Limited (The),Public Non-Financial Corporation,S.11001,1996-07-24T00:00:00Z
Abbeyfield Bradford-on-Avon Society Limited (The),Public Non-Financial Corporation,S.11001,1996-07-24T00:00:00Z
"Abbeyfield Braintree, Bocking and Felsted Society Limited",Public Non-Financial Corporation,S.11001,1996-07-24T00:00:00Z
Abbeyfield Bristol and Keynsham Society,Public Non-Financial Corporation,S.11001,1996-07-24T00:00:00Z
Abbeyfield Bromley Society Limited (The),Public Non-Financial Corporation,S.11001,1996-07-24T00:00:00Z
Abbeyfield Buckland Monachorum Society Limited (The),Public Non-Financial Corporation,S.11001,1996-07-24T00:00:00Z
Abbeyfield Burnham and Highbridge Society Ltd (The),Public Non-Financial Corporation,S.11001,1996-07-24T00:00:00Z
Abbeyfield Burnley Society Limited (The),Public Non-Financial Corporation,S.11001,1996-07-24T00:00:00Z
Abbeyfield Bury Society Limited (The),Public Non-Financial Corporation,S.11001,1996-07-24T00:00:00Z
Abbeyfield Camborne Society Ltd (The),Public Non-Financial Corporation,S.11001,1996-07-24T00:00:00Z
Abbeyfield Canvey Island Society Limited (The),Public Non-Financial Corporation,S.11001,1996-07-24T00:00:00Z
Abbeyfield Chalfonts Society Limited (The),Public Non-Financial Corporation,S.11001,1996-07-24T00:00:00Z
Abbeyfield Chester Society Limited,Public Non-Financial Corporation,S.11001,1996-07-24T00:00:00Z
Abbeyfield Cirencester Society Limited,Public Non-Financial Corporation,S.11001,1996-07-24T00:00:00Z
Abbeyfield Colwyn Bay Society Ltd,Public Non-Financial Corporation,S.11001,1996-07-24T00:00:00Z
Abbeyfield Crowborough Society Limited (The),Public Non-Financial Corporation,S.11001,1996-07-24T00:00:00Z
Abbeyfield Deben Extra Care Society Limited (The),Public Non-Financial Corporation,S.11001,1996-07-24T00:00:00Z
Abbeyfield Deptford Society Limited (The),Public Non-Financial Corporation,S.11001,1996-07-24T00:00:00Z
Abbeyfield Dorcas Society Limited (The),Public Non-Financial Corporation,S.11001,1996-07-24T00:00:00Z
Abbeyfield Dulwich Society Limited (The),Public Non-Financial Corporation,S.11001,1996-07-24T00:00:00Z
Abbeyfield East London Extra Care Society Ltd (The),Public Non-Financial Corporation,S.11001,1996-07-24T00:00:00Z
Abbeyfield Ellesmere Port Society Limited (The),Public Non-Financial Corporation,S.11001,1996-07-24T00:00:00Z
Abbeyfield Fareham Society Limited (The),Public Non-Financial Corporation,S.11001,1996-07-24T00:00:00Z
Abbeyfield Ferring Society Limited (The),Public Non-Financial Corporation,S.11001,1996-07-24T00:00:00Z
Abbeyfield Fflint,Public Non-Financial Corporation,S.11001,1996-07-24T00:00:00Z
Abbeyfield Furness Extra Care Society Limited (The),Public Non-Financial Corporation,S.11001,1996-07-24T00:00:00Z
Abbeyfield Gerrards Cross Society Limited (The),Public Non-Financial Corporation,S.11001,1996-07-24T00:00:00Z
Abbeyfield Gloucestershire Society Limited (The),Public Non-Financial Corporation,S.11001,1996-07-24T00:00:00Z
Abbeyfield Great Missenden & District Society (The),Public Non-Financial Corporation,S.11001,1996-07-24T00:00:00Z
"Abbeyfield Grimsby, Cleethorpes and District Society Limited",Public Non-Financial Corporation,S.11001,1996-07-24T00:00:00Z
Abbeyfield Groombridge Society Limited (The),Public Non-Financial Corporation,S.11001,1996-07-24T00:00:00Z
Abbeyfield Guildford Society Limited (The),Public Non-Financial Corporation,S.11001,1996-07-24T00:00:00Z
Abbeyfield Hertfordshire Residential Care Society,Public Non-Financial Corporation,S.11001,1996-07-24T00:00:00Z
Abbeyfield Holsworthy Society Limited (The),Public Non-Financial Corporation,S.11001,1996-07-24T00:00:00Z
Abbeyfield Hoylake and West Kirby Society Ltd (The),Public Non-Financial Corporation,S.11001,1996-07-24T00:00:00Z
Abbeyfield Ilkley Society Limited (The),Public Non-Financial Corporation,S.11001,1996-07-24T00:00:00Z
Abbeyfield Kent Society (The),Public Non-Financial Corporation,S.11001,1996-07-24T00:00:00Z
Abbeyfield Kings Langley Society Limited (The),Public Non-Financial Corporation,S.11001,1996-07-24T00:00:00Z
Abbeyfield Lancashire Extra Care Society Ltd (The),Public Non-Financial Corporation,S.11001,1996-07-24T00:00:00Z
Abbeyfield Lancaster Society Limited (The),Public Non-Financial Corporation,S.11001,1996-07-24T00:00:00Z
Abbeyfield Liskeard Society Limited (The),Public Non-Financial Corporation,S.11001,1996-07-24T00:00:00Z
Abbeyfield Llandeilo Society Ltd,Public Non-Financial Corporation,S.11001,1996-07-24T00:00:00Z
Abbeyfield Llandudno Society Ltd,Public Non-Financial Corporation,S.11001,1996-07-24T00:00:00Z
Abbeyfield Llanrwst and District Society Ltd,Public Non-Financial Corporation,S.11001,1996-07-24T00:00:00Z
Abbeyfield London Polish Society Limited (The),Public Non-Financial Corporation,S.11001,1996-07-24T00:00:00Z
Abbeyfield Loughborough Society Limited (The),Public Non-Financial Corporation,S.11001,1996-07-24T00:00:00Z
Abbeyfield Nailsworth & District Society Ltd,Public Non-Financial Corporation,S.11001,1996-07-24T00:00:00Z
Abbeyfield Newbury Society Limited (The),Public Non-Financial Corporation,S.11001,1996-07-24T00:00:00Z
Abbeyfield Newcastle-upon-Tyne Society Ltd (The),Public Non-Financial Corporation,S.11001,1996-07-24T00:00:00Z
Abbeyfield North Downs Society Limited (The),Public Non-Financial Corporation,S.11001,1996-07-24T00:00:00Z
Abbeyfield North Northumberland Extra Care Society Limited,Public Non-Financial Corporation,S.11001,1996-07-24T00:00:00Z
Abbeyfield Northallerton and District Society Ltd,Public Non-Financial Corporation,S.11001,1996-07-24T00:00:00Z
Abbeyfield Orwell Extra Care Society Limited (The),Public Non-Financial Corporation,S.11001,1996-07-24T00:00:00Z
Abbeyfield Oxenford Society Limited (The),Public Non-Financial Corporation,S.11001,1996-07-24T00:00:00Z
Abbeyfield Oxton & Prenton Society Ltd (The),Public Non-Financial Corporation,S.11001,1996-07-24T00:00:00Z
Abbeyfield Pirbright and District Society Ltd (The),Public Non-Financial Corporation,S.11001,1996-07-24T00:00:00Z
Abbeyfield Porlock Society Limited (The),Public Non-Financial Corporation,S.11001,1996-07-24T00:00:00Z
Abbeyfield Prestbury and District Society Ltd,Public Non-Financial Corporation,S.11001,1996-07-24T00:00:00Z
Abbeyfield Reading Society Limited (The),Public Non-Financial Corporation,S.11001,1996-07-24T00:00:00Z
Abbeyfield Ribble Valley Society Limited (The),Public Non-Financial Corporation,S.11001,1996-07-24T00:00:00Z
Abbeyfield Rotherhithe Society Limited (The),Public Non-Financial Corporation,S.11001,1996-07-24T00:00:00Z
Abbeyfield Saltash Society Limited (The),Public Non-Financial Corporation,S.11001,1996-07-24T00:00:00Z
Abbeyfield Sanderstead Society Limited (The),Public Non-Financial Corporation,S.11001,1996-07-24T00:00:00Z
Abbeyfield Scarborough Society Limited (The),Public Non-Financial Corporation,S.11001,1996-07-24T00:00:00Z
Abbeyfield Scotland Ltd,Public Non-Financial Corporation,S.11001,2001-07-18T00:00:00Z
Abbeyfield Shanklin Society Limited (The),Public Non-Financial Corporation,S.11001,1996-07-24T00:00:00Z
Abbeyfield Sidmouth Society Limited (The),Public Non-Financial Corporation,S.11001,1996-07-24T00:00:00Z
Abbeyfield Society (The),Public Non-Financial Corporation,S.11001,1996-07-24T00:00:00Z
Abbeyfield Sodbury Vale Society Limited (The),Public Non-Financial Corporation,S.11001,1996-07-24T00:00:00Z
Abbeyfield Solent Society Limited (The),Public Non-Financial Corporation,S.11001,1996-07-24T00:00:00Z
Abbeyfield South Downs Limited,Public Non-Financial Corporation,S.11001,1996-07-24T00:00:00Z
Abbeyfield South Molton Society Limited (The),Public Non-Financial Corporation,S.11001,1996-07-24T00:00:00Z
Abbeyfield South West Society Limited (The),Public Non-Financial Corporation,S.11001,1996-07-24T00:00:00Z
Abbeyfield Southend Society Limited (The),Public Non-Financial Corporation,S.11001,1996-07-24T00:00:00Z
Abbeyfield Southern Oaks,Public Non-Financial Corporation,S.11001,1996-07-24T00:00:00Z
Abbeyfield Tavistock Society Limited (The),Public Non-Financial Corporation,S.11001,1996-07-24T00:00:00Z
Abbeyfield Thirsk & Sowerby Society Limited (The),Public Non-Financial Corporation,S.11001,1996-07-24T00:00:00Z
Abbeyfield Tiverton Society Limited (The),Public Non-Financial Corporation,S.11001,1996-07-24T00:00:00Z
Abbeyfield Uxbridge Society Limited (The),Public Non-Financial Corporation,S.11001,1996-07-24T00:00:00Z
Abbeyfield Wales Society Ltd,Public Non-Financial Corporation,S.11001,1996-07-24T00:00:00Z
Abbeyfield Wallasey Society (The),Public Non-Financial Corporation,S.11001,1996-07-24T00:00:00Z
Abbeyfield Wessex Society Limited,Public Non-Financial Corporation,S.11001,1996-07-24T00:00:00Z
Abbeyfield Wey Valley Society Limited,Public Non-Financial Corporation,S.11001,1996-07-24T00:00:00Z
Abbeyfield Whitehaven Society Limited (The),Public Non-Financial Corporation,S.11001,1996-07-24T00:00:00Z
Abbeyfield Widnes Society Limited (The),Public Non-Financial Corporation,S.11001,1996-07-24T00:00:00Z
Abbeyfield Winchester Society Limited (The),Public Non-Financial Corporation,S.11001,1996-07-24T00:00:00Z
Abbeyfield Worcester Society Limited (The),Public Non-Financial Corporation,S.11001,1996-07-24T00:00:00Z
Abbeyfield Wrexham Society Ltd,Public Non-Financial Corporation,S.11001,1996-07-24T00:00:00Z
Abbeyfield York Society Limited (The),Public Non-Financial Corporation,S.11001,1996-07-24T00:00:00Z
Abeona Housing Co-operative Limited,Public Non-Financial Corporation,S.11001,1996-07-24T00:00:00Z
Aberdeen City Council,Local Government,S.1313,NA
Aberdeen Harbour Board,Former Public Non-Financial Corporation,S.11001,2015-12-02T00:00:00Z
Aberdeen Soroptimist Housing Society Ltd,Public Non-Financial Corporation,S.11001,2001-07-18T00:00:00Z
Aberdeen Western Peripheral Route (AWPR) Special purpose Vehicles (SPVs),Central Government,S.1311,2014-12-11T00:00:00Z
Aberdeenshire Council,Local Government,S.1313,NA
Aberford Almshouses Trust,Public Non-Financial Corporation,S.11001,1996-07-24T00:00:00Z
Abertawe Bro Morgannwg University Health Board,Central Government,S.1311,2009-06-01T00:00:00Z
Abertay Housing Association Ltd,Public Non-Financial Corporation,S.11001,2001-07-18T00:00:00Z
ABF The Soldiers Charity,Former Central Government,S.1311,2013-03-01T00:00:00Z
Ability Housing Association,Public Non-Financial Corporation,S.11001,1996-07-24T00:00:00Z
ABN Amro Bank NV,Public Financial Corporation,S.12201,NA
Abronhill Housing Association Ltd,Public Non-Financial Corporation,S.11001,2001-07-18T00:00:00Z
Academies (En Bloc),Central Government,S.1311,2002-07-01T00:00:00Z
Academy Trusts (En Bloc),Central Government,S.1311,NA
Accent Corporate Services Limited,Public Non-Financial Corporation,S.11001,1996-07-24T00:00:00Z
Accent Group Limited,Public Non-Financial Corporation,S.11001,1996-07-24T00:00:00Z
Accent Housing Limited,Public Non-Financial Corporation,S.11001,1996-07-24T00:00:00Z
Accent Nene Limited,Public Non-Financial Corporation,S.11001,1996-07-24T00:00:00Z
Accent Peerless Limited,Public Non-Financial Corporation,S.11001,1996-07-24T00:00:00Z
Access Homes Housing Association Limited,Public Non-Financial Corporation,S.11001,1996-07-24T00:00:00Z
Acclaim Housing Limited,Public Non-Financial Corporation,S.11001,1996-07-24T00:00:00Z
AccommodationYes Limited,Public Non-Financial Corporation,S.11001,1996-07-24T00:00:00Z
Accord Housing Association Limited,Public Non-Financial Corporation,S.11001,1996-07-24T00:00:00Z
Accountant General of the Senior Courts,"CG Funds, Accounts, Courts and Posts",S.1311,NA
Accountant General of the Supreme Court,"CG Funds, Accounts, Courts and Posts",S.1311,NA
Accounts Commission for Scotland,Central Government,S.1311,NA
Acis Group Limited,Public Non-Financial Corporation,S.11001,1996-07-24T00:00:00Z
Action Housing and Support Limited,Public Non-Financial Corporation,S.11001,1996-07-24T00:00:00Z
Actis,Public Non-Financial Corporation,S.11001,NA
Adactus Housing Association Limited,Public Non-Financial Corporation,S.11001,1996-07-24T00:00:00Z
Adactus Housing Group Limited,Public Non-Financial Corporation,S.11001,1996-07-24T00:00:00Z
Adam and Company plc,Public Financial Corporation,S.12201,NA
Addiscombe Catholic Housing Association Limited,Public Non-Financial Corporation,S.11001,1996-07-24T00:00:00Z
Adler Housing,Public Non-Financial Corporation,S.11001,1996-07-24T00:00:00Z
Administration of Radioactive Substances Advisory Committee,Central Government,S.1311,NA
Adullam Homes Housing Association Limited,Public Non-Financial Corporation,S.11001,1996-07-24T00:00:00Z
Adult Learning Inspectorate,Former Central Government,S.1311,NA
Adur District Council,Local Government,S.1313,NA
Advance Housing and Support Limited,Public Non-Financial Corporation,S.11001,1996-07-24T00:00:00Z
Advantage - West Midlands,Former Central Government,S.1311,2012-07-01T00:00:00Z
Adventure Activities Licensing Authority/TQS Ltd,Central Government,S.1311,NA
Advisory Board on Fair Trading in Telecommunications,Former Central Government,S.1311,NA
Advisory Board on Family Law,Former Central Government,S.1311,2003-08-01T00:00:00Z
Advisory Board on Restricted Patients,Former Central Government,S.1311,NA
Advisory Board on Sustainable Development,Former Central Government,S.1311,NA
Advisory Board on the Registration of Homeopathic Products,Central Government,S.1311,NA
Advisory Committee for Disabled People in Employment and Training,Former Central Government,S.1311,2002-04-01T00:00:00Z
Advisory Committee for the Joint Environmental Markets Unit,Former Central Government,S.1311,NA
Advisory Committee for Wales,Central Government,S.1311,NA
Advisory Committee of the Therapeutic Professions Allied to Medicine,Former Central Government,S.1311,NA
Advisory Committee on Advertising,Former Central Government,S.1311,2008-01-01T00:00:00Z
Advisory Committee on Animal Feedingstuffs,Central Government,S.1311,NA
Advisory Committee on Arbitration Law,Former Central Government,S.1311,NA
Advisory Committee on Borderline Substances,Central Government,S.1311,NA
Advisory Committee on Breast Cancer Screening,Former Central Government,S.1311,NA
Advisory Committee on Business and the Environment,Central Government,S.1311,NA
Advisory Committee on Business Appointments,Central Government,S.1311,NA
Advisory Committee on Cleaner Coal Technology,Former Central Government,S.1311,NA
Advisory Committee on Conscientious Objectors,Central Government,S.1311,NA
Advisory Committee on Consumer Products and the Environment,Central Government,S.1311,NA
Advisory Committee on Dangerous Pathogens,Central Government,S.1311,NA
Advisory Committee on Dental Establishments,Former Central Government,S.1311,NA
Advisory Committee on Design Quality in the NHS,Former Central Government,S.1311,NA
Advisory Committee on Distinction Awards,Central Government,S.1311,NA
Advisory Committee on Genetic Testing,Former Central Government,S.1311,NA
Advisory Committee on Hazardous Substances,Former Central Government,S.1311,2012-07-01T00:00:00Z
Advisory Committee on Historic Wreck Sites,Former Central Government,S.1311,2011-03-01T00:00:00Z
Advisory Committee on Juvenile Court Lay Panel (Northern Ireland),Former Central Government,S.1311,2005-04-01T00:00:00Z
Advisory Committee on Legal Education and Conduct,Former Central Government,S.1311,NA
Advisory Committee on Lifelong Learning Targets,Former Central Government,S.1311,NA
Advisory Committee on National Health Service Drugs,Central Government,S.1311,NA
Advisory Committee on Novel Foods and Processes,Central Government,S.1311,NA
Advisory Committee on Overseas Economic and Social Research,Former Central Government,S.1311,2001-01-01T00:00:00Z
Advisory Committee on Packaging,Central Government,S.1311,NA
Advisory Committee on Pesticides,Central Government,S.1311,NA
Advisory Committee on Plant and Machinery,Former Central Government,S.1311,NA
Advisory Committee on Releases to the Environment,Central Government,S.1311,NA
Advisory Committee on Service Candidates,Former Central Government,S.1311,NA
Advisory Committee on Sites of Special Scientific Interest,Former Central Government,S.1311,2011-04-01T00:00:00Z
Advisory Committee on Telecommunications for Disabled and Elderly People (DIEL),Central Government,S.1311,NA
Advisory Committee on the Government Art Collection,Central Government,S.1311,NA
Advisory Committee on the Microbiological safety of Food,Central Government,S.1311,NA
Advisory Committee on Work-Life Balance,Former Central Government,S.1311,NA
Advisory Committees on General Commissioners of Income Tax,Central Government,S.1311,NA
Advisory Committees on General Commissioners of Income Tax (Northern Ireland),Former Central Government,S.1311,2009-04-01T00:00:00Z
Advisory Committees on Justices of the Peace (Northern Ireland),Former Central Government,S.1311,2005-06-01T00:00:00Z
Advisory Committees on Justices of the Peace in England and Wales,Central Government,S.1311,NA
"Advisory Committees on Justices of the Peace in Lancashire, Greater Manchester and Merseyside",Central Government,S.1311,NA
Advisory Conciliation and Arbitration Service,Central Government,S.1311,NA
Advisory Council on Libraries,Former Central Government,S.1311,NA
Advisory Council on National Records and Archives,Central Government,S.1311,2004-04-01T00:00:00Z
Advisory Council on Public Records,Former Central Government,S.1311,2004-04-01T00:00:00Z
Advisory Council on the Misuse of Drugs,Central Government,S.1311,NA
Advisory Group on Hepatitis,Central Government,S.1311,NA
Advisory Group on Military Medicine,Central Government,S.1311,2008-08-01T00:00:00Z
Advisory Panel on Standards for the Planning Inspectorate,Former Central Government,S.1311,2010-06-01T00:00:00Z
AEA Technology,Former Public Corporation,S.11001,NA
Aelwyd Housing Association Ltd,Public Non-Financial Corporation,S.11001,1996-07-24T00:00:00Z
Aerospace Committee,Former Central Government,S.1311,NA
Affinity Sutton Homes Limited,Public Non-Financial Corporation,S.11001,1996-07-24T00:00:00Z
Agamemnon Housing Association Limited,Public Non-Financial Corporation,S.11001,1996-07-24T00:00:00Z
Age Concern Wiltshire,Local Government,S.1313,NA
Aged Merchant Seamen's Homes,Public Non-Financial Corporation,S.11001,1996-07-24T00:00:00Z
Aggregator Vehicle PLC,Central Government,S.1311,2014-08-08T00:00:00Z
Agricultural Development and Advisory Service,Former Central Government,S.1311,NA
Agricultural Dwelling House Advisory Committees (England) (ADHAC),Former Central Government,S.1311,2013-12-01T00:00:00Z
Agricultural Dwelling House Advisory Committees (Wales),Former Central Government,S.1311,2007-03-01T00:00:00Z
Agricultural Land Tribunal (Wales),Central Government,S.1311,NA
Agricultural Land Tribunals (England),Former Central Government,S.1311,2013-07-01T00:00:00Z
Agricultural Research Institute of Northern Ireland,Former Central Government,S.1311,2006-03-01T00:00:00Z
Agricultural Wages Board for England and Wales,Former Central Government,S.1311,2013-06-01T00:00:00Z
Agricultural Wages Board for Northern Ireland,Central Government,S.1311,NA
Agricultural Wages Committees for England,Former Central Government,S.1311,2013-12-01T00:00:00Z
Agricultural Wages Committees for Wales,Former Central Government,S.1311,2007-03-01T00:00:00Z
Agriculture and Environment Biotechnology Commission,Former Central Government,S.1311,NA
Agriculture and Horticulture Development Board,Central Government,S.1311,NA
Agri-Food & Biosciences Institute,Central Government,S.1311,2006-04-01T00:00:00Z
Agudas Israel Housing Association Limited,Public Non-Financial Corporation,S.11001,1996-07-24T00:00:00Z
Air Safety Support International Ltd,Central Government,S.1311,2000-11-01T00:00:00Z
Air Travel Trust,Central Government,S.1311,2008-04-01T00:00:00Z
Airborne Particles Expert Group,Central Government,S.1311,NA
Aire Valley Finance (No2) plc,Public Financial Corporation,S.12501,NA
Aire Valley Homes Leeds,Public Non-Financial Corporation,S.11001,NA
Aire Valley Mortgages 2004-1 plc,Public Financial Corporation,S.12501,NA
Aire Valley Mortgages 2005-1 plc,Public Financial Corporation,S.12501,NA
Aire Valley Mortgages 2006-1 plc,Public Financial Corporation,S.12501,NA
Aire Valley Mortgages 2007-1 plc,Public Financial Corporation,S.12501,NA
Aire Valley Mortgages 2007-2 plc,Public Financial Corporation,S.12501,NA
Aire Valley Mortgages 2008-1 plc,Public Financial Corporation,S.12501,NA
Aire Valley Warehousing 3 Limited,Public Financial Corporation,S.12501,NA
Airport Advertising Ltd (s MA),Public Non-Financial Corporation,S.11001,2013-02-01T00:00:00Z
Airport Driving Range Company Limited,Public Non-Financial Corporation,S.11001,2013-11-22T00:00:00Z
Airport Management Consultants Ltd (s MA),Former Public Corporation,S.11001,2006-07-01T00:00:00Z
Airport Management Services Limited (s H&IE),Central Government,S.1311,NA
Airport Petroleum Ltd (s MA),Public Non-Financial Corporation,S.11001,2013-02-01T00:00:00Z
Airport Trading Ltd (s MA),Former Public Corporation,S.11001,2006-07-01T00:00:00Z
AKSA Housing Association Limited,Public Non-Financial Corporation,S.11001,1996-07-24T00:00:00Z
Albion Housing Co-operative Limited,Public Non-Financial Corporation,S.11001,1996-07-24T00:00:00Z
Albyn Housing Society Ltd,Public Non-Financial Corporation,S.11001,2001-07-18T00:00:00Z
Alcohol Education and Research Council,Former Central Government,S.1311,2012-07-01T00:00:00Z
Aldwyck East Housing Association Limited,Public Non-Financial Corporation,S.11001,1996-07-24T00:00:00Z
Aldwyck Housing Group Limited,Public Non-Financial Corporation,S.11001,1996-07-24T00:00:00Z
Alice Coralie Glyn Homes,Public Non-Financial Corporation,S.11001,1996-07-24T00:00:00Z
Allandale Care Group Limited,Public Non-Financial Corporation,S.11001,1996-07-24T00:00:00Z
