London Borough of Merton,Local Government,S.1313,NA
London Borough of Newham,Local Government,S.1313,NA
London Borough of Redbridge,Local Government,S.1313,NA
London Borough of Richmond upon Thames,Local Government,S.1313,NA
London Borough of Southwark,Local Government,S.1313,NA
London Borough of Sutton,Local Government,S.1313,NA
London Borough of Tower Hamlets,Local Government,S.1313,NA
London Borough of Waltham Forest,Local Government,S.1313,NA
London Borough of Wandsworth,Local Government,S.1313,NA
London Boroughs (En Bloc),Local Government,S.1313,NA
London Bus Services Ltd (s.TfL),Public Non-Financial Corporation,S.11001,NA
London Buses Ltd (s.TfL),Local Government,S.1313,1905-06-22T00:00:00Z
London Community Rehabilitation Company (CRC),Former Central Government,S.1311,2015-02-01T00:00:00Z
London Cyrenians Housing Limited,Public Non-Financial Corporation,S.11001,1996-07-24T00:00:00Z
London Development Agency,Former Local Government,S.1313,2012-03-01T00:00:00Z
London District Housing Association Limited,Public Non-Financial Corporation,S.11001,1996-07-24T00:00:00Z
London Docklands Development Corporation - (LDDC),Former Public Corporation,S.11001,NA
"London Fire and Emergency Planning Authority, The",Local Government,S.1313,NA
London Housing Trust,Public Non-Financial Corporation,S.11001,1996-07-24T00:00:00Z
London Legacy Development Corporation,Local Government,S.1313,2012-03-01T00:00:00Z
London Luton Airport Ltd,Local Government,S.1313,1998-08-01T00:00:00Z
London Olympic Bid Company / London 2012 Ltd,Former Central Government,S.1311,2010-04-01T00:00:00Z
London Organising Committee of the Olympic Games (LOCOG),Former Public Corporation,S.11001,2013-06-01T00:00:00Z
London Pensions Fund Authority (operations),Public Non-Financial Corporation,S.11001,NA
London Region Electricity Consumers Committee,Former Central Government,S.1311,NA
London Regional Transport,Former Public Corporation,S.11001,NA
London River Services Ltd (s.TfL),Public Non-Financial Corporation,S.11001,NA
London Strategic Housing Limited,Public Non-Financial Corporation,S.11001,1996-07-24T00:00:00Z
London Thames Gateway Development Corporation,Former Central Government,S.1311,2013-02-01T00:00:00Z
London Transport Museum (s.TfL),Local Government,S.1313,1905-06-22T00:00:00Z
London Transport Museum (Trading) Ltd,Public Non-Financial Corporation,S.11001,2008-04-01T00:00:00Z
London Transport Users Committee (LTUC),Local Government,S.1313,NA
London Underground Ltd,Public Non-Financial Corporation,S.11001,NA
London Waste and Recycling Board,Local Government,S.1313,NA
Londonderry Port and Harbour Commissioners,Public Non-Financial Corporation,S.11001,NA
Longdendale Housing Society Limited,Public Non-Financial Corporation,S.11001,1996-07-24T00:00:00Z
Longhurst & Havelok Homes,Public Non-Financial Corporation,S.11001,1996-07-24T00:00:00Z
Longhurst Group Limited,Public Non-Financial Corporation,S.11001,1996-07-24T00:00:00Z
Longlife Housing Co-operative Limited,Public Non-Financial Corporation,S.11001,1996-07-24T00:00:00Z
Look Ahead Care and Support Ltd,Public Non-Financial Corporation,S.11001,1996-07-24T00:00:00Z
Lord Chancellor's Department,Former Central Government,S.1311,2005-06-01T00:00:00Z
Lord Chancellor's Legal Aid Advisory Committee (Northern Ireland),Former Central Government,S.1311,2006-03-01T00:00:00Z
"Lord Chief Justice, The","CG Funds, Accounts, Courts and Posts",S.1311,NA
Lord Mayor of Portsmouth's Coronation Homes Ltd.,Public Non-Financial Corporation,S.11001,1996-07-24T00:00:00Z
Loreburn Housing Association Ltd,Public Non-Financial Corporation,S.11001,2001-07-18T00:00:00Z
Loretto Housing Association Ltd,Public Non-Financial Corporation,S.11001,2001-07-18T00:00:00Z
Lothian Buses plc,Public Non-Financial Corporation,S.11001,NA
Loughs Agency,Central Government,S.1311,1999-12-01T00:00:00Z
Louisa Cottages Charity,Public Non-Financial Corporation,S.11001,1996-07-24T00:00:00Z
Louisa Lilley Almshouses (The),Public Non-Financial Corporation,S.11001,1996-07-24T00:00:00Z
Low Carbon Contracts Company,Central Government,S.1311,2014-08-01T00:00:00Z
Low Level Waste Repository (LLWR) Ltd,Central Government,S.1311,2008-04-01T00:00:00Z
Low Pay Commission,Central Government,S.1311,NA
Lowestoft Church & Town Almshouse Charity,Public Non-Financial Corporation,S.11001,1996-07-24T00:00:00Z
LUL Nominee BCV Ltd,Local Government,S.1313,2008-05-01T00:00:00Z
LUL Nominee SSL Ltd,Local Government,S.1313,2008-05-01T00:00:00Z
Luminus Group Limited,Public Non-Financial Corporation,S.11001,1996-07-24T00:00:00Z
Luminus Homes Limited,Public Non-Financial Corporation,S.11001,1996-07-24T00:00:00Z
Lune Valley Rural Housing Association Limited,Public Non-Financial Corporation,S.11001,1996-07-24T00:00:00Z
Luton Borough Council,Local Government,S.1313,NA
Luton Community Housing Ltd,Public Non-Financial Corporation,S.11001,1996-07-24T00:00:00Z
Luton International Airport Ltd,Former Public Corporation,S.11001,1998-08-01T00:00:00Z
Lydney War Memorial Trust,Public Non-Financial Corporation,S.11001,1996-07-24T00:00:00Z
Lygon Almshouses (The),Public Non-Financial Corporation,S.11001,1996-07-24T00:00:00Z
Lyme Regis Port,Local Government,S.1313,NA
Lyng Community Association,Public Non-Financial Corporation,S.11001,1996-07-24T00:00:00Z
Lynsted Housing Co-operative Limited,Public Non-Financial Corporation,S.11001,1996-07-24T00:00:00Z
Lyvennet Community Trust,Public Non-Financial Corporation,S.11001,1996-07-24T00:00:00Z
Macaulay Land Use Research Institute,Former Central Government,S.1311,2011-04-01T00:00:00Z
Macaulay Research and Consultancy Services Ltd,Public Non-Financial Corporation,S.11001,NA
Macduff Port,Local Government,S.1313,NA
MacFarlane Trust,"CG Funds, Accounts, Courts and Posts",S.1311,NA
Magistrates Courts (En Bloc),Central Government,S.1311,2005-04-01T00:00:00Z
Magistrates Courts Rule Committee,Former Central Government,S.1311,2012-09-01T00:00:00Z
Magistrates Courts Rules Committee (Northern Ireland),Central Government,S.1311,1905-06-03T00:00:00Z
Magna Housing Association Limited,Public Non-Financial Corporation,S.11001,1996-07-24T00:00:00Z
Magna Housing Group Limited,Public Non-Financial Corporation,S.11001,1996-07-24T00:00:00Z
Magna Housing Limited,Public Non-Financial Corporation,S.11001,1996-07-24T00:00:00Z
Magna West Somerset Housing Association Limited,Public Non-Financial Corporation,S.11001,1996-07-24T00:00:00Z
Magnox Electric Ltd (s BNFL),Former Central Government,S.1311,2008-10-01T00:00:00Z
Magnox Electric plc,Former Public Corporation,S.11001,2005-04-01T00:00:00Z
Magnox Limited,Central Government,S.1311,2011-01-01T00:00:00Z
Magnox North Ltd. (s. BNFL),Former Central Government,S.1311,2011-01-01T00:00:00Z
Magnox South Ltd. (s. BNFL),Former Central Government,S.1311,2011-01-01T00:00:00Z
Maidstone Borough Council,Local Government,S.1313,NA
Major Housing Association Ltd,Public Non-Financial Corporation,S.11001,1996-07-24T00:00:00Z
Maldon District Council,Local Government,S.1313,NA
Maldon Housing Association Limited,Public Non-Financial Corporation,S.11001,1996-07-24T00:00:00Z
Malins Affordable Homes Limited,Public Non-Financial Corporation,S.11001,1996-07-24T00:00:00Z
Mallaig Harbour,Former Public Non-Financial Corporation,S.11001,2015-12-02T00:00:00Z
Malvern Hills District Council,Local Government,S.1313,NA
Manchester (Barton) Aerodrome,Local Government,S.1313,NA
Manchester Airport Building Ltd (s MA),Former Public Corporation,S.11001,2006-07-01T00:00:00Z
Manchester Airport Employment Services Ltd (s MA),Former Public Corporation,S.11001,2006-07-01T00:00:00Z
Manchester Airport Finance Holdings Ltd,Public Non-Financial Corporation/Public Non-Financial Corporation (see notes in tab),S.11001/3,2013-02-01T00:00:00Z
Manchester Airport Finance Ltd (s MA),Former Public Corporation,S.11001,2006-07-01T00:00:00Z
Manchester Airport Group Finance Ltd,Public Non-Financial Corporation/Public Non-Financial Corporation (see notes in tab),S.11001/3,2013-02-01T00:00:00Z
Manchester Airport Group plc,Public Non-Financial Corporation/Public Non-Financial Corporation (see notes in tab),S.11001/3,2013-02-01T00:00:00Z
Manchester Airport Group Property Developments Ltd,Public Non-Financial Corporation/Public Non-Financial Corporation (see notes in tab),S.11001/3,2013-02-01T00:00:00Z
Manchester Airport Group Property Services Ltd,Public Non-Financial Corporation/Public Non-Financial Corporation (see notes in tab),S.11001/3,2013-02-01T00:00:00Z
Manchester Airport Holdings Limited,Public Non-Financial Corporation/Public Non-Financial Corporation (see notes in tab),S.12701/03,2013-02-01T00:00:00Z
Manchester Airport plc,Public Non-Financial Corporation/Public Non-Financial Corporation (see notes in tab),S.11001/3,2013-02-01T00:00:00Z
Manchester and District Housing Association Limited,Public Non-Financial Corporation,S.11001,1996-07-24T00:00:00Z
Manchester City Council,Local Government,S.1313,NA
Manchester Investment and Development Agency Service Ltd,Local Government,S.1313,NA
Manchester Jewish Housing Association,Public Non-Financial Corporation,S.11001,1996-07-24T00:00:00Z
Manchester Unity Housing Association Limited,Public Non-Financial Corporation,S.11001,1996-07-24T00:00:00Z
Manningham Housing Association Limited,Public Non-Financial Corporation,S.11001,1996-07-24T00:00:00Z
Manor Estates Housing Association Ltd,Public Non-Financial Corporation,S.11001,2001-07-18T00:00:00Z
Manor Housing Association Limited,Public Non-Financial Corporation,S.11001,1996-07-24T00:00:00Z
Mansfield District Council,Local Government,S.1313,NA
Mansfield Road (Nottingham) Baptist Housing Association Limited,Public Non-Financial Corporation,S.11001,1996-07-24T00:00:00Z
Mansfields (Norwich) Ltd - (s Remploy Ltd ),Former Public Corporation,S.11001,NA
Mansfields Group Ltd - (s Remploy Ltd),Former Public Corporation,S.11001,NA
Margaret Colquhoun Chavasse Almshouses,Public Non-Financial Corporation,S.11001,1996-07-24T00:00:00Z
Margaret Hydes Charity,Public Non-Financial Corporation,S.11001,1996-07-24T00:00:00Z
Margaret Jane Ashley Almshouse Charity (The),Public Non-Financial Corporation,S.11001,1996-07-24T00:00:00Z
Marine and Aviation (War Risks) Fund,"CG Funds, Accounts, Courts and Posts",S.1311,NA
Marine and Fisheries Agency,Former Central Government,S.1311,NA
Marine Management Organisation,Central Government,S.1311,NA
Marine Safety Agency,Former Central Government,S.1311,NA
Marine Scotland,Central Government,S.1311,2009-04-01T00:00:00Z
Maritime and Coastguard Agency,Central Government,S.1311,NA
Maritime Second Housing Association Ltd,Public Non-Financial Corporation,S.11001,1996-07-24T00:00:00Z
Marlborough & District Housing Association Limited,Public Non-Financial Corporation,S.11001,1996-07-24T00:00:00Z
Marsden Memorial Homes,Public Non-Financial Corporation,S.11001,1996-07-24T00:00:00Z
Marshall Aid Commemoration Commission,Central Government,S.1311,NA
Marshfield Consolidated Charities,Public Non-Financial Corporation,S.11001,1996-07-24T00:00:00Z
Martlet Homes Limited,Public Non-Financial Corporation,S.11001,1996-07-24T00:00:00Z
Mary Hannah Almshouses,Public Non-Financial Corporation,S.11001,1996-07-24T00:00:00Z
Mary Hatch Almshouses with Diamond Jubilee Cottages,Public Non-Financial Corporation,S.11001,1996-07-24T00:00:00Z
Maryhill Housing Association Ltd,Public Non-Financial Corporation,S.11001,2001-07-18T00:00:00Z
Masonic Housing Association,Public Non-Financial Corporation,S.11001,1996-07-24T00:00:00Z
Master of the Rolls,"CG Funds, Accounts, Courts and Posts",S.1311,NA
May Day Permanent Housing Co-operative Limited,Public Non-Financial Corporation,S.11001,1996-07-24T00:00:00Z
Maynard Co-operative Housing Association Limited,Public Non-Financial Corporation,S.11001,1996-07-24T00:00:00Z
Mayor's Office for Policing and Crime,Local Government,S.1313,2012-01-01T00:00:00Z
Maze / Long Kesh Development Corporation,Central Government,S.1311,2012-09-01T00:00:00Z
Measurement Advisory Committee,Former Central Government,S.1311,NA
Meat and Livestock Commission (MLC),Former Central Government,S.1311,NA
Meat Hygiene Advisory Committee,Former Central Government,S.1311,2004-09-01T00:00:00Z
Meat Hygiene Appeals Tribunal for England and Wales,Central Government,S.1311,NA
Meat Hygiene Service,Former Central Government,S.1311,2010-04-01T00:00:00Z
Medical Appeal Tribunals Northern Ireland,Central Government,S.1311,NA
Medical Appeals Tribunal,Former Central Government,S.1311,NA
Medical Devices Agency,Former Central Government,S.1311,NA
Medical Practices Committee,Former Central Government,S.1311,NA
Medical Research Council,Central Government,S.1311,NA
Medical Research Council Technology,Public Non-Financial Corporation,S.11001,2010-04-01T00:00:00Z
Medical Supplies Agency,Former Central Government,S.1311,2005-03-01T00:00:00Z
Medical Workforce Standing Advisory Committee,Former Central Government,S.1311,1905-06-25T00:00:00Z
Medicines and Healthcare products Regulatory Agency,Public Non-Financial Corporation,S.11001,NA
Medicines Commission,Central Government,S.1311,NA
Medway Council,Local Government,S.1313,NA
Melin Homes Limited,Public Non-Financial Corporation,S.11001,1996-07-24T00:00:00Z
Melton Borough Council,Local Government,S.1313,NA
Melville Housing Association Ltd,Public Non-Financial Corporation,S.11001,2001-07-18T00:00:00Z
Mendip District Council,Local Government,S.1313,NA
Mental Health Act Commission,Former Central Government,S.1311,2009-03-01T00:00:00Z
Mental Health Commission for Northern Ireland,Former Central Government,S.1311,2009-04-01T00:00:00Z
Mental Health Review Tribunal,Central Government,S.1311,NA
Mental Health Review Tribunal for Northern Ireland,Central Government,S.1311,NA
Mental Health Review Tribunal for Wales,Central Government,S.1311,NA
Mental Welfare Commission for Scotland,Central Government,S.1311,NA
Merchant Navy Reserve,Former Central Government,S.1311,NA
Merchant Taylors' Boone's Charity (The),Public Non-Financial Corporation,S.11001,1996-07-24T00:00:00Z
Mercian Housing Association Limited,Public Non-Financial Corporation,S.11001,1996-07-24T00:00:00Z
Mercy House of William Fry,Public Non-Financial Corporation,S.11001,1996-07-24T00:00:00Z
Meres and Mosses Housing Association,Public Non-Financial Corporation,S.11001,1996-07-24T00:00:00Z
Merlin Housing Society Limited,Public Non-Financial Corporation,S.11001,1996-07-24T00:00:00Z
Mersea Island Trust,Public Non-Financial Corporation,S.11001,1996-07-24T00:00:00Z
Merseyside and North Wales Region Electricity Consumers Committee,Former Central Government,S.1311,NA
Merseyside Community Rehabilitation Company (CRC),Former Central Government,S.1311,2015-02-01T00:00:00Z
Merseyside Development Corporation,Former Public Corporation,S.11001,NA
Merseyside Passenger Transport Executive - (s PTE),Local Government,S.1313,1998-04-01T00:00:00Z
Merseyside Waste Authority,Local Government,S.1313,1986-01-01T00:00:00Z
Merseytravel - (Merseyside Passenger Transport Executive),Former Public Corporation,S.11001,NA
Merthyr Tydfil County Borough Council,Local Government,S.1313,NA
Merthyr Tydfil Housing Association Limited,Public Non-Financial Corporation,S.11001,1996-07-24T00:00:00Z
Merthyr Valleys Homes Limited,Public Non-Financial Corporation,S.11001,1996-07-24T00:00:00Z
Merton Priory Homes,Public Non-Financial Corporation,S.11001,1996-07-24T00:00:00Z
Meteorological Office,Public Non-Financial Corporation,S.11001,NA
Methodist Homes Housing Association Limited,Public Non-Financial Corporation,S.11001,1996-07-24T00:00:00Z
Metronet Rail BCV Holdings Ltd,Former Public Corporation,S.11001,1905-07-03T00:00:00Z
Metronet Rail SSL Holdings Ltd,Former Public Corporation,S.11001,1905-07-03T00:00:00Z
Metropolitan Benefit Societies' Almshouses,Public Non-Financial Corporation,S.11001,1996-07-24T00:00:00Z
Metropolitan Housing Trust Limited,Public Non-Financial Corporation,S.11001,1996-07-24T00:00:00Z
Metropolitan Police Authority,Former Local Government,S.1313,2012-01-01T00:00:00Z
Metropolitan Police Committee,Former Central Government,S.1311,2000-01-01T00:00:00Z
Microbiological Research Authority,Former Central Government,S.1311,NA
Mid and East Antrim Borough Council,Local Government,S.1313,NA
Mid Devon District Council,Local Government,S.1313,NA
Mid Suffolk District Council,Local Government,S.1313,NA
Mid Sussex District Council,Local Government,S.1313,NA
Mid Ulster District Council,Local Government,S.1313,NA
Middle Level Commissioners,Local Government,S.1313,NA
Middlesbrough Council,Local Government,S.1313,NA
Midland Heart Limited,Public Non-Financial Corporation,S.11001,1996-07-24T00:00:00Z
Midlands Region Electricity Consumers Committee,Former Central Government,S.1311,NA
Midlothian Council,Local Government,S.1313,NA
Mid-Wales Housing Association Ltd,Public Non-Financial Corporation,S.11001,1996-07-24T00:00:00Z
Mile End Housing Co-operative Limited (The),Public Non-Financial Corporation,S.11001,1996-07-24T00:00:00Z
Milford Haven Port Authority,Public Non-Financial Corporation,S.11001,NA
Military Survey,Former Central Government,S.1311,NA
Milk Development Council (MDC),Former Central Government,S.1311,NA
Mill Street Co-op Ltd,Public Non-Financial Corporation,S.11001,1996-07-24T00:00:00Z
Millat Asian Housing Association Limited,Public Non-Financial Corporation,S.11001,1996-07-24T00:00:00Z
Milldale Housing Co-operative Limited,Public Non-Financial Corporation,S.11001,1996-07-24T00:00:00Z
Millennium Commission,Former Central Government,S.1311,NA
Miller Walk Housing Co-operative Limited,Public Non-Financial Corporation,S.11001,1996-07-24T00:00:00Z
Milnbank Housing Association Ltd,Public Non-Financial Corporation,S.11001,2001-07-18T00:00:00Z
Milton Keynes - (s NTC),Former Central Government,S.1311,NA
Milton Keynes Council,Local Government,S.1313,NA
Minehead Port,Local Government,S.1313,NA
Mineworker's Pension Scheme,Public Pension Funds,S.12901,1994-10-31T00:00:00Z
Ministry of Defence,Central Government,S.1311,NA
Ministry of Defence Police & Guarding Agency,Former Central Government,S.1311,2012-04-01T00:00:00Z
Ministry of Justice,Central Government,S.1311,NA
Minster Housing Co-operative Limited,Public Non-Financial Corporation,S.11001,1996-07-24T00:00:00Z
Miss Rutland's Almshouses,Public Non-Financial Corporation,S.11001,1996-07-24T00:00:00Z
Mission Housing Association Limited,Public Non-Financial Corporation,S.11001,1996-07-24T00:00:00Z
Misuse of Drugs Advisory Board,Central Government,S.1311,NA
Misuse of Drugs Professional Panel,Central Government,S.1311,NA
Misuse of Drugs Tribunal,Central Government,S.1311,NA
Mitre Housing Association Limited,Public Non-Financial Corporation,S.11001,1996-07-24T00:00:00Z
MNE Ltd.,Public Non-Financial Corporation,S.11001,NA
Moat Farm Housing Co-operative Limited,Public Non-Financial Corporation,S.11001,1996-07-24T00:00:00Z
Moat Homes Limited,Public Non-Financial Corporation,S.11001,1996-07-24T00:00:00Z
Moat Housing Group Limited,Public Non-Financial Corporation,S.11001,1996-07-24T00:00:00Z
Mole Valley District Council,Local Government,S.1313,NA
Mole Valley Housing Association Limited,Public Non-Financial Corporation,S.11001,1996-07-24T00:00:00Z
Molendinar Park Housing Association,Public Non-Financial Corporation,S.11001,2001-07-18T00:00:00Z
Molyneux Almshouses (The),Public Non-Financial Corporation,S.11001,1996-07-24T00:00:00Z
Money Advice Service,Central Government,S.1311,2011-04-01T00:00:00Z
Monitor  Independent Regulator of NHS Foundation Trusts,Central Government,S.1311,NA
Monmouth Road Housing Co-operative Limited,Public Non-Financial Corporation,S.11001,1996-07-24T00:00:00Z
Monmouthshire County Council,Local Government,S.1313,NA
Monmouthshire Housing Association Limited,Public Non-Financial Corporation,S.11001,1996-07-24T00:00:00Z
Monopolies and Mergers Commission,Former Central Government,S.1311,NA
Montrose Port,Former Public Non-Financial Corporation,S.11001,2015-12-02T00:00:00Z
Moorlands Housing,Public Non-Financial Corporation,S.11001,1996-07-24T00:00:00Z
Moray Council,Local Government,S.1313,NA
Moredun Research Institute,Central Government,S.1311,NA
Mortgage Express,Public Financial Corporation,S.12201,NA
Mortlake Almshouse and Relief Charities,Public Non-Financial Corporation,S.11001,1996-07-24T00:00:00Z
Mossbank Homes Limited,Public Non-Financial Corporation,S.11001,1996-07-24T00:00:00Z
Mosscare Housing Limited,Public Non-Financial Corporation,S.11001,1996-07-24T00:00:00Z
Mount Green Housing Association Limited,Public Non-Financial Corporation,S.11001,1996-07-24T00:00:00Z
Mrs H Frances Le Personne Benevolent Trust,Public Non-Financial Corporation,S.11001,1996-07-24T00:00:00Z
Muir Group Housing Association Limited,Public Non-Financial Corporation,S.11001,1996-07-24T00:00:00Z
MuirCroft Housing Association Limited,Public Non-Financial Corporation,S.11001,1996-07-24T00:00:00Z
Muirhouse Housing Association Ltd,Public Non-Financial Corporation,S.11001,2001-07-18T00:00:00Z
Mulberry Housing Co-operative Limited,Public Non-Financial Corporation,S.11001,1996-07-24T00:00:00Z
Multimedia Ventures Ltd (50%) (sWS) (Associate),Former Public Non-Financial Corporation,S.11001,2013-06-13T00:00:00Z
Municipal & Owen Carter Almshouse Charities,Public Non-Financial Corporation,S.11001,1996-07-24T00:00:00Z
Municipal Charities,Public Non-Financial Corporation,S.11001,1996-07-24T00:00:00Z
Municipal Charities of Stratford-upon-Avon (The),Public Non-Financial Corporation,S.11001,1996-07-24T00:00:00Z
Museum of Kent Life Trust,Local Government,S.1313,NA
Museum of London,Local Government,S.1313,NA
Museum of Science and Industry in Manchester,Former Central Government,S.1311,2012-01-01T00:00:00Z
Museums and Galleries Commission,Former Central Government,S.1311,NA
Museums Libraries and Archives Council,Former Central Government,S.1311,2012-05-01T00:00:00Z
Musselburgh Port,Local Government,S.1313,NA
My Space Housing Solutions,Public Non-Financial Corporation,S.11001,1996-07-24T00:00:00Z
N.I.R Leasing Limited - (s NITHC),Public Non-Financial Corporation,S.11001,NA
N.I.R Travel Limited - (s NITHC),Public Non-Financial Corporation,S.11001,NA
NACRO,Public Non-Financial Corporation,S.11001,1996-07-24T00:00:00Z
Nacro Community Enterprises Limited,Public Non-Financial Corporation,S.11001,1996-07-24T00:00:00Z
Nairn Port,Local Government,S.1313,NA
National Advisory Council for the Employment of People with Disabilities,Former Central Government,S.1311,NA
National Air Traffic Services Ltd - (s CAA),Former Public Corporation,S.11001,NA
National Archives,Central Government,S.1311,NA
National Archives of Scotland,Former Central Government,S.1311,2011-04-01T00:00:00Z
National Army Museum,Central Government,S.1311,NA
National Assembly for Wales,Central Government,S.1311,NA
National Association of Citizens Advice Bureau (England and Wales) (The),Former Central Government,S.1311,2013-11-01T00:00:00Z
National Audit Office,Central Government,S.1311,NA
National Biological Standards Board (UK),Former Central Government,S.1311,2009-04-01T00:00:00Z
National Blood Authority,Former Public Corporation,S.11001,NA
"National Board for Nursing, Midwifery and Health Visiting for Northern Ireland",Former Central Government,S.1311,2002-04-01T00:00:00Z
"National Board for Nursing, Midwifery and Health Visiting for Scotland",Former Central Government,S.1311,2002-04-01T00:00:00Z
National Care Standards Commission,Former Central Government,S.1311,NA
National Clinical Assessment Authority (NCAA),Former Central Government,S.1311,2005-04-01T00:00:00Z
National College for School Leadership,Former Central Government,S.1311,2013-04-01T00:00:00Z
National College for Teaching and Leadership,Central Government,S.1311,2013-04-01T00:00:00Z
National Consumer Council,Former Central Government,S.1311,2008-04-01T00:00:00Z
National Consumers Consultative Committee (Electricity) (NCCC),Former Central Government,S.1311,NA
National Council for Education and Training for Wales,Central Government,S.1311,NA
National Council of Young Mens Christian Associations (Incorporated),Public Non-Financial Corporation,S.11001,1996-07-24T00:00:00Z
National Crime Agency,Central Government,S.1311,2013-10-01T00:00:00Z
National Crime Squad,Former Central Government,S.1311,2006-04-01T00:00:00Z
National Criminal Intelligence Service,Former Central Government,S.1311,2006-04-01T00:00:00Z
National Curriculum Council,Former Central Government,S.1311,NA
National Disability Council,Former Central Government,S.1311,NA
National Employer Advisory Board,Central Government,S.1311,NA
National Employment Panel,Former Central Government,S.1311,NA
National Employment Savings Trust Corporation (NEST),Public Financial Corporation,S.12901,NA
National Endowment for Science and Technology and the Arts (NESTA),Former Central Government,S.1311,2012-04-01T00:00:00Z
National Exhibition Centre Limited,Former Local Government,S.1313,2015-05-01T00:00:00Z
National Expert Group on Transboundary Air Pollution,Central Government,S.1311,NA
National Forest Company,Central Government,S.1311,NA
National Fraud Authority,Central Government,S.1311,2008-10-01T00:00:00Z
National Fuel Distributors Ltd - (s HI),Former Public Corporation,S.11001,NA
National Galleries of Scotland,Central Government,S.1311,NA
National Gallery,Central Government,S.1311,NA
National Health Service Business Services Authority,Central Government,S.1311,NA
National Health Service Central Register,Former Central Government,S.1311,NA
"National Health Service Commissioning Board, The",Central Government,S.1311,2012-10-01T00:00:00Z
National Health Service Estates,Public Non-Financial Corporation,S.11001,NA
National Health Service Foundation Trusts (England),Central Government,S.1311,NA
National Health Service Information Authority,Former Central Government,S.1311,2005-04-01T00:00:00Z
National Health Service Litigation Authority,Central Government,S.1311,NA
National Health Service Pensions Agency,Former Central Government,S.1311,NA
National Health Service Professionals South West,Former Central Government,S.1311,NA
National Health Service Supplies Authority,Former Central Government,S.1311,NA
