Cynon Taf Community Housing (2007) Limited,Public Non-Financial Corporation,S.11001,1996-07-24T00:00:00Z
Cyril Wood Memorial Trust (The),Public Non-Financial Corporation,S.11001,1996-07-24T00:00:00Z
Cyron Housing Co-operative Limited,Public Non-Financial Corporation,S.11001,1996-07-24T00:00:00Z
Dacorum Council,Local Government,S.1313,NA
Dairy Produce Quota Tribunal,Former Central Government,S.1311,NA
DairyCo Ltd,Central Government,S.1311,NA
Dale & Valley Homes Limited,Public Non-Financial Corporation,S.11001,1996-07-24T00:00:00Z
Dale and Valley Homes Ltd,Public Non-Financial Corporation,S.11001,NA
Dales Housing Limited,Public Non-Financial Corporation,S.11001,1996-07-24T00:00:00Z
Dalmuir Park Housing Association Ltd,Public Non-Financial Corporation,S.11001,2001-07-18T00:00:00Z
Dame Bertha Lopes Almshouses,Public Non-Financial Corporation,S.11001,1996-07-24T00:00:00Z
Danby Almshouse Charity,Public Non-Financial Corporation,S.11001,1996-07-24T00:00:00Z
Darent Housing Co-operative Limited,Public Non-Financial Corporation,S.11001,1996-07-24T00:00:00Z
Darlington Borough Council,Local Government,S.1313,NA
Darlington Housing Association Limited,Public Non-Financial Corporation,S.11001,1996-07-24T00:00:00Z
Dartford Almshouse Charity,Public Non-Financial Corporation,S.11001,1996-07-24T00:00:00Z
Dartford Borough Council,Local Government,S.1313,NA
Dartmoor National Park Authority,Local Government,S.1313,1996-06-01T00:00:00Z
Dartmoor Steering Group and Working Party,Former Central Government,S.1311,2006-04-01T00:00:00Z
Darwin Advisory Committee,Central Government,S.1311,NA
Dauntsey Almshouse Charity,Public Non-Financial Corporation,S.11001,1996-07-24T00:00:00Z
Daventry District Council,Local Government,S.1313,NA
David Henry Waring Home Trust (The),Public Non-Financial Corporation,S.11001,1996-07-24T00:00:00Z
David MacBrayne HR (UK) Ltd,Central Government,S.1311,2007-11-01T00:00:00Z
David MacBrayne Ltd,Central Government,S.1311,2006-07-01T00:00:00Z
Dawley Housing Co-operative Limited,Public Non-Financial Corporation,S.11001,1996-07-24T00:00:00Z
Day's & Atkinson's Almshouse Charity,Public Non-Financial Corporation,S.11001,1996-07-24T00:00:00Z
De Montfort Housing Society Limited,Public Non-Financial Corporation,S.11001,1996-07-24T00:00:00Z
Debt Management Account,"CG Funds, Accounts, Courts and Posts",S.1311,NA
Deer Commission for Scotland,Former Central Government,S.1311,2011-04-01T00:00:00Z
Defence Analytical Services Agency,Former Central Government,S.1311,2008-04-01T00:00:00Z
Defence Animal Centre,Former Central Government,S.1311,NA
Defence Aviation Repair Agency,Former Public Corporation,S.11001,NA
Defence Bills Agency,Former Central Government,S.1311,2007-04-01T00:00:00Z
Defence Codification Agency,Former Central Government,S.1311,NA
Defence Communications Services Agency,Former Central Government,S.1311,2007-04-01T00:00:00Z
Defence Dental Agency,Former Central Government,S.1311,2005-04-01T00:00:00Z
Defence Estates,Former Central Government,S.1311,2007-04-01T00:00:00Z
Defence Estates Organisation,Former Central Government,S.1311,NA
Defence Evaluation and Research Agency,Former Public Corporation,S.11001,NA
Defence Geographical and Imaging Intelligence Agency,Former Central Government,S.1311,2005-04-01T00:00:00Z
Defence Housing Executive,Former Central Government,S.1311,2004-04-01T00:00:00Z
Defence Intelligence and Security Agency,Former Central Government,S.1311,2005-04-01T00:00:00Z
Defence Medical Training Organisation,Former Central Government,S.1311,2008-04-01T00:00:00Z
Defence Nuclear Safety Committee,Central Government,S.1311,NA
Defence Postal and Courier Services Agency,Former Central Government,S.1311,NA
Defence Procurement Agency,Former Central Government,S.1311,2007-04-01T00:00:00Z
Defence Science and Technology Laboratory (The) (DSTL),Public Non-Financial Corporation,S.11001,NA
Defence Scientific Advisory Council,Central Government,S.1311,NA
Defence Secondary Care Agency,Former Central Government,S.1311,2003-04-01T00:00:00Z
Defence Storage and Distribution Agency,Former Central Government,S.1311,2010-07-01T00:00:00Z
Defence Support Group,Public Non-Financial Corporation,S.11001,NA
Defence Transport and Movement Executive,Former Central Government,S.1311,2007-04-01T00:00:00Z
Defence Vetting Agency,Former Central Government,S.1311,2011-10-01T00:00:00Z
"Defence, Clothing and Textiles Agency",Former Central Government,S.1311,2010-07-01T00:00:00Z
Delce Manor Housing Co-operative Limited,Public Non-Financial Corporation,S.11001,1996-07-24T00:00:00Z
Denbighshire County Council,Local Government,S.1313,NA
Denehurst Park (Rochdale) Ltd,Local Government,S.1313,NA
Dennetts Housing Co-operative Limited,Public Non-Financial Corporation,S.11001,1996-07-24T00:00:00Z
Dental Practice Board,Former Central Government,S.1311,NA
Dental Rates Study Group,Former Central Government,S.1311,NA
Dental Vocational Training Authority,Former Central Government,S.1311,NA
"Department for Business, Energy and Industrial Strategy",Central Government,S.1311,2016-07-14T00:00:00Z
"Department for Business, Enterprise & Regulatory Reform (BERR)",Former Central Government,S.1311,NA
"Department for Business, Innovation and Skills",Former Central Government,S.1311,2016-07-14T00:00:00Z
"Department for Children, Schools and Families (DCSF)",Former Central Government,S.1311,NA
Department for Communities and Local Government,Central Government,S.1311,NA
Department for Constitutional Affairs (DCA),Former Central Government,S.1311,2007-05-01T00:00:00Z
"Department for Culture, Media & Sport",Central Government,S.1311,NA
Department for Education,Central Government,S.1311,NA
Department for Employment and Learning,Central Government,S.1311,NA
Department for Employment and Skills,Former Central Government,S.1311,NA
"Department for Environment, Food & Rural Affairs",Central Government,S.1311,NA
Department for Exiting the European Union,Central Government,S.1311,2016-07-14T00:00:00Z
"Department for Innovation, Universities & Skills (DIUS)",Former Central Government,S.1311,NA
Department for International Development,Central Government,S.1311,NA
Department for International Trade,Central Government,S.1311,2016-07-14T00:00:00Z
Department for Transport,Central Government,S.1311,NA
"Department for Transport, Local Government and the Regions (DTLR)",Former Central Government,S.1311,NA
Department for Work and Pensions,Central Government,S.1311,NA
Department of Energy and Climate Change (DECC),Former Central Government,S.1311,2016-07-14T00:00:00Z
Department of Health,Central Government,S.1311,NA
Department of Trade and Industry (DTI),Former Central Government,S.1311,NA
Depaul Housing Services,Public Non-Financial Corporation,S.11001,1996-07-24T00:00:00Z
Deptford Housing Co-operative Limited,Public Non-Financial Corporation,S.11001,1996-07-24T00:00:00Z
Derby City Council,Local Government,S.1313,NA
Derby Homes Limited,Public Non-Financial Corporation,S.11001,1996-07-24T00:00:00Z
Derby Homes Ltd,Public Non-Financial Corporation,S.11001,NA
Derbyshire County Council,Local Government,S.1313,NA
Derbyshire Dales District Council,Local Government,S.1313,NA
"Derbyshire, Nottinghamshire, Leicestershire & Rutland Community Rehabilitation Company (CRC)",Former Central Government,S.1311,2015-02-01T00:00:00Z
Derry City and Strabane District Council,Local Government,S.1313,NA
Derventio Housing Trust,Public Non-Financial Corporation,S.11001,1996-07-24T00:00:00Z
Derwen Cymru Ltd,Public Non-Financial Corporation,S.11001,1996-07-24T00:00:00Z
Derwent and Solway Housing Association Limited,Public Non-Financial Corporation,S.11001,1996-07-24T00:00:00Z
Derwent Community Housing Association Limited,Public Non-Financial Corporation,S.11001,1996-07-24T00:00:00Z
Derwent Housing Association Limited,Public Non-Financial Corporation,S.11001,1996-07-24T00:00:00Z
Derwentside Homes,Public Non-Financial Corporation,S.11001,1996-07-24T00:00:00Z
Design Council (incorporating CABE),Former Central Government,S.1311,2011-04-01T00:00:00Z
DEVCO,Public Non-Financial Corporation,S.11001,1996-07-24T00:00:00Z
Developing Initiatives for Support in the Community,Public Non-Financial Corporation,S.11001,NA
Developing Initiatives for Support in the Community,Public Non-Financial Corporation,S.11001,1996-07-24T00:00:00Z
Development Awareness Working Group,Former Central Government,S.1311,2001-04-01T00:00:00Z
Development Board for Rural Wales,Former Public Corporation,S.11001,NA
Development Initiative for Slough Housing,Local Government,S.1313,NA
Devon and Cornwall Housing Limited,Public Non-Financial Corporation,S.11001,1996-07-24T00:00:00Z
Devon County Council,Local Government,S.1313,NA
Devon Waste Management Limited,Former Public Corporation,S.11001,2003-12-01T00:00:00Z
Diamond Light Source Limited,Central Government,S.1311,2002-02-01T00:00:00Z
Diceform Ltd  - (s Remploy Ltd),Former Public Corporation,S.11001,NA
Dimensions (UK) Limited,Public Non-Financial Corporation,S.11001,1996-07-24T00:00:00Z
Dingle Residents Co-operative Limited,Public Non-Financial Corporation,S.11001,1996-07-24T00:00:00Z
Diplomatic Service Appeal Board,Former Central Government,S.1311,2011-03-01T00:00:00Z
Direct Labour Organisations (En Bloc),Local Government,S.1313,NA
Direct Line Group,Former Public Financial Corporation,S.12801,2013-09-01T00:00:00Z
Direct Rail Services Ltd,Public Non-Financial Corporation,S.11001,NA
Direct Service Organisations,Local Government,S.1313,NA
Directly Operated Railways,Central Government,S.1311,NA
Disability Employment Advisory Committee,Former Central Government,S.1311,2008-04-01T00:00:00Z
Disability Living Allowance Advisory Board,Former Central Government,S.1311,2013-02-01T00:00:00Z
Disability Living Allowance Advisory Board for Northern Ireland,Central Government,S.1311,NA
Disability Rights Commission,Former Central Government,S.1311,NA
Disability Rights Task Force,Former Central Government,S.1311,NA
Disabled Peoples Employment Corporation (UK) Ltd,Central Government,S.1311,2015-04-07T00:00:00Z
Disabled Persons Transport Advisory Committee (DPTAC),Central Government,S.1311,NA
Disclosure and Barring Service,Central Government,S.1311,2012-12-01T00:00:00Z
Disposal Services Agency,Former Central Government,S.1311,2007-04-01T00:00:00Z
Distinction and Meritorious Service Awards Committee,Central Government,S.1311,NA
District Councils,Local Government,S.1313,NA
District Homes CIC,Public Non-Financial Corporation,S.11001,1996-07-24T00:00:00Z
DoA Ltd,Former Central Government,S.1311,2012-07-01T00:00:00Z
Docklands Light Railway Ltd (s.TfL),Public Non-Financial Corporation,S.11001,NA
Doctors and Dentists Review Body,Central Government,S.1311,NA
Dolerite Funding No.1 plc,Public Financial Corporation,S.12501,NA
Dolerite Funding No.2 plc,Public Financial Corporation,S.12501,NA
Dolphin Living Limited,Public Non-Financial Corporation,S.11001,1996-07-24T00:00:00Z
Domestic Coal Consumers' Council,Former Central Government,S.1311,NA
Dominican Playgroup,Local Government,S.1313,NA
Donations and Bequests (to government),"CG Funds, Accounts, Courts and Posts",S.1311,NA
Doncaster Metropolitan Borough Council,Local Government,S.1313,NA
Doncaster Young Men's Christian Association,Public Non-Financial Corporation,S.11001,1996-07-24T00:00:00Z
Dorking Charity,Public Non-Financial Corporation,S.11001,1996-07-24T00:00:00Z
Dormer's Hospital Charity,Public Non-Financial Corporation,S.11001,1996-07-24T00:00:00Z
Dorneywood Trust,Central Government,S.1311,NA
Dornoch Aerodrome,Local Government,S.1313,NA
Dorset County Council,Local Government,S.1313,NA
"Dorset, Devon & Cornwall Community Rehabilitation Company (CRC)",Former Central Government,S.1311,2015-02-01T00:00:00Z
Dounreay Site Restoration Limited,Central Government,S.1311,2008-04-01T00:00:00Z
Dover District Council,Local Government,S.1313,NA
Dover Harbour Board,Public Non-Financial Corporation,S.11001,NA
Drainage Council for Northern Ireland,Central Government,S.1311,NA
Drapers' Almshouse Charity (The),Public Non-Financial Corporation,S.11001,1996-07-24T00:00:00Z
Drayton Parochial Charities,Public Non-Financial Corporation,S.11001,1996-07-24T00:00:00Z
Driver & Vehicle Agency (Northern Ireland),Public Non-Financial Corporation,S.11001,NA
Driver and Vehicle Licensing Agency (DVLA),Central Government,S.1311,NA
Driving Standards Agency,Public Non-Financial Corporation,S.11001,NA
Drum Housing Association Limited,Public Non-Financial Corporation,S.11001,1996-07-24T00:00:00Z
Drumchapel Housing Co-operative Ltd,Public Non-Financial Corporation,S.11001,2001-07-18T00:00:00Z
Ducane Housing Association Limited,Public Non-Financial Corporation,S.11001,1996-07-24T00:00:00Z
Duchess of Somerset's Hospital (The),Public Non-Financial Corporation,S.11001,1996-07-24T00:00:00Z
Dudley Metropolitan Borough Council,Local Government,S.1313,NA
Duke of Yorks Military School,Former Central Government,S.1311,2007-04-01T00:00:00Z
Dumfries and Galloway Council,Local Government,S.1313,NA
Dumfries and Galloway Housing,Public Non-Financial Corporation,S.11001,2001-07-18T00:00:00Z
Dumfries and Galloway Regional Council Harbour,Local Government,S.1313,NA
Dunbar Harbour,Former Public Non-Financial Corporation,S.11001,2015-12-02T00:00:00Z
Dunbar Port,Local Government,S.1313,NA
Dunbritton Housing Association Ltd,Public Non-Financial Corporation,S.11001,2001-07-18T00:00:00Z
Dundee Aerodrome,Former Local Government,S.1313,2007-12-01T00:00:00Z
Dundee City Council,Local Government,S.1313,NA
Dunedin Canmore Housing Limited,Public Non-Financial Corporation,S.11001,2001-07-18T00:00:00Z
Dunk's Almshouse Charity,Public Non-Financial Corporation,S.11001,1996-07-24T00:00:00Z
Dunstaffnage Marine Laboratory,Central Government,S.1311,NA
Durham Aged Mineworkers' Homes Association,Public Non-Financial Corporation,S.11001,1996-07-24T00:00:00Z
Durham City Homes Limited,Public Non-Financial Corporation,S.11001,1996-07-24T00:00:00Z
Durham County Council,Local Government,S.1313,NA
Durham Tees Valley Community Rehabilitation Company (CRC),Former Central Government,S.1311,2015-02-01T00:00:00Z
Dyers Company Housing Association Limited,Public Non-Financial Corporation,S.11001,1996-07-24T00:00:00Z
E W King Memorial Homes,Public Non-Financial Corporation,S.11001,1996-07-24T00:00:00Z
Ealing Homes Ltd,Former Public Corporation,S.11001,2012-11-01T00:00:00Z
Earle's Retreat,Public Non-Financial Corporation,S.11001,1996-07-24T00:00:00Z
"Earsdon, Newburn and Shilbottle Almshouse Charity",Public Non-Financial Corporation,S.11001,1996-07-24T00:00:00Z
East Ayrshire Council,Local Government,S.1313,NA
East Boro Housing Trust Limited,Public Non-Financial Corporation,S.11001,1996-07-24T00:00:00Z
East Cambridgeshire District Council,Local Government,S.1313,NA
East Coast Main Line Company Ltd,Former Public Non-Financial Corporation,S.11001,2015-03-01T00:00:00Z
East Devon District Council,Local Government,S.1313,NA
East Dorset District Council,Local Government,S.1313,NA
East Dunbartonshire Council,Local Government,S.1313,NA
East Dunbartonshire Municipal Bank Ltd,Public Financial Corporation,S.12501,NA
East Durham Homes Limited,Public Non-Financial Corporation,S.11001,1996-07-24T00:00:00Z
East Durham Homes Ltd,Public Non-Financial Corporation,S.11001,NA
East End Homes Limited,Public Non-Financial Corporation,S.11001,1996-07-24T00:00:00Z
East Hampshire District Council,Local Government,S.1313,NA
East Hertfordshire District Council,Local Government,S.1313,NA
East Homes Limited,Public Non-Financial Corporation,S.11001,1996-07-24T00:00:00Z
East Kent Housing,Public Non-Financial Corporation,S.11001,2011-04-01T00:00:00Z
East Kilbride and District Housing,Public Non-Financial Corporation,S.11001,2001-07-18T00:00:00Z
East Lancashire Light Railway Trust,Local Government,S.1313,NA
East Lindsey District Council,Local Government,S.1313,NA
East London Waste Authority,Local Government,S.1313,1986-01-01T00:00:00Z
East Lothian Council,Local Government,S.1313,NA
East Lothian Housing Association Ltd,Public Non-Financial Corporation,S.11001,2001-07-18T00:00:00Z
East Midlands Airport (s MA),Public Non-Financial Corporation/Public Non-Financial Corporation (see notes in tab),S.11001/3,2013-02-01T00:00:00Z
East Midlands Airport Nottingham Derby Leicester Ltd,Public Non-Financial Corporation/Public Non-Financial Corporation (see notes in tab),S.11001/3,2013-02-01T00:00:00Z
East Midlands Airport Property Investments (Hotels) Ltd,Public Non-Financial Corporation/Public Non-Financial Corporation (see notes in tab),S.11001/3,2013-02-01T00:00:00Z
East Midlands Airport Property Investments (Industrial) Ltd,Public Non-Financial Corporation/Public Non-Financial Corporation (see notes in tab),S.11001/3,2013-02-01T00:00:00Z
East Midlands Airport Property Investments (Offices) Ltd,Public Non-Financial Corporation/Public Non-Financial Corporation (see notes in tab),S.11001/3,2013-02-01T00:00:00Z
East Midlands Cultural Consortium,Former Central Government,S.1311,2010-09-01T00:00:00Z
East Midlands Development Agency,Former Central Government,S.1311,2012-07-01T00:00:00Z
East Midlands Housing Group,Public Non-Financial Corporation,S.11001,1996-07-24T00:00:00Z
East Midlands International Airport,Former Public Corporation,S.11001,NA
East Midlands Region: Electricity Consumers Committee,Former Central Government,S.1311,NA
East North East Homes Leeds,Public Non-Financial Corporation,S.11001,NA
East Northamptonshire Council,Local Government,S.1313,NA
East of England Development Agency,Former Central Government,S.1311,2012-07-01T00:00:00Z
East of England International Ltd,Former Central Government,S.1311,2012-06-21T00:00:00Z
East of Scotland Water Authority,Former Public Corporation,S.11001,NA
East Renfrewshire Council,Local Government,S.1313,NA
East Riding of Yorkshire Council,Local Government,S.1313,NA
East Staffordshire Borough Council,Local Government,S.1313,NA
East Sussex County Council,Local Government,S.1313,NA
East Thames Group Limited,Public Non-Financial Corporation,S.11001,1996-07-24T00:00:00Z
East Thames Limited,Public Non-Financial Corporation,S.11001,1996-07-24T00:00:00Z
Eastbourne Borough Council,Local Government,S.1313,NA
Eastbourne Buses Ltd,Former Public Corporation,S.11001,2008-12-01T00:00:00Z
Eastbourne Homes Ltd,Public Non-Financial Corporation,S.11001,NA
Eastern Health and Personal Social Services Board,Central Government,S.1311,NA
Eastern Region: Electricity Consumers Committee,Former Central Government,S.1311,NA
Eastern Shires Purchasing Organisation,Public Non-Financial Corporation,S.11001,NA
Easthall Park Housing Cooperative Ltd,Public Non-Financial Corporation,S.11001,2001-07-18T00:00:00Z
Eastlands Homes Partnership Limited,Public Non-Financial Corporation,S.11001,1996-07-24T00:00:00Z
Eastleigh Borough Council,Local Government,S.1313,NA
Easy Housing Association Ltd,Public Non-Financial Corporation,S.11001,1996-07-24T00:00:00Z
Eblex Ltd,Central Government,S.1311,NA
Ebony Sistren Housing Association Limited,Public Non-Financial Corporation,S.11001,1996-07-24T00:00:00Z
Ecco Housing Association Limited,Public Non-Financial Corporation,S.11001,1996-07-24T00:00:00Z
"Economic and Social Research Council, The",Central Government,S.1311,NA
Economic Research Institute of Northern Ireland,Central Government,S.1311,NA
Eday Aerodrome,Local Government,S.1313,NA
Eden District Council,Local Government,S.1313,NA
Eden Housing Association Limited,Public Non-Financial Corporation,S.11001,1996-07-24T00:00:00Z
Edinburgh City Council,Local Government,S.1313,NA
Edinburgh International Conference Centre Ltd,Local Government,S.1313,NA
Edinburgh Tours Ltd,Public Non-Financial Corporation,S.11001,NA
Education Action Fora,Local Government,S.1313,NA
Education Funding Agency,Central Government,S.1311,2012-04-01T00:00:00Z
Education Leeds Ltd,Local Government,S.1313,NA
Education Scotland,Central Government,S.1311,2011-04-01T00:00:00Z
Education Transfer Council (ETC),Former Central Government,S.1311,NA
Edward Henry House Co-operative Limited,Public Non-Financial Corporation,S.11001,1996-07-24T00:00:00Z
Edward Mayes Trust (The),Public Non-Financial Corporation,S.11001,1996-07-24T00:00:00Z
Egerton Housing Association Limited,Public Non-Financial Corporation,S.11001,1996-07-24T00:00:00Z
Eildon Housing Association Ltd,Public Non-Financial Corporation,S.11001,2001-07-18T00:00:00Z
Eileen Trust,"CG Funds, Accounts, Courts and Posts",S.1311,NA
Ekarro Housing Co-operative Limited,Public Non-Financial Corporation,S.11001,1996-07-24T00:00:00Z
Ekaya Housing Association Limited,Public Non-Financial Corporation,S.11001,1996-07-24T00:00:00Z
Elderpark Housing Association Ltd,Public Non-Financial Corporation,S.11001,2001-07-18T00:00:00Z
Eldon Housing Association Limited,Public Non-Financial Corporation,S.11001,1996-07-24T00:00:00Z
Eldonian Community Based Housing Association Ltd,Public Non-Financial Corporation,S.11001,1996-07-24T00:00:00Z
Eleanor Palmer Trust,Public Non-Financial Corporation,S.11001,1996-07-24T00:00:00Z
Electoral Commission,Central Government,S.1311,NA
Electricity Council,Former Central Government,S.1311,NA
Electricity Producers Insurance Co. Ltd,Former Public Corporation,S.11001,NA
Electricity Settlements Company Ltd,Central Government,S.1311,2014-08-01T00:00:00Z
Elim Housing Association Limited,Public Non-Financial Corporation,S.11001,1996-07-24T00:00:00Z
Elizabeth Dowell's Trust,Public Non-Financial Corporation,S.11001,1996-07-24T00:00:00Z
Elizabeth Huggins Cottages Charity,Public Non-Financial Corporation,S.11001,1996-07-24T00:00:00Z
Elles Housing Co-operative Limited,Public Non-Financial Corporation,S.11001,1996-07-24T00:00:00Z
Elmbridge Borough Council,Local Government,S.1313,NA
EMH Housing and Regeneration Limited,Public Non-Financial Corporation,S.11001,1996-07-24T00:00:00Z
Emily Bentley Homes,Public Non-Financial Corporation,S.11001,1996-07-24T00:00:00Z
Emily Brydges Willyams Memorial Houses,Public Non-Financial Corporation,S.11001,1996-07-24T00:00:00Z
Employment Service,Former Central Government,S.1311,2002-04-01T00:00:00Z
Employment Tribunals Service,Former Central Government,S.1311,2006-04-01T00:00:00Z
Empower Housing Association Limited,Public Non-Financial Corporation,S.11001,1996-07-24T00:00:00Z
Empowering People Inspiring Communities Limited,Public Non-Financial Corporation,S.11001,1996-07-24T00:00:00Z
Endeavour Housing Association Limited,Public Non-Financial Corporation,S.11001,1996-07-24T00:00:00Z
Energy Advisory Panel,Former Central Government,S.1311,NA
Energy Sales and Trading Ltd (s. BNFL),Former Public Corporation,S.11001,2007-04-01T00:00:00Z
Enfield Homes Ltd,Public Non-Financial Corporation,S.11001,NA
"Engineering and Physical Sciences Research Council, The",Central Government,S.1311,NA
Engineering Construction Industry Training Board,Central Government,S.1311,NA
England Marketing Advisory Board,Central Government,S.1311,NA
"English Institute for Sport, The",Central Government,S.1311,2002-04-01T00:00:00Z
"English National Board for Nursing, Midwifery and Health Visiting",Former Central Government,S.1311,NA
English Nature,Former Central Government,S.1311,NA
English Partnerships (LP) Limited,Former Central Government,S.1311,NA
English Rural Housing Association Limited,Public Non-Financial Corporation,S.11001,1996-07-24T00:00:00Z
English Tourism Council,Former Central Government,S.1311,NA
ENHAM,Public Non-Financial Corporation,S.11001,1996-07-24T00:00:00Z
Enniskillen Aerodrome,Local Government,S.1313,NA
Enrichment Holdings Limited,Central Government,S.1311,2008-03-01T00:00:00Z
Enrichment Investments Limited,Central Government,S.1311,2009-12-01T00:00:00Z
Enterprise South Devon,Local Government,S.1313,NA
Enterprise Ulster,Former Central Government,S.1311,NA
Environment Agency,Central Government,S.1311,NA
Environment and Heritage Service,Former Central Government,S.1311,2008-07-01T00:00:00Z
Epping Forest District Council,Local Government,S.1313,NA
Epsom and Ewell Borough Council,Local Government,S.1313,NA
Epsom and Ewell Housing Association Limited,Public Non-Financial Corporation,S.11001,1996-07-24T00:00:00Z
Equal Opportunities Commission for Northern Ireland,Former Central Government,S.1311,NA
Equality 2025,Central Government,S.1311,2006-12-01T00:00:00Z
Equality and Human Rights Commission,Central Government,S.1311,NA
Equality Commission for Northern Ireland,Central Government,S.1311,NA
Equity Housing Group Limited,Public Non-Financial Corporation,S.11001,1996-07-24T00:00:00Z
Erewash Borough Council,Local Government,S.1313,NA
Erimus Housing Limited,Public Non-Financial Corporation,S.11001,1996-07-24T00:00:00Z
Essex Community Rehabilitation Company (CRC),Former Central Government,S.1311,2015-02-01T00:00:00Z
Essex County Council,Local Government,S.1313,NA
Estuary Housing Association Limited,Public Non-Financial Corporation,S.11001,1996-07-24T00:00:00Z
Ethnic Minority Business Forum,Former Central Government,S.1311,NA
Euro-Hub (Birmingham),Local Government,S.1313,NA
European Channel Broadcasting Ltd (s BBCW),Public Non-Financial Corporation,S.11001,NA
European Channel Management Ltd (s BBCW),Public Non-Financial Corporation,S.11001,NA
Eurostar (UK) Ltd,Former Public Corporation,S.11001,2010-09-01T00:00:00Z
Eustace Hook and Drummond Memorial Almshouses,Public Non-Financial Corporation,S.11001,1996-07-24T00:00:00Z
Eventide & Watts Charity,Public Non-Financial Corporation,S.11001,1996-07-24T00:00:00Z
Everbrook Housing Co-operative Limited,Public Non-Financial Corporation,S.11001,1996-07-24T00:00:00Z
Evolve Housing + Support,Public Non-Financial Corporation,S.11001,1996-07-24T00:00:00Z
Ewart Road Housing Co-operative Limited,Public Non-Financial Corporation,S.11001,1996-07-24T00:00:00Z
Exaireo Trust Ltd (The),Public Non-Financial Corporation,S.11001,1996-07-24T00:00:00Z
Excel Housing Solutions,Public Non-Financial Corporation,S.11001,1996-07-24T00:00:00Z
Exchange Equalisation Account,"CG Funds, Accounts, Courts and Posts",S.1311,NA
Exeter and Devon Airport Ltd,Former Public Corporation,S.11001,NA
Exeter City Council,Local Government,S.1313,NA
